itemCode,yahooID,itemName,description,amzbulletpoint1,amzbulletpoint2,amzbulletpoint3,amzbulletpoint4,amzbulletpoint5
LMSW99X12,zapotec-rug-9-x-12,Zapotec Rug - 9 x 12,"Give your family room southwestern flair with the Zapotec Rug - 9 x 12, detailed with intricate geometrics in shades of midnight blue, ivory, gray and deep salmon.
<ul><li>100% New Zealand wool and colorfast Swiss chrome dyes</li>
<li>Hand-knotted</li>
<li> 9'W x 12'L</li>
<li>Vacuum regularly without the beater brush; Spot clean with warm soapy water</li>
<li>Midnight blue, ivory, gray and deep salmon</li>
</ul> ~ Ships from the manufacturer. Allow 1 to 2 weeks.",,,,,
KACDV1721,cactus-jewelry-holder,Cactus Jewelry Holder,"This ceramic cactus in a glossy finish will cleverly hold your rings and other jewelry. 3 1/2""W x 3 1/2""D x 4""H",,,,,
KDR9166,bright-skies-southwest-napkin,Bright Skies Southwest Napkin,"Exclusive - Featuring a geometric print in turquoise, red, blue and gold, these 100% cotton linens set a beautiful southwest table. Machine wash. Measures 20""W x 20""L. ~",,,,,
NTZORBSTOL39RX3,zorro-barstool-set-of-3,Zorro Barstool - Set of 3,"Bring classic western style to your decor with the Zorro Barstool. Hand tooled antique brown leather, in a Classico design, is chiseled and carved by leather artisans and accented with nailhead trim. Each leather hide is selected for the best quality and wood is seasoned to age gracefully with a rustic finish. Each measures 17""W x 17""D x 30""H. Sold in a set of three.  ~  Ships from the manufacturer.  Allow 6 to 8 weeks.  Cannot express ship.  This item can be customized. Please email teresa@blackforestdecor.com or call 800-605-0915, ext. 778 to inquire about custom furniture orders and large bulk order discounts. Additional discounts may be available for large bulk orders. ~ Ships from the manufacturer. Allow 6 to 8 weeks. Cannot express ship.",,,,,
DS15062,turquoise-feather-double-switch-plate,Turquoise Feather Double Switch Plate,Bring southwest spirit to your room with these polyresin switch covers embossed with feathers and turquoise stones. 5 1/4”W x  1/2”D x 5 1/2”H,,,,,
DS52407,cast-iron-rust-moose-knob,Cast Iron Rust Moose Knob,"Exclusive - This cast iron hardware brings rustic style to your lodge cabinetry with a detailed moose design in an antiqued natural finish. Screws included. Measures 2""W x 1""D x 2""H. ~",,,,,
VXT0108,cowboy-rider-wall-sconce,Cowboy Rider Wall Sconce,"Exclusive - Backlit by an amber flake glass shade, this sconce with photocell features a metal art riding cowboy in burnished bronze steel.  Uses one 100-watt max bulb.  Measures 8""W x 5""D x 11""H. ~ Allow 1 week.",,,,,
VXOW50518OA,pinecone-cabin-outdoor-wall-sconce,Pinecone Cabin Outdoor Wall Sconce,"Add grace and warmth to your home with the Pinecone Cabin Outdoor Wall Sconce.  Perfect to light up your cabin's exterior, this metal Mission-inspired wall light features metal art pinecones to add incredible style.  Finished in an Old World patina with a rust Scavo glass shade and uses one 60-watt max bulb.  Measures 9""W x 5 1/4""D x 9 1/4""H. ~ Ships from the manufacturer. Allow 1 week. Cannot express ship or ship to Alaska.",,,,,
MUMMRPBR,antler-pool-ball-rack,Antler Pool Ball Rack,"A Black Forest Decor Exclusive - Designed to hold standard size pool balls, the resin Antler Pool Ball Rack is cast from real antlers and carefully finished to add an authentic outdoor touch to your game room.  Measures 16""W x 16¼""D x 3""H. ~",,,,,
2BG82413,boot-blocks-and-feathers-shower-curtain-hooks-set-of-12,Southwestern Feathers Shower Curtain Hooks - Set of 12,"Create effortless style in your western bathroom with the Southwestern Feathers Shower Curtain Hooks - Set of 12, beautifully made with colorful striped feathers. <ul><li>Hand painted carved resin</li> <li>3 3/5""W x 3""D x 7""H each</li> </ul> ~ Ships from the manufacturer. Allow 1 week. Cannot express ship.",,,,,
2DD25654,moose-and-bear-lodge-stoneware-moose-dinner-plate,Moose Lodge Stoneware Dinner Plate,"An earthy red glaze with a moose forest scene makes the Moose and Bear Lodge Stoneware Moose Dinner Plate the perfect complement to cabin meals.  Microwave and dishwasher safe.  Measures 11""Dia. ~",,,,,
PS7126,black-bear-with-cub-by-the-stream-sculpture,Black Bear with Cub by the Stream Sculpture,"Exclusive - A curving branch encircles this detailed polyresin tabletop sculpture of a mother bear and her cub.  Measures 9""W x 1½""D x 7""H. ~",,,,,
UNGMD577,shotgun-shell-toothbrush-holder,Shotgun Shell Toothbrush Holder,Polyresin replicas of shotgun shells and weathered wood. ~,,,,,
COFL1013FRS2158,evergreen-moose-floor-lamp,Evergreen Moose Floor Lamp,"Give your room an outdoorsy update with the Evergreen Moose Floor Lamp. Crafted with a frontier rust finish moose silhouette and pine tree on either side of the pole base, this floor lamp makes a beautiful accent.
<ul><li>Metal</li>
<li>14""Dia. x 62""H</li>
<li>Frontier Rust finish</li>
<li>Uses one 150-watt max bulb</li>
<li>20""Dia. faux calf-skin shade</li>
</ul> ~ Ships from the manufacturer. Allow 3 to 4 weeks. Cannot express ship.",,,,,
LKRA1128,climbing-black-bears-toilet-brush-holder,Climbing Black Bears Toilet Brush Holder,"Curious, climbing black bears embellish this polyresin toilet brush holder for lodge charm. Plastic brush included. 4""Dia. x 7""H",,,,,
DS21451,metal-bear-curtain-rod,Bear Metal Curtain Rod,"A Black Forest Decor Exclusive - Detailed bear accents add rustic appeal to the matte black-finished Metal Bear Curtain Rod and bracket set.  Includes extendable heavy duty rod, two brackets, screws and drywall anchors.  Measures 48-82""W x 5¾""D x 4""H. ~",,,,,
RE622,bear-and-twig-triple-switch-plate-cover,Bear and Twig Triple Switch Plate Cover,"A Black Forest Decor Exclusive - Hand painted with amazing detail, the polyresin Bear and Twig Triple Switch Plate Cover features lounging black bears.  Measures 8""W x 1¼""D x 6½""H. ~",,,,,
HXDI1810SK,black-bear-forest-salt-and-pepper-set,Black Bear Forest Salt & Pepper Set,"Hand-painted black bear scenes and scalloped edges make the terracotta ceramic Black Bear Forest Salt & Pepper Set a welcoming touch in your kitchen.  Dishwasher, oven and microwave safe.  Measures 3"" Dia. x 3¼""H each. ~",,,,,
HXDI1810SP,black-bear-forest-serving-platter,Black Bear Forest Serving Platter,"The hand-painted terracotta ceramic Black Bear Forest Serving Platter features scalloped edges and black bear scenes in gold and green.  Dishwasher, oven and microwave safe.  Measures 17""W x 13""D x 2""H. ~",,,,,
2HMQW2010KGOC,star-ranch-quilt-set-king,Star Ranch Quilt Set - King,"Stars and barbed wire border these 100% cotton quilts, while faux leather accents add to the rugged ranch look. Quilt sets include quilt and two shams (twin has one). Machine wash quilts and shams, dry clean pillows. Dimensions available online. Measures 120""W x 240""L. ~",,,,,
VXVL55702BBZ,montana-vanity-2-light,Montana Vanity Light - 2 Light,"Add grace and warmth to your room with the Montana 2 Light Vanity.  Crafted from metal with a rustic flair, this vanity light features bear and pine tree silhouettes to create defining style.  Finished in burnished bronze with amber flake glass shades and uses two 100-watt max bulbs.  UL listed for damp locations.  Measures 16 1/2""W x 8""D x 14""H. ~ Ships from the manufacturer. Allow 1 week. Cannot express ship or ship to Alaska.",,,,,
VXCC55714BBZ,montana-flush-mount-ceiling-light,Montana Flush Mount Ceiling Light,"The Montana Flush Mount Ceiling Light casts a lovely glow in your home.  This metal ceiling light with bear and pine tree silhouettes has true lodge style.  Finished in burnished bronze with an amber flake glass shade and uses three 60-watt max bulbs.  Measures 14""W x 14""D x 7""H. ~ Ships from the manufacturer. Allow 1 week. Cannot express ship or ship to Alaska.",,,,,
YG30184,yg30184,Moose Welcome Sign,"A Black Forest Decor Exclusive - A friendly forest resident greets your guests in the wooden Moose Welcome Sign with a vintage look.  This regal moose with pine branches makes your home or cabin an inviting place.  Measures 16""W x 3/4""D x 27 3/4""H. ~",,,,,
PK15401,forest-trails-round-placemat,Forest Trails Round Placemat,"This scalloped cotton placemat sets a nature-inspired table with graceful leaves, pinecones and acorns layered with vintage stamps and script. Self backed. Machine wash. 17”Dia.",,,,,
PK21837BLK,large-black-bear-canister,Large Black Bear Canister,"Topped with a metal bear sculpture in a black finish, this round glass canister displays mementos or decorative items. Not food safe. 5”Dia. x 10 1/2”H",,,,,
2PG30SJM7508C18,bears-in-canoe-hooked-pillow,Bears in Canoe Hooked Pillow,"A Black Forest Decor Exclusive - Whimsical bear designs add fun cabin style to the hand-hooked 100% wool pillows with zippered cotton velvet backing. Measures 14""W x 18""L. ~",,,,,
AD0193TUR201,whiskey-river-turquoise-rug-5-x-8,Whiskey River Turquoise Rug - 5 x 8,"A Lone Star Western Decor Exclusive - Rich chocolate brown and oatmeal form the perfect backdrop for red, bright turquoise and sunset gold diamonds on the premium nylon Whiskey River Turquoise 5 x 8 Rug.  Fade and stain resistant.  Made in the USA.  Measures 5'4""W x 7'8""L. ~ Ships from the manufacturer.  Allow 2 weeks.  Cannot express ship.",,,,,
CARJB6411,timber-woods-v-valance,"Timber Woods ""V"" Valance","Exclusive - Enhance your windows with the striped woven poly chenille Timber Woods ""V"" Valance in olive, brown, black and cream with a top ""V"" layer in brown faux leather embellished with an embroidered black bear and fringe.  Dry clean.  Measures 54""W x 18""H. ~",,,,,
DS13224,turquoise-and-silver-scroll-rectangular-tissue-box,Turquoise & Silver Scroll Rectangular Tissue Box,"Exclusive - Add western flair to your bath with the polyresin Turquoise & Silver Scroll Rectangular Tissue Box with a silver and gold metalwork look and faux turquoise stones. Measures 10""W x 5¼""D x 4""H. ~",,,,,
DS21568,spur-curtain-rod-and-rod-holders,Spur Curtain Rod & Rod Holders,"Featuring metal horseshoes and spurs in a rich brown finish with silver accents, the Spur Curtain Rod & Rod Holders give your window treatments a western kick.  Includes two brackets and heavy duty curtain rod that extends from 44"" to 82"" long.  Measures 48""W (min.) x 3 3/4""D x 9""H.  Mounting hardware included. ~",,,,,
DS21977,metal-western-star-mirror,Metal Western Star Mirror,"Exclusive - Three western stars and studs decorate the frame of this rustic metal mirror in an antique brown finish.  Measures 20¼""W x 1¾""D x 29½""H. ~",,,,,
HXTW3003C,hxtw3003c,Running Horse Cream Towel Set (3 pcs),"Made of luxurious 100% cotton with embroidered galloping horses, the Running Horse Cream Towel Set is an invigorating sight at the start of the day.  Set includes one 28"" x 51"" bath towel, one 16"" x 31"" hand towel and one 11"" x 20"" wash towel. ~ Ships from the manufacturer.  Allow 1 to 2 weeks.  Cannot express ship or ship to Alaska or Canada.",,,,,
HXWD8004SOOC,tooled-flower-leather-outlet-cover,Tooled Flower Leather Outlet Cover,"A Lone Star Western Decor Exclusive - With a tooled floral design, topstitching and silver rivets, the resin Tooled Flower Leather Outlet Cover is full of western detail. ~",,,,,
HXWD8006SROC,barnwood-and-leather-single-rocker-plate,Barnwood & Leather Single Rocker Plate,"Exclusive - An aged barnwood design is highlighted by leather-look details, silver studs and rope trim on these rugged resin switch plates. Measures 3¼""W x 5¼""H. ~",,,,,
VXVL55403BBZ,canyon-3-light-vanity,Canyon Vanity Light - 3 Light,"Add grace and warmth to your room with the Canyon 3 Light Vanity.  This lodge vanity light is made from metal and features deer and pine tree silhouettes.  Finished in burnished bronze with amber flake glass shades and uses three 100-watt max bulbs.  UL listed for damp locations.  Measures 24""W x 8""D x 14""H. ~ Ships from the manufacturer. Allow 1 week. Cannot express ship or ship to Alaska.",,,,,
2DD25657,moose-and-bear-lodge-stoneware-moose-bowl,Moose Lodge Stoneware Bowl,"An earthy red glaze with a moose forest scene makes the Moose and Bear Lodge Stoneware Moose Bowl the perfect complement to cabin meals.  Microwave and dishwasher safe.  Measures 6""Dia. x 3""H. ~",,,,,
2HMDI1763,pinewood-forest-dinnerware,Pinewood Forest Dinnerware,"Pines drift into view on this ceramic dinnerware set in soothing natural colors. Includes four 16-oz. mugs, four 5 3/4""Dia. bowls, four 8 1/2""Dia. salad plates and four 10 3/4""Dia. dinner plates.",,,,,
2BG87273,forest-signs-moose-shaped-lotion-dispenser,Forest Signs Moose Lotion Dispenser,"Accent your lodge bathroom with the Forest Signs Moose Shaped Lotion Dispenser.  This lotion dispenser features a cute sitting moose for a fun addition to your home. <ul><li>Resin</li> <li>4 1/4""W x 3""D x 7 1/4""H</li> <li>Multicolor</li> <li>Hand wash or wipe with damp cloth </li> </ul> ~ Ships from the manufacturer. Allow 1 week. Cannot express ship.",,,,,
2SCSB5413C,distressed-ceramic-cross-vase-turquoise,Distressed Ceramic Cross Vase - Turquoise,"Exclusive - Display fresh-cut blooms in these ceramic bottle-style vases embossed with intricate crosses and words of inspiration.  Measures 4¼""W x 4¼""D x 12""H. ~",,,,,
AQW130001,majestic-moose-wood-panel,Majestic Moose Wood Panel,"A Black Forest Decor Exclusive - Printed on knotted wood in warm soothing colors, the Majestic Moose Wood Panel brings rustic beauty to your room.  Measures 23½""W x 1""D x 16""H. ~",,,,,
CL3036STWC474,snowshoe-table-lamp,Snowshoe Table Lamp,"A Black Forest Decor Exclusive - Crafted with genuine snowshoes from Canada, the wood Snowshoe Table Lamp is topped by a laced woodchip shade.  Made in the USA.  Uses one 100-watt max 3-way bulb.  Measures 15""W x 11""D x 30""H. ~ Ships from the manufacturer.  Allow 2 to 3 weeks.  Cannot express ship or ship to Alaska.",,,,,
KE1960W,ke1960w,Moose & Pine Wash Cloth,"A Black Forest Decor Exclusive - Richly embroidered with textured moose and pine trees, the soft 100% cotton Moose & Pine Wash Cloth pampers your cabin guests in shades of nutmeg, chocolate brown and crisp green.  Machine wash.  Measures 13""W x 13""L. ~",,,,,
PD53053XB219,mountain-majesty-hand-towel,Mountain Majesty Hand Towel,"Jacquard-woven in three classic patterns, these 100% cotton towels bring southwest luxury to your bath. Machine wash. 18”W x 30”L",,,,,
VVDSCO7515,rustic-star-table-lamp,Rustic Star Table Lamp,"A Lone Star Western Decor Exclusive - With a burlap shade and a weathered wood finish, the polyresin Rustic Star Table Lamp with circled star embellishment has a vintage look.  Uses one 150-watt max bulb.  Measures 16""W x 12""D x 29""H. ~",,,,,
VXT0219,weathered-patina-lantern-pendant-light,Weathered Patina Lantern Pendant Light,"Exclusive - Bring targeted light and classic Old West style to your home with this steel pendant in a weathered patina finish with clear glass shade. Uses one 100-watt max bulb. UL listed for exterior damp locations. Includes 9' of wire and 2' of chain. Measures 8""W x 8""D x 14¾""H. ~",,,,,
YG17812,bear-metal-hanging-wall-clock,Bear Metal Hanging Wall Clock,"This metal hanging wall-mount clock with bear and tree silhouettes is sure to spark conversation. Uses two AA batteries (not included). 14 1/4""W x 4 1/4""D x 22 3/4""H",,,,,
PK97185,tree-iron-hook,Tree Iron Hook,Update your lodge entryway with these iron hooks in a black finish with metal art silhouettes. ~,,,,,
SIX9345,black-bear-and-log-basket,Black Bear & Log Basket,A Black Forest Decor exclusive - Three black bear cubs play on this hand-painted polyresin basket with a hollowed log look and pinecone accents. For decorative use only. 14”W x 9 1/2”D x 10”H,,,,,
CARJB3042,canyon-shadows-sofa-cover,Canyon Shadows Sofa Cover,"A Black Forest Decor Exclusive - Transform your living room with the poly woven chenille Canyon Shadows Sofa Cover featuring southwest diamond patterns in shades of brown with turquoise, red and rust highlights.  Dry clean.  Measures 74""W x 170""L. ~",,,,,
KE13017A,black-bear-lodge-tumbler,Black Bear Lodge Tumbler,"Featuring a playful black bear, the resin Black Bear Lodge Tumbler adds the perfect rustic detail to your bath.  Measures 4½""W x 4¾""H. ~",,,,,
GL17A,gl17a,Round Cowhide Placemat - 16 Inch,"Create a beautiful western spread with the handcrafted hair-on-cowhide 16 Inch Round Cowhide Placemat with prominent star design and leather laced edges.  Natural cowhide color and pattern may vary.  Measures 16""W. ~",,,,,
LAFORST30WCW,laforst30wcw,Forest Wall Hanging - Large,"Streaks of rust, copper and green from a unique color wash finish create a sunlight effect on towering pines on the Forest Large Wall Hanging.  Designed by Neil Rose, this metal art piece is crafted from laser-cut cold-rolled steel.  Measures 20 1/2""W x 30""H.  Made in the USA. ~ Ships from the manufacturer.  Allow 1 to 2 weeks.  Cannot express ship or ship to Alaska or Canada.",,,,,
DS13297,faux-antler-tray,Faux Antler Tray,"Exclusive - Create a rustic display with this tray featuring two palmated polyresin antlers in a realistic finish. Measures 5¾""W x 3½""D x 3""H. ~",,,,,
2BG50331,pine-cone-diamond-bath-rug,Pinecone Diamond Bath Rug,"Make a statement in your bathroom with the Pine Cone Diamond Bath Rug, adorned with a pinecone and diamond motif in natural gold, sage green and terracotta for a true lodge feel. <ul><li>Heat transfer print on 100% nylon</li> <li>20""W x 33""L</li> <li>Machine washable </li> <li>Made in the USA</li> </ul> ~ Ships from the manufacturer. Allow 1 week. Cannot express ship.",,,,,
2PPHSV12,pine-trees-embroidered-valance,Pine Trees Embroidered Valance,"Exclusive - Intricately embroidered pinecones and pine trees on taupe cotton bring outdoor beauty to these lined rod pocket valances. Machine wash. Measures 58""W x 14""H each. ~",,,,,
VCCVAP1653,canyon-rim-table-lamp,Canyon Rim Table Lamp,"Featuring a drip glaze in turquoise, gold and copper, this ceramic and metal table lamp with a mocha silk shade offers an elegant western look. Uses one 3-way 150-watt max bulb. 32 1/2”H",,,,,
DS62024,desert-run-southwestern-placemats-set-of-4,Desert Run Southwestern Placemats (Set of 4),"Exclusive - Galloping horse silhouettes add spirit to stripes and geometrics in a southwest palette of cream, indigo, coral and gray on these polyester linens. Table runner features faux suede and fringe trim. Machine wash. Measures 14""W x 19""L each. ~",,,,,
LKRA1131,twisted-timber-black-bears-cross,Twisted Timber Black Bears Cross,"Two black bears climb among intertwined tree branches on this rustic, polyresin wall cross. 9""W x 1 1/2""D x 16""H",,,,,
LKRA4668,antler-double-switch-plate,Antler Double Switch Plate,"The resin faux Antler Double Switch Plate completes your rustic rooms.  Hardware included.  Measures 5½""W x 1""D x 6""H. ~",,,,,
LKRA4668,antler-double-switch-plate,Antler Double Switch Plate,"The resin faux Antler Double Switch Plate completes your rustic rooms.  Hardware included.  Measures 5½""W x 1""D x 6""H. ~",,,,,
LKRA8933,turquoise-tooled-leather-lotion-pump,Turquoise Tooled Leather Lotion Pump,"Jeweled silver conchos embellish the durable resin Turquoise Tooled Leather Lotion Pump with silver metal pump.  Measures 3"" Dia. x 7 1/2""H. ~",,,,,
PK11347DM,gingham-plaid-moose-valance,Gingham Plaid Moose Valance,"Add rustic appeal to windows with this gingham plaid cotton valance with moose silhouette patches. Dry clean. 60""W x 14""H",,,,,
CARJB2068,canyon-shadows-bed-set-queen,Canyon Shadows Bed Set - Queen,"A Black Forest Decor Exclusive - A dazzling diamond design is woven in red, coral, turquoise and chocolate on the southwestern Canyon Shadows Queen Bed Set with two-tone brown microsuede, antique brass rivets and faux leather fringe for rugged appeal.  Bed sets include 88""W x 94""L comforter, 60""W x 80""L x 15""H bedskirt, two 20""W x 27""L standard shams and 9""W x 20""L fringed neckroll.  Additional pillows sold separately.  Dry clean. ~",,,,,
CARJB2074,canyon-shadows-valance,"Canyon Shadows ""V"" Valance","A Black Forest Decor Exclusive - A dazzling diamond design is woven in red, coral, turquoise and chocolate on a fabric ""V"" overlay on the southwestern Canyon Shadows ""V"" valance with chocolate microsuede and faux leather fringe for rugged appeal.  Dry clean.  Measures 54""W x 15""H with 3"" rod pocket. ~",,,,,
CARJB4057,highlands-cabin-bed-set-king,Highlands Cabin Bed Set - King,"A Black Forest Decor Exclusive - Create a classic cabin look with the Highlands Cabin King Bed Set featuring woven red plaid complemented by embroidered tan chenille, riveted faux leather and olive and chocolate microfiber suede.  Bed sets include 110""W x 96""L comforter, 76""W x 80""L x 15""H bedskirt, two 20""W x 37""L king shams and one 9""Dia. x 20""L neckroll.  Dry clean. ~",,,,,
CARJB4114,western-paisley-beaumont-alternate-euro-sham,Western Paisley Beaumont Alternate Euro Sham,"A Black Forest Decor Exclusive - Rich brown, caramel and tan paisley woven chenille with a microfiber welt gives the Western Paisley Beaumont Alternate Euro Sham a sophisticated look.  Zipper closure.  Dry clean.  Measures 27""W x 27""L. ~",,,,,
HXWD2011,mission-trail-wall-cross,Mission Trail Wall Cross,"A Lone Star Western Decor Exclusive - A wood cross in a distressed and stained cream finish is layered with turquoise resin tooled leather and a cast iron scroll cross with rhinestones to create the gorgeous Mission Trail Wall Cross.  Measures 14""W x 22""H. ~",,,,,
KE13013E,rather-be-fishing-tissue-box,Rather Be Fishing Tissue Box,"Emblems of fishing life and vintage lodge signs turn your bath into a rustic getaway.  Resin bath accessories and 100% cotton ivory towels.  Measures 7""W x 7""D x 7¼""H. ~",,,,,
HXBW3190CH,barbed-wire-bath-runner-tan,Barbed Wire Tan Bath Runner,"Bold black barbed wire gives these polyester rugs a rugged look.  Non-skid rubber back.  Machine washable.  Measures 24""W x 60""L each. ~",,,,,
HXDI4001SK01TQ,savannah-turquoise-salt-and-pepper-shakers,Savannah Turquoise Salt & Pepper Shakers,"Textured in floral tooled leather patterns, these handcrafted turquoise stoneware pieces bring western detail to your kitchen.  Microwave, oven and dishwasher safe.  Measures 2¼""W x 2¼""D x 3½""H. ~",,,,,
KM07102600144DU,ducks-unlimited-plaid-light-square-pillow,Ducks Unlimited Plaid Light Square Pillow,"Cotton/poly blend with Ducks Unlimited logo. Machine wash cold, tumble dry low. ~",,,,,
ERPP1161336RTT,forest-pines-braided-table-runner,Forest Pines Braided Table Runner,"Exclusive - Elegant pine trees add natural beauty to these table linens, woven in 100% natural jute for a cozy, traditional look. Spot clean with cold water. Measures 13""W x 36""L. ~",,,,,
ERSTOP01,southwestern-jute-stair-tread,Southwestern Jute Stair Tread,Add color and style to your stairs with these braided 100% jute treads with hand-printed western designs. Rug pad recommended. 8 1/4”W x 27”L each,,,,,
KM07170000012BC,bone-collector-sheet-set-queen,Bone Collector Sheet Set - Queen,"Showcase your love of hunting and outdoor culture with the Bone Collector Queen Sheet Set, made from a 55% cotton/45% poly percale.  This set features a scattered skull logo and Michael Waddell signature in brown and khaki on warm tan.  Set includes flat sheet, fitted sheet and two engineered 21""W x 26""L standard pillow cases.  Machine wash. ~ Ships from the manufacturer.  Allow 1 to 2 weeks.  Cannot express ship or ship to Alaska or Canada.",,,,,
WRWD24590,yellowstone-ii-throw,Yellowstone II Throw,"Make a statement in your bedroom with the Yellowstone II Throw, adorned with stunning Native American-inspired geometrics in turquoise, red, and shades of brown for a true tribal feel. <ul><li>Acrylic/poly/wool blend</li> <li>Yellowstone fabric</li> <li>60""W x 72""L</li> <li>Blanket stitch on outside edge</li> <li>Made in the USA</li> </ul> ~ Ships from the manufacturer. Allow 3 to 5 weeks. Cannot express ship.",,,,,
DS13339,elk-antler-bowl,Elk Antler Bowl,"Bring the wild into your style with this elegant decorative bowl featuring polyresin antlers. 13 1/5""W x 13 1/5""D x 5 1/5""H",,,,,
DS15110,oval-antler-mirror,Oval Antler Mirror,"Make a statement on your walls with this oval wall mirror framed with interlocking resin antlers.  20""W x 3 1/4""D x 26""H",,,,,
DS22243,pine-tree-metal-curtain-tiebacks,Pine Tree Metal Curtain Tie Backs,"Detailed pine tree accents add rustic appeal to this wrought iron window hardware. Set of two. Mounting hardware included. 9""W x 4 1/2""D x 5 1/4""H",,,,,
LKRA1126,climbing-black-bears-bath-set-set-of-4,Climbing Black Bears Bath Set - Set of 4,"Curious, climbing black bears embellish this polyresin accessories for lodge charm. Set includes lotion pump, tumbler, soap dish and toothbrush holder.",,,,,
NTZORBSTOL39RX2,zorro-barstool-set-of-2,Zorro Barstool - Set of 2,"Bring classic western style to your decor with the Zorro Barstool. Hand tooled antique brown leather, in a Classico design, is chiseled and carved by leather artisans and accented with nailhead trim. Each leather hide is selected for the best quality and wood is seasoned to age gracefully with a rustic finish. Each measures 17""W x 17""D x 30""H. Sold in a set of two.  ~  Ships from the manufacturer.  Allow 6 to 8 weeks.  Cannot express ship.  This item can be customized. Please email teresa@blackforestdecor.com or call 800-605-0915, ext. 778 to inquire about custom furniture orders and large bulk order discounts. Additional discounts may be available for large bulk orders. ~ Ships from the manufacturer. Allow 6 to 8 weeks. Cannot express ship.",,,,,
