itemCode,yahooID,itemName,description,amzbulletpoint1,amzbulletpoint2,amzbulletpoint3,amzbulletpoint4,amzbulletpoint5
SSLWHSBE,brindle-horseshoe-and-star-toilet-seat-elongated,Brindle Horseshoe & Star Toilet Seat - Elongated,"A Lone Star Western Decor Exclusive - A black and gold cast iron star and horseshoe adorn genuine brindle cowhide with brass nailhead trim on the wood Brindle Horseshoe & Star Elongated Toilet Seat.  Installation hardware included.  Cowhide color and pattern may vary.  Handmade in the USA.  Measures 15""W x 18""D x 3""H. ~",,,,,
YG16403,moose-weathered-wood-sign,Moose Weathered Wood Sign,"Exclusive - Printed in weathered white, this wood sign with a planked look perfectly expresses your outdoor spirit. Measures 8""W x ¾""D x 18¾""H. ~",,,,,
KE1772BRB,ke1772brb,Mojave Brick Bath Towel,A Lone Star Western Decor Exclusive - Vibrant brick red 100% cotton makes the perfect backdrop for poly/cotton southwest designs and blanket stitched trim in chocolate brown and sand on the luxuriously soft Mojave Brick Bath Towel.  Machine washable.  Measures 25”W x 50”H.  ~,,,,,
LMSW98X10,zapotec-rug-8-x-10,Zapotec Rug - 8 x 10,"With intricate geometrics in shades of midnight blue, ivory, gray and deep salmon, the Zapotec Rug - 8 x 10 completes your southwestern home.
<ul><li>100% New Zealand wool and colorfast Swiss chrome dyes</li>
<li>Hand-knotted</li>
<li> 8'W x 10'L</li>
<li>Vacuum regularly without the beater brush; Spot clean with warm soapy water</li>
<li>Midnight blue, ivory, gray and deep salmon</li>
</ul> ~ Ships from the manufacturer. Allow 1 to 2 weeks.",,,,,
RE565,pinecone-outlet-cover,Pinecone Outlet Cover,"Raised, realistic pine boughs and bark textures give these hand-painted polyresin switch covers woodland style.  Measures 4""W x ½""D x 5½""H. ~",,,,,
2CRJB6764,distressed-faux-leather-bedskirt-king,Distressed Faux Leather Bedskirt - King,"Add a rustic feel to your bed with this rugged brown faux leather bedskirt. Flat front with split corners. Machine wash. 78""W x 80""L x 15""H Add a rustic feel to your bed with this rugged brown faux leather bedskirt. Flat front with split corners. Machine wash. 78""W x 80""L x 15""H",,,,,
2CRJP503,mountain-wildlife-plush-valance,Mountain Wildlife Plush Valance,"Exclusive - Add classic cabin style to your windows with this poly plush rod pocket valance featuring a moose family and lodge geometrics in red, brown, tan, gold and black. Machine wash. Measures 84""W x 15""H. ~",,,,,
3RH844353843224,bellevue-layers-rug-3-x-5,Bellevue Layers Rug - 3 x 5,"Decorate your entryway in style with the southwestern Bellevue Layers Rug - 3 x 5, embellished with a rugged tan and gray design. <ul><li>100% heat-set polypropylene with jute backing</li> <li>Serged in a matching color</li> <li>3'3""W x 5'3""L</li> <li>Professional cleaning recommended; Do not use beater bar when vacuuming</li> <li>Tan and gray</li> <li>Use of a rug pad is recommended</li> </ul> ~ Ships from the manufacturer. Allow 1 week. Cannot express ship.",,,,,
2LHLCQCF,highland-hills-lodge-comforter-queen,Highland Hills Lodge Comforter - Queen,"Relax the rustic way with this comforter, digitally printed for vibrant color and detail. 100% cotton outer shell with polyester fill. Machine wash. 92""W x 96""L",,,,,
AD0094MUL234,ad0094mul234,Santa Fe Spirit Rug - 3 x 4,"A Black Forest Decor Exclusive - Bold southwest stripes in warm red, yellow ochre and black have a Native American diamond pattern overlay on the premium nylon Santa Fe Spirit 3 x 4 Rug with durable serged edges.  Fade and stain resistant.  Made in the USA.  Measures 2'8""W x 3'11""L. ~ Ships from the manufacturer.  Allow 2 weeks.  Cannot express ship or ship to Alaska or Canada.",,,,,
CARJB6130,yukon-river-bear-and-moose-rambling-bear-pillow,Yukon River Rambling Bear Pillow,"Transform your bedroom with this luxurious woven chenille bedding in browns, red, black, tan and forest green with wildlife, canoes and leaves accented by faux leather, gimp trim and wooden buttons.  Bed sets include comforter, bedskirt, two shams and neckroll.  Dry clean. ~",,,,,
CARJB6412,canyon-shadows-diamond-valance,Canyon Shadows Diamond Valance,"Exclusive - Bring a fresh new look to your windows with woven poly chenille with delicate diamonds in shades of brown, orange, turquoise and red. Dry clean.  Measures 54""W x 18""H. ~",,,,,
HXBC2010OSTQ,turquoise-scrolls-and-stars-contour-rug,Turquoise Scrolls & Stars Contour Rug,"Give your bathroom western flair with the Turquoise Scrolls & Stars Contour Rug, detailed with brown and tan scrolls and stars on turquoise. <ul><li>Acrylic</li> <li>24""W x 20""L</li> <li>Spot clean only</li> </ul> ~ Ships from the manufacturer. Allow 1 to 2 weeks. Cannot express ship.",,,,,
2LHWTTLQCF,lake-lifestyle-comforter-queen,Lake Lifestyle Comforter - Queen,"Digitally printed with fishing icons and phrases, this cotton bedding captures lake living. Poly-fill. Machine wash. 92""W x 96""L",,,,,
CARJB1781,alpine-bear-bed-set-queen,Alpine Bear Bed Set - Queen,"A Black Forest Decor Exclusive - Bear and pine tree appliqués, antique gold rivets and fringe add a rustic touch to the appealing olive green, faded blue and chocolate plaid microsuede Alpine Bear Queen Bed Set.  Includes 92""W x 96""L comforter, 60""W x 80""L x 15""H bedskirt, two 20""W x 27""L standard shams and one 14""W x 26""L accent pillow.  Dry clean. ~",,,,,
DS21450,cross-tiebacks,Cross Tiebacks,"Dark brown metal western icons keep your curtains in place.  Mounting hardware included.  Sold in pairs.  Measures 8½""W x 4½""D x 5¾""H. ~",,,,,
ERSCP81,pinecone-half-round-braided-rug,Pinecone Half-Round Braided Rug,"Braided in 100% natural jute in burgundy, black and sage, this half-round rug is hand-stenciled with graceful pinecones and needles. ~",,,,,
LKRA9709,antler-towel-rack,Antler Towel Rack,"A Black Forest Decor Exclusive - With a realistic antler look, the sturdy polyresin Antler Towel Rack holds bath towels or dish cloths.  Measures 21""W x 7½""D x 5""H. ~",,,,,
LKRA9709,antler-towel-rack,Antler Towel Rack,"A Black Forest Decor Exclusive - With a realistic antler look, the sturdy polyresin Antler Towel Rack holds bath towels or dish cloths.  Measures 21""W x 7½""D x 5""H. ~",,,,,
WW5386498005,black-bear-stained-glass-wall-art,Black Bear Stained Glass Wall Art,"Charming black bear artwork is printed with fade-resistant inks on glass to create the unique Black Bear Stained Glass Wall Art framed in black moulding.  Includes hanging chain.  Printed and assembled in the USA.  Measures 14""W x 20""H. ~ Ships from the manufacturer.  Allow 1 week.  Cannot express ship.",,,,,
WW4084003003,misty-forest-folding-storage-bin,Misty Forest Folding Storage Bin,Keep cabin essentials organized with this non-woven canvas and cardboard bin with top-stitched faux leather handles. Folds flat for easy storage. 12 3/4”W x 12 3/4”D x 15”H,,,,,
RH12056,sun-dance-table-runner,Sun Dance Table Runner,"Southwest-style geometrics and horizontal stripes merge in a colorful palette on this cotton-poly table runner. Machine wash. 13""W x 72""L",,,,,
RH15603,mojave-sun-jacquard-towel,Mojave Sun Jacquard Towel,"Exclusive - Bring a cheerful look to your kitchen with these cotton/poly tapestry accessories featuring southwest designs in turquoise, red, orange and brown.  Machine wash. Measures 16""W x 28""L. ~",,,,,
SIX1530,bear-wilderness-metal-wall-art,Bear Wilderness Metal Wall Art,"Exclusive - Bring wild outdoor beauty to your walls with the laser-cut bear head Bear Wilderness Metal Wall Art in a rust and green finish.  Measures 25""W x 1/16""D x 24""H. ~",,,,,
NTZORCSTOL39RX2,zorro-counter-stool-set-of-2,Zorro Counter Stool - Set of 2,"Bring classic western style to your decor with the Zorro Counter Stool. Hand tooled antique brown leather, in a Classico design, is chiseled and carved by leather artisans and accented with nailhead trim. Each leather hide is selected for the best quality and wood is seasoned to age gracefully with a rustic finish. Each measures 17""W x 17""D x 26""H. Sold in a set of two.  ~  Ships from the manufacturer.  Allow 6 to 8 weeks.  Cannot express ship.  This item can be customized. Please email teresa@blackforestdecor.com or call 800-605-0915, ext. 778 to inquire about custom furniture orders and large bulk order discounts. Additional discounts may be available for large bulk orders. ~ Ships from the manufacturer. Allow 6 to 8 weeks. Cannot express ship.",,,,,
2CRJP576,buffalo-plaid-plush-valance,Buffalo Plaid Plush Valance,"Create a comfy lodge look with this polyester plush rod pocket valance. Machine wash. 80""W x 15""H",,,,,
HXTW3190M,hxtw3190m,Barbwire Mocha Towel Set (3 pcs),"Barbed wire embroidery, 100% cotton luxury and elegant color make the Barbwire Mocha Towel Set perfect for even the most discriminating western decorator. Set includes one 28"" x 51"" bath towel, one 16"" x 31"" hand towel, and one 11"" x 20"" wash cloth.  ~ Allow 1 to 2 weeks.  Ships from the manufacturer.  Cannot express ship or ship to Alaska or Canada.",,,,,
HXWD8000SOOC,lone-star-leather-outlet-cover,Lone Star Leather Outlet Cover,A Lone Star Western Decor Exclusive - Update your western decor with the leather-look resin Lone Star Leather Outlet Cover with topstitching and circled silver star. ~,,,,,
DBDBF0609,rustic-tree-bark-floor-standing-fan,Rustic Tree Bark Floor Standing Fan,"Bring a gentle breeze to your rustic home with these deep brown metal, oscillating fans with a realistic polyresin fir bark base and neck.  3-speed, 45-watt motor  Measures 16""W x 55""H. ~ Ships from the manufacturer.  Allow 1 week.  Cannot express ship or ship to Alaska.",,,,,
DBLED4398,deer-led-candle,Deer LED Candle,"A flickering LED light glows behind wildlilfe silhouettes on these twine-wrapped, flameless wax candles with a 5-hour timer.  Uses three AAA batteries (not included). ~",,,,,
CARJB6227,yukon-river-bear-and-moose-bamboo-button-pillow,Yukon River Bamboo Button Pillow,"Transform your bedroom with this luxurious woven chenille bedding in browns, red, black, tan and forest green with wildlife, canoes and leaves accented by faux leather, gimp trim and wooden buttons.  Bed sets include comforter, bedskirt, two shams and neckroll.  Dry clean. ~",,,,,
ER043MBP2,moose--bear-and-pinecone-braided-coasters-set-of-6,"Moose, Bear & Pinecone Braided Coasters (Set of 6)","Braided from 100% natural jute, this set of six printed coasters includes two bear, two moose and two pinecone designs.  Measures 5""Dia. each. ~",,,,,
KE13013B,rather-be-fishing-toothbrush-holder,Rather Be Fishing Toothbrush Holder,"Emblems of fishing life and vintage lodge signs turn your bath into a rustic getaway.  Resin bath accessories and 100% cotton ivory towels.  Measures 5""W x 5""D x 4""H. ~",,,,,
RH16503,mojave-sun-pot-holder,Mojave Sun Pot Holder,"A Lone Star Western Decor Exclusive - Bring a cheerful look to your kitchen with the cotton/poly tapestry Mojave Sun Pot Holder featuring southwest designs in turquoise, red, orange and brown.  Machine wash.  Measures 7""W x 9""L. ~",,,,,
KAPH1000,kaph1000,Twig Placemat,"Invite a bit of nature to your next dinner party with the beautiful, natural Twig Placemat that looks great in a number of settings.  Wipe with a damp cloth, and roll up for easy storage.  Sold individually.  Measures 18 1/2""W x 13""D x  1/4""H each. ~",,,,,
PK68047,black-bear-buffalo-check-valance,Black Bear Buffalo Check Valance,Give windows a lodge update with this cotton valance in red buffalo check plaid with black bear appliques.  Dry clean. ~,,,,,
MW83BFGCKOKC,southwest-expressions-tapestry-coverlet-king,Southwest Expressions Tapestry Coverlet - King,"Exclusive - Woven with a classic kilim design in a vintage palette of blues, reds and greens, this cotton/poly collection creates an inviting southwest space. Dry clean, machine wash coverlets and sham. Dimensions available online. Measures 106""W x 90""L. ~",,,,,
MW83BFGCKSWH,southwest-at-heart-tapestry-coverlet-king,Southwest at Heart Tapestry Coverlet - King,"Exclusive - Vibrant turquoise, red, gold and rust folk-art designs wind around this cotton and cotton/poly tapestry bedding for a fun southwest look. Machine wash, dry clean bedskirt and pillows. Measures 106""W x 90""L. ~",,,,,
CARJB61025,sonoran-sky-bed-set-king,Sonoran Sky Bed Set - King,"A Lone Star Western Decor Exclusive - Inspired by the desert sunset, the woven chenille Sonoran Sky King Bed Set in vivid red, orange, turquoise and cream is accented with brown faux leather, beading, fringe, embroidery and genuine turquoise stones.  Bed set includes 110""W x 96""L comforter, 76""W x 80""L x 15""H bedskirt, two 20""W x 37""L king shams and 14"" x 26"" accent pillow.  Dry clean. ~",,,,,
CBK126757,wood-decorative-canoe-paddles-set-of-3,Wood Decorative Canoe Paddles (Set of 3),"A Black Forest Decor Exclusive - Painted in three colorful geometric patterns, the set of decorative wood paddles brings adventurous spirit to your lodge. Measures 4¾""W x 1""D x 47¼""H each. ~",,,,,
BN63691370,smoky-mountain-tapestry-valance,Smoky Mountain Tapestry Valance,These tailored valances weave together classic lodge motifs to dress up your cabin windows.  Pattern placement will vary.  Vacuum or dry clean.  Handmade in the USA of imported materials. ~,,,,,
AS6580,young-buck-canvas-wall-art,Young Buck Canvas Wall Art,"Add style to your walls with the Young Buck Canvas Wall Art, designed with a modern buck image on gallery wrapped canvas with black edges to complement your cabin décor.<ul><li>Canvas and wood</li> <li>25""W x 25""H</li> <li>Hanging hardware included</li> <li>Gallery wrapped canvas with black edges</li> <li>Made in the USA</li> </ul> ~ Ships from the manufacturer. Allow 2 to 3 weeks. Cannot express ship.",,,,,
DS10865,black-bear-reading-story-table-lamp,Black Bear Reading Story Table Lamp,"A bear cub looks over his mama's shoulder as she reads a book on this delightful polyresin table lamp. Uses one 40-watt max bulb.  14""W x 14""D x 23""H",,,,,
CF-WLBEADVTW,beadfltwbl,Bear Adventure Fleece Blanket - Twin,"Made from plush, super-soft acrylic, the Bear Adventure Fleece Twin Blanket makes any bedroom feel like a rustic cabin getaway. Machine washable. Measures 60"" x 80"". ~",,,,,
DS13634,pinecone-single-hook,Pinecone Single Hook,"Add organization and nature-inspired style to your room with this polyresin and metal hook. 4 1/3""W x 1 3/4""D x 8""H",,,,,
HXLD8200DROC,antler-double-rocker-plate,Antler Double Rocker Plate,"A Black Forest Decor Exclusive - The resin faux Antler Double Rocker Plate completes your rustic rooms.  Hardware included.  Measures 5""W x 1""D x 5½""H. ~",,,,,
2LHRODEO74SC,cowboy-caravan-shower-curtain,Cowboy Caravan Shower Curtain,"This sophisticated western design features a paisley bandana pattern, cowboy imagery, and rustic stars.
<ul><li>Polyester</li>
<li>Liner not included, but strongly recommended</li>
<li>71""W x 72""L</li>
<li>Machine wash</li>
<li>12 button holes for hook placement; Hooks not included</li>
<li>Made to order in the USA</li>
</ul> ~ Ships from the manufacturer. Allow 1 to 2 weeks. Cannot express ship.",,,,,
2CRJB6761,turquoise-earth-bed-set-king,Turquoise Earth Bed Set - King,"Warm up your western lodge with this wool-blend bedding in a classic southwest pattern. Includes 110""W x 96""L blanket and two shams. Machine wash. Warm up your western lodge with this wool-blend bedding in a classic southwest pattern. Includes 110""W x 96""L blanket and two shams. Machine wash.",,,,,
HXBW3190RED,barbed-wire-bath-rug-red,Barbed Wire Red Bath Rug,"Bold black barbed wire gives these polyester rugs a rugged look.  Non-skid rubber back.  Machine washable.  Measures 24""W x 36""L. ~",,,,,
MW83BFGCQOKC,southwest-expressions-tapestry-coverlet-queen,Southwest Expressions Tapestry Coverlet - Queen,"Exclusive - Woven with a classic kilim design in a vintage palette of blues, reds and greens, this cotton/poly collection creates an inviting southwest space. Dry clean, machine wash coverlets and sham. Dimensions available online. Measures 90""W x 90""L. ~",,,,,
SIX9311,climbing-bears-single-switch-plate,Climbing Bears Single Switch Plate,"A Black Forest Decor Exclusive - Black bear cubs explore forest scenery on the hand-painted polyresin Climbing Bears Single Switch Plate with a wood grain texture.  Measures 3¼""W x 6¾""H. ~",,,,,
LKRA4395,turquoise-tooled-leather-outlet-cover,Turquoise Tooled Leather Outlet Cover,"A Lone Star Western Decor Exclusive - Classic rose tooled leather patterns with a distressed turquoise finish are re-created in resin on the Turquoise Tooled Leather Outlet Cover.  Measures 3½""W x ½""D x 5¼""H. ~",,,,,
KACXX2282,cast-iron-cactus-wall-hook,Cast Iron Cactus Wall Hook,"Exclusive - Add storage to your entry or bath with the whimsical Cast Iron Cactus Wall Hook with two hooks in a rust finish. Sold individually. Measures 5½""W x 2""D x 4¾""H. ~",,,,,
KE13013A,rather-be-fishing-tumbler,Rather Be Fishing Tumbler,"Emblems of fishing life and vintage lodge signs turn your bath into a rustic getaway.  Resin bath accessories and 100% cotton ivory towels.  Measures 4½""W x 4½""D x 4¾""H. ~",,,,,
COBRH36CFR,western-star-horseshoe-boot-rack,Western Star Horseshoe Boot Rack,"Exclusive - A row of horseshoes holds two pairs of boots on this steel boot rack in a frontier rust finish with circled stars on the ends. Measures 24""W x 9""D x 9½""H. ~",,,,,
ALTBWCH2CLA005T,altbwch2cla005t,Tequila Barrel Wall Candle Holder,"A Lone Star Western Decor Exclusive - The Tequila Barrel Wall Candle Holder is crafted from reclaimed genuine tequila barrel wood and iron.  Sold individually.  Includes one 3"" ball candle.  Size may vary slightly.  Measures 4""W x 7""D x 12""H. ~ Ships from the manufacturer.  Allow 3 to 4 weeks.  Cannot express ship or ship to Alaska or Canada.",,,,,
CFTWLSUNSET,sedona-oversized-towel,Sedona Oversized Towel,"In a colorful southwest geometric design, the 100% cotton Sedona Oversized Towel brings western luxury to your bath. Machine wash. Measures 34""W x 64""L. ~",,,,,
DS12715,bear-on-tree-wall-shelf,Bear on Tree Wall Shelf,"A Black Forest Decor Exclusive - Two bear cubs climbing on polyresin branches support the wood Bear on Tree Wall Shelf perfect for displaying mementos.  Measures 22¾""W x 7¾""D x 14""H. ~",,,,,
DS13269,southwest-jar-salt-and-pepper-shaker-set,Southwest Jar Salt & Pepper Shaker Set,"Exclusive - Two aged southwestern pots with kokopelli, cross and feather embellishments contain glass salt and pepper shakers on this polyresin holder with a faux wood base. Measures 6""W x 3¼""D x 5""H. ~",,,,,
DLART2110,flying-eagle-wood-carving-wall-art,Flying Eagle Wood Carving Wall Art,"A Black Forest Decor Exclusive - A majestic bald eagle takes flight in the hand carved and handpainted solid wood Flying Eagle Wood Carving Wall Art with a lacquer finish.  Measures 32""W x ¾""D x 12""H. ~",,,,,
2PG30HRS736C18O,lets-get-toasted-hooked-pillow,Let's Get Toasted Hooked Pillow,"A Black Forest Decor Exclusive - Whimsical bear designs add fun cabin style to the hand-hooked 100% wool pillows with zippered cotton velvet backing. Measures 14""W x 18""L. ~",,,,,
2VX736425561825,red-river-southwestern-rust-boudoir-pillow,Red River Southwestern Rust Boudoir Pillow - CLEARANCE,"Native American-inspired designs in earthy shades of rust, turquoise, black and tan bordered by solid rust and brass conchos give the poly Red River Southwestern Rust Boudoir Pillow with cotton backing a serene look. Dry clean. Measures 14""W x 20""L. ~",,,,,
HXDI4001CS01TQ,savannah-turquoise-canister-set,Savannah Turquoise Canister Set - 3 pcs,"Tooled leather patterns in vibrant turquoise give this handcrafted stoneware kitchenware vintage western charm.  Microwave, oven and dishwasher safe.  Measures Small: 6""W x 6""D x 7?""H; Medium: 6""W x 6""D x 8?""H; Large: 6""W x 6""D x 9""H. ~",,,,,
LROWE03INSG2680,zigzag-diamonds-rug-3-x-8,Zigzag Diamonds Rug - 3 x 8,"The Zigzag Diamonds Rug - 3 x 8 offers lots of southwestern style with a relaxed, yet refined cream, indigo, sage, and terracotta design with a meticulously hand-knotted texture on a hand-woven base.
<ul><li>Hand woven jute/wool with no backing</li>
<li>2'6""W x 8'L</li>
<li>Spot clean and vacuum carefully without beater bar; professional cleaning recommended.</li>
<li>Multicolor</li>
<li>Long-wearing durability</li>
<li>Rug pad recommended for use on hard floor</li>
</ul> ~ Ships from the manufacturer. Allow 1 week. Cannot express ship.",,,,,
PK47647B,river-falls-bear-lined-valance,River Falls Bear Lined Valance,"Brighten your windows with the 100% cotton River Falls Bear Lined Valance in rustic red, green and tan plaid with charming brown bear patches.  Dry clean.  Measures 60""W x 14""H with 2"" rod pocket. ~",,,,,
PS5086,bear-smart-phone-charger,Bear Smart Phone Charger,"A Black Forest Décor Exclusive - Three mischievous black bears play on a curved log on the detailed polyresin Bear Smart Phone Charger holder with charging slot.  Charger not included.  Measures 6""W x 2¼""D x 3¼""H. ~",,,,,
VXCC55514BBZ,big-sky-flush-mount-ceiling-light,Big Sky Flush Mount Ceiling Light,"The Big Sky Flush Mount Ceiling Light is the perfect lighting accent to your home.  Featuring outdoor-inspired elements, this metal ceiling light features pine tree silhouettes to add incredible style.  Finished in burnished bronze with an amber flake glass shade and uses three 60-watt max bulbs.  Measures 14""W x 14""D x 7""H. ~ Ships from the manufacturer. Allow 1 week. Cannot express ship or ship to Alaska.",,,,,
VCCVAVP093,deer-forest-table-lamp,Deer Forest Table Lamp,"Exclusive - A printed, rust-colored deer forest scene encircles the linen shade of this resin pedestal lamp in a weathered wood finish.  Uses one 3-way 150-watt max bulb.  Measures 15""W x 15""D x 29""H. ~",,,,,
TICA610,pine-tree-branches-swag-wall-hanging,Pine Tree Branches Swag Wall Hanging,"Exclusive - Pine boughs hang in a graceful swag on this three-dimensional handcrafted metal wall art in a handpainted finish.  Ready to hang. Measures Approx. 32""W x 2""D x 13""H. ~",,,,,
NTS12894,nts12894,Antique Copper Twig Flatware Set (5 pcs),"Handcrafted from 18/8 stainless steel, the Antique Copper Twig Flatware Set features unique twig-shaped handles made from an iron alloy with an antique copper finish.  Five piece flatware set is dishwasher safe. ~ Ships from the manufacturer.  Allow 6 to 8 weeks.  Cannot express ship or ship to Alaska or Canada.",,,,,
RH19022,desert-jewel-lined-valance,Desert Jewel Lined Valance,"Add the charm of the southwest to your home with this cotton-poly valance in turquoise, rust, brown and red diamond patterns. Machine wash. 54""W x 15""H",,,,,
VV-CL1769,faantala,Faux Antler Table Lamp,"Four faux antlers intertwine to form the base of this stunning Faux Antler Table Lamp, while a tan faux suede shade tops it off for a truly rustic feeling. Uses 60-watt max bulb. Lamp: 29½"" H; Shade: 7"" x 18"" x 12"".  ~",,,,,
VXCF55618BBZ,timberland-semi-flush-ceiling-light-18-inch,Timberland Semi-Flush Ceiling Light (18 Inch),"The Timberland 18 Inch Semi-Flush Ceiling Light is the perfect lighting accent to your home.  Combining metal moose and pine tree silhouettes with an amber flake glass shade, this hanging light complements your woodland decor.  Finished in burnished bronze and uses three 100-watt max bulbs.  Comes with 6 feet of chain and 9 feet of wire.  Measures 18 1/2""W x 16 1/2""H. ~ Ships from the manufacturer. Allow 1 week. Cannot express ship or ship to Alaska.",,,,,
WGTSLLSE,lakeland-sunset-toilet-seat-elongated,Lakeland Sunset Toilet Seat - Elongated,"Give your bath decor lodge flair with the Lakeland Sunset Elongated Toilet Seat.  Featuring a printed image of two fishermen on the lake at sunset, this toilet seat is made from red oak veneer over a solid wood composite core sealed with a protective glossy acrylic finish and antique brass hinges.  Measures 15""W x 18 1/2""D x 2""H.  Installation hardware included.  Made in the USA. ~ Ships from the manufacturer. Allow 2 to 3 weeks. Cannot express ship.",,,,,
LKRA8815,steer-skull-wall-hanging,Steer Skull Wall Hanging,"A Lone Star Western Decor Exclusive - This reproduction steer skull, made of painted cast resin, adds desert beauty to your wall.  Measures 20""W x 4""D x 12""H. ~",,,,,
LKRA8815,steer-skull-wall-hanging,Steer Skull Wall Hanging,"A Lone Star Western Decor Exclusive - This reproduction steer skull, made of painted cast resin, adds desert beauty to your wall.  Measures 20""W x 4""D x 12""H. ~",,,,,
PK493689,bear-and-moose-stoneware-mixing-bowl-set-3-pcs,Bear & Moose Stoneware Mixing Bowl Set - 3 pcs,"The cream Bear & Moose Stoneware Mixing Bowl Set has embossed bears and moose on opposite sides and brushed brown rims for rustic style.  Microwave and dishwasher safe.  Set of three.  Measures Small: 7""Dia x 3½""H; Medium: 8¼""Dia. x 4""H; Large: 10""Dia. x 5""H. ~",,,,,
PK676620,vintage-camp-lantern-soap-dispenser,Vintage Camp Lantern Soap Dispenser,"Classic camping items are replicated in cast resin to make these accessories a fun addition to your bath.  Measures 4½""W x 3½""D x 9""H. ~",,,,,
MUMMRFPTS,antler-fireplace-tool-set-4-pcs,Antler Fireplace Tool Set (4 pcs),"Bring rugged beauty to your hearth with the Antler Fireplace Tool Set, featuring metal tools with cast resin handles modeled from naturally shed antlers for an authentic look.  Four piece set includes broom, shovel, poker and stand.  Measures 15""W x 10""D x 31½""H. ~",,,,,
ER68081P,pinecone-braided-jute-table-runner,Pinecone Braided Jute Table Runner,"Add a rustic accent to any table with this reversible 100% jute table runner printed with lodge designs. Spot clean. 13""W x 36""L",,,,,
