Item Code,Manufacturer Model Number,UPC Code,Product Name,Current Wholesale (Stocking) Price AFTER Discount,New Wholesale (Stocking) Price AFTER Discount,Current Wholesale (Stocking) Price BEFORE Discount,New Wholesale (Stocking) Price BEFORE Discount,Current Drop Ship Price AFTER Discount,New Drop Ship Price AFTER Discount,Current Drop Ship Price BEFORE Discount,New Drop Ship Price BEFORE Discount,Drop Ship Fee (optional),MAP Price (Sale Price),Full Retail Price (MSRP),Option 1 Value,Option 1 Surcharge,Option 2 Value,Option 2 Surcharge,Option 3 Value,Option 3 Surcharge
KM0716230141BR,0716230141BRN,,Buckmark Plaid Pink & Gray Oblong Pillow,9.75,,,,9.75,,,,,,,,,,,,
KM07170100144BC,07170100144BC,,Bone Collector Black Black Square Pillow,9.75,,,,9.75,,,,,,,,,,,,
KM07172200010BR,07172200010BRN,,Browning Whitetails Sheet Set - Cal King,42.50,,,,42.50,,,,,,,,,,,,
KM07172300012BR,07172300012BRN,,Browning Pink Buckmark Sheet Set - Queen,29.50,,,,29.50,,,,,,,,,,,,
KM07201700011KM,07201700011KM,,Laura Sheet Set - King,39.75,,,,39.75,,,,,,,,,,,,
KM07280200012BR,07280200012BRN,730733133125,3D Buckmark Sheet Set - Queen,34.25,,34.25,,34.25,,34.25,,,,,,,,,,
KM09009500060KM,09009500060KM,,American Denim Bedskirt - Cal King,25.00,,,,25.00,,,,,,,,,,,,
KM09023500084BR,09023500084BRT,,Duck Approach Comforter Set - Twin,64.50,,,,64.50,,,,,,,,,,,,
KM-BB-DRPS,09075600034BRT,730733089675,Black Bear Rod Pocket Drapes,43.50,,,,43.50,,,,,,,,,,,,
KM07141000013KM,07141000013KM,,Realtree Max-4 Camo Sheet Set - Full,24.50,,,,24.50,,,,,,,,,,,,
KM07164000013MO,07164000013MO,,Mossy Oak New Break-Up Camo Sheet Set - Full,24.50,,,,24.50,,,,,,,,,,,,
KM07164050014MO,07164050014MO,,Mossy Oak New Break-Up Crib Sheet Set - 2 pcs,12.00,,,,12.00,,,,,,,,,,,,
KM07280200014BR,07280200014BRN,730733133101,3D Buckmark Sheet Set - Twin,24.50,,24.50,,24.50,,24.50,,,,,,,,,,
KM09052800037BR,09052800037BRT,,River Fishin' Square Accent Pillow,13.25,,,,13.25,,,,,,,,,,,,
KM09072200032BR,09072200032BRN,,Browning Whitetails Valance,15.50,,,,15.50,,,,,,,,,,,,
KM-DRPSTHEWOODS,07104100034KM,730733004272,The Woods Curtain Drapes,30.50,,,,30.50,,,,,,,,,,,,
KM07141050075KM,07141050075KM,,Realtree Max-4 Crib Comforter,15.50,,,,15.50,,,,,,,,,,,,
KM07151000034RT,07151000034RT,730733135426,Max 5 Realtree Drapes,19.50,,,,19.50,,,,,,,,,,,,
KM07170000015BC,07170000015BC,,Bone Collector Sheet Set - XL Twin,21.50,,,,21.50,,,,,,,,,,,,
KM07172300014BR,07172300014BRN,,Browning Pink Buckmark Sheet Set - Twin,20.50,,,,20.50,,,,,,,,,,,,
KM07172300082BR,07172300082BRN,,Browning Pink Buckmark Comforter Set - Queen,54.50,,,,54.50,,,,,,,,,,,,
KM07176000083RT,07176000083RT,,Realtree AP Lavender Camo Comforter Set - Full,43.00,,,,43.00,,,,,,,,,,,,
KM09009500030KM,09009500030KM,,American Denim Standard Sham,12.00,,,,12.00,,,,,,,,,,,,
KM7180500032BRN,"07180500032BRN (Browning Lined Valance - 63x20 w/3"" Header)",,Browning Valance (lined) 63 x 20,9.75,,,,9.75,,,,,,,,,,,,
KM07162300034BR,07162300034BRN,,Buckmark Plaid Pink & Gray Drapes,19.50,,,,19.50,,,,,,,,,,,,
KM07164000084MO,07164000084MO,,Mossy Oak New Break-Up Camo Comforter Set - Twin,35.00,,,,35.00,,,,,,,,,,,,
KM07175950394KM,07175950394RT,,Realtree AP Pink Crib Set - 3 pcs,34.25,,,,34.25,,,,,,,,,,,,
KM07176100013RT,07176100013RT,730733135488,Xtra Realtree Camo Sheet Set - Full,24.50,,,,24.50,,,,,,,,,,,,
KM09072100081BR,09072100081BRN,,Browning Buckmark Comforter Set - King,104.50,,,,104.50,,,,,,,,,,,,
KM09072200083BR,09072200083BRN,,Browning Whitetails Comforter Set - Full,79.50,,,,79.50,,,,,,,,,,,,
KM07141000010KM,07141000010KM,,Realtree Max-4 Camo Sheet Set - Cal King,32.50,,,,32.50,,,,,,,,,,,,
KM07186000014KM,07186000014KM,730733093443,Wild Horses Sheet Set - Twin,26.00,,,,26.00,,,,,,,,,,,,
KM07201700013KM,07201700013KM,,Laura Sheet Set - Full,33.25,,,,33.25,,,,,,,,,,,,
KM07201700014KM,07201700014KM,,Laura Sheet Set - Twin,26.00,,,,26.00,,,,,,,,,,,,
KM09049000082KM,09049000082KM,,Palm Grove Comforter Set - Queen,129.50,,,,129.50,,,,,,,,,,,,
KM09080210000BR,09080210000BRN,730733133231,3D Buckmark Shower Curtain,18.00,,18.00,,18.00,,18.00,,,,,,,,,,
KM-07107700088,07107700088KM,,Northern Exposure Daybed Ensemble,63.50,,,,63.50,,,,,,,,,,,,
KM07175000013RT,07175000013RT,,Realtree AP Fuchsia Sheet Set - Full,24.50,,,,24.50,,,,,,,,,,,,
KM07175900015RT,07175900015RT,,Realtree AP Pink Sheet Set - XL Twin,21.50,,,,21.50,,,,,,,,,,,,
KM07175900083KM,07175900083RT,,Realtree AP Pink Comforter Set - Full,43.00,,,,43.00,,,,,,,,,,,,
KM07176050075RT,07176050075RT,,Realtree AP Lavender Crib Comforter,15.50,,,,15.50,,,,,,,,,,,,
KM07180500011BR,07180500011BRN,,Browning Country Sheet Set - King,32.50,,,,32.50,,,,,,,,,,,,
KM07201700034KM,07201700034KM,,Laura Rod Pocket Drapes,30.50,,,,30.50,,,,,,,,,,,,
KM09086000034KM,09086000034KM,,Wild Horses Drapes,43.50,,,,43.50,,,,,,,,,,,,
KM09086000040KM,09086000040KM,,Wild Horses Euro Fringed Pillow,20.50,,,,20.50,,,,,,,,,,,,
KM-SC-WO,07104110000KM,,The Woods Shower Curtain,16.75,,,,16.75,,,,,,,,,,,,
KM07102600244DU,07102600244DU,,Ducks Unlimited Plaid Dark Square Pillow,9.00,,,,9.00,,,,,,,,,,,,
KM07141000011KM,07141000011KM,,Realtree Max-4 Camo Sheet Set - King,32.50,,,,32.50,,,,,,,,,,,,
KM07164000034MO,07164000034MO,,Mossy Oak New Break-Up Camo Rod Pocket Drapes,19.50,,,,19.50,,,,,,,,,,,,
KM07172100015BR,07172100015BRN,730733122488,Browning Buckmark Sheet Set - XL Twin,31.50,,,,31.50,,,,,,,,,,,,
KM07172150002BR,07172150002BRN,,Browning Buckmark Diaper Stacker,12.00,,,,12.00,,,,,,,,,,,,
KM07176000047RT,07176000047RT,,Realtree AP Lavender Camo Curtains,19.50,,,,19.50,,,,,,,,,,,,
KM09080200032BR,09080200032BRN,730733133187,3D Buckmark Valance,14.50,,14.50,,14.50,,14.50,,,,,,,,,,
KM-NNN,07107700013KM - 07107700083KM,,Northern Exposure EZ Bed Set - Full,103.00,,,,103.00,,,,,,,,,,,,
KM07102600083DU,07102600083DU,,Ducks Unlimited Plaid Comforter Set - Full,43.00,,,,43.00,,,,,,,,,,,,
KM07164000037MO,07164000037MO,,Mossy Oak New Break-Up Camo Square Accent Pillow,9.00,,,,9.00,,,,,,,,,,,,
KM07174800983RT,07174800983RT,,Realtree AP Black Comforter Set - Full,34.50,,,,34.50,,,,,,,,,,,,
KM07175000082RT,07175000082RT,,Realtree AP Fuchsia Comforter Set - Queen,47.00,,,,47.00,,,,,,,,,,,,
KM09090100082BR,09090100082BRT,,Whitetail Ridge Comforter Set - Queen,79.50,,,,79.50,,,,,,,,,,,,
KM07162300244BR,07162300244BRN,,Buckmark Plaid Pink & Gray Gray Accent Pillow,9.75,,,,9.75,,,,,,,,,,,,
KM07174800984RT,07174800984RT,,Realtree AP Black Comforter Set - Twin,28.00,,,,28.00,,,,,,,,,,,,
KM07175300084RT,07175300084RT,,Realtree All Purpose Camo Comforter Set - Twin,36.00,,,,36.00,,,,,,,,,,,,
KM0717590002KM,07175950002RT,,Realtree AP Pink Diaper Stacker,12.00,,,,12.00,,,,,,,,,,,,
KM07175900082KM,07175900082RT,,Realtree AP Pink Comforter Set - Queen,47.00,,,,47.00,,,,,,,,,,,,
KM07176050014RT,07176050014RT,,Realtree AP Lavender Crib Sheet Set,12.00,,,,12.00,,,,,,,,,,,,
KM07180300011BR,07180300011BRN,,Oak Tree Buckmark Sheet Set - King,36.50,,,,36.50,,,,,,,,,,,,
KM09080200084BR,09080200084BRN,730733133149,3D Buckmark Comforter Set - Twin,49.50,,49.50,,49.50,,49.50,,,,,,,,,,
KM-E1,07107700032KM,730733177327,Northern Exposure Window Valance,14.00,,,,14.00,,,,,,,,,,,,
KM-H6,07104100012KM - 07104100082KM,,The Woods EZ Bed Set - Queen,116.25,,,,116.25,,,,,,,,,,,,
KM07151000013RT,07151000013RT,,Max 5 Realtree Sheet Set - Full,24.50,,,,24.50,,,,,,,,,,,,
KM07164000011MO,07164000011MO,,Mossy Oak New Break-Up Camo Sheet Set - King,32.50,,,,32.50,,,,,,,,,,,,
KM07172600244BR,07172600244BRN,,Buckmark Camo Pink Light Logo Pillow,9.75,,,,9.75,,,,,,,,,,,,
KM09023500034BR,09023500034BRT,,Duck Approach Drapes,44.50,,,,44.50,,,,,,,,,,,,
KM09049000081KM,09049000081KM,,Palm Grove Comforter Set - King,149.50,,,,149.50,,,,,,,,,,,,
KM7180500034BRN,07180500034BRN (Browning Drapes-1 Pair with Tie Backs),,Browning Country Drapes (2 Panels w/Tiebacks),19.50,,,,19.50,,,,,,,,,,,,
KM-Q1,07104100032KM,730733004104,The Woods Window Valance,14.00,,,,14.00,,,,,,,,,,,,
KM-WTD-SHKG,07183000011BRT,,Whitetail Dreams Sheet Set - King,39.75,,,,39.75,,,,,,,,,,,,
KM07141000034KM,07141000034KM,,Realtree Max-4 Camo Rod Pocket Drapes,19.50,,,,19.50,,,,,,,,,,,,
KM07141000081KM,07141000081KM,,Realtree Max-4 Camo Comforter Set - King,53.00,,,,53.00,,,,,,,,,,,,
KM0715101000RT,0715101000RT,,Max 5 Realtree Shower Curtain,11.50,,,,11.50,,,,,,,,,,,,
KM07223700011BR,07223700011BRT,730733132982,Whitetail Birch Sheet Set - King,39.75,,39.75,,39.75,,39.75,,,,,,,,,,
KM09009500064KM,09009500064KM,,American Denim Bedskirt - Twin,18.00,,,,18.00,,,,,,,,,,,,
KM09072100037BR,09072100037BRN,,Browning Buckmark Square Border Pillow,11.75,,,,11.75,,,,,,,,,,,,
KM09086000032KM,09086000032KM,,Wild Horses Window Valance,16.25,,,,16.25,,,,,,,,,,,,
KM-B3,07107700011KM - 07107700081KM,,Northern Exposure EZ Bed Set - King,129.50,,,,129.50,,,,,,,,,,,,
KM-BB-SHFL,07175600013BRT,730733089538,Black Bear Sheet Set - Full,33.25,,,,33.25,,,,,,,,,,,,
KM09009500062KM,09009500062KM,730733108789,American Denim Bedskirt - Queen,23.00,,,,23.00,,,,,,,,,,,,
KM09080200144BR,09080200144BRN,730733133217,3D Buckmark Square 3-D Buckmark Pillow,12.50,,12.50,,12.50,,12.50,,,,,,,,,,
KM-BB-CSFL,09075600083BRT,,Black Bear Comforter Set - Full,78.50,,,,78.50,,,,,,,,,,,,
KM07175950014KM,07175950014RT,,Realtree AP Pink Crib Sheet Set - 2 pcs,12.00,,,,12.00,,,,,,,,,,,,
KM07176000082RT,07176000082RT,,Realtree AP Lavender Camo Comforter Set - Queen,47.00,,,,47.00,,,,,,,,,,,,
KM09049000083KM,09049000083KM,,Palm Grove Comforter Set - Full,119.50,,,,119.50,,,,,,,,,,,,
KM09086000083KM,09086000083KM,,Wild Horses Comforter Set - Full,78.50,,,,78.50,,,,,,,,,,,,
KM09080000141BR,09080000141BRN,,Buckmark Suede Oblong Pillow - Brown,9.00,,,,9.00,,,,,,,,,,,,
KM09080200037BR,09080200037BRN,730733133200,3D Buckmark Square Pillow,12.50,,12.50,,12.50,,12.50,,,,,,,,,,
KM07170100012BC,07170100012BC,,Bone Collector Black Sheet Set - Queen,29.50,,,,29.50,,,,,,,,,,,,
KM07174700013RT,07174700013RT,,Realtree AP Snow Sheet Set - Full,24.50,,,,24.50,,,,,,,,,,,,
KM07175300034RT,07175300034RT,,Realtree All Purpose Camo Rod Pocket Drapes,19.50,,,,19.50,,,,,,,,,,,,
KM07180300013BR,07180300013BRN,,Oak Tree Buckmark Sheet Set - Full,28.25,,,,28.25,,,,,,,,,,,,
KM07201700082KM,07201700082KM,,Laura Comforter Set - Queen,49.75,,,,49.75,,,,,,,,,,,,
KM07201700084KM,07201700084KM,,Laura Comforter Set - Twin,39.75,,,,39.75,,,,,,,,,,,,
KM09009500063KM,09009500063KM,,American Denim Bedskirt - Full,20.50,,,,20.50,,,,,,,,,,,,
KM09023500141BR,09023500141BRT,,Duck Approach Brown Oblong Accent Pillow,11.75,,,,11.75,,,,,,,,,,,,
KM07152800013BR,07152800013BRT,,River Fishin' Sheet Set - Full,33.25,,,,33.25,,,,,,,,,,,,
KM07164050394MO,07164050394MO,,Mossy Oak New Break-Up Crib Set - 3 pcs,34.25,,,,34.25,,,,,,,,,,,,
KM07170100011BC,07170100011BC,,Bone Collector Black Sheet Set - King,32.50,,,,32.50,,,,,,,,,,,,
KM07170100034BC,07170100034BC,,Bone Collector Black Curtains,19.50,,,,19.50,,,,,,,,,,,,
KM07186000011KM,07186000011KM,730733093474,Wild Horses Sheet Set - King,39.75,,,,39.75,,,,,,,,,,,,
KM09009500031KM,09009500031KM,,American Denim King Sham,14.00,,,,14.00,,,,,,,,,,,,
KM09009500037KM,09009500037KM,,American Denim Square Pillow,11.00,,,,11.00,,,,,,,,,,,,
KM-090860-FLSET,07186000013KM - 09086000083KM,,Wild Horses EZ Bed Set - Full,111.75,,,,111.75,,,,,,,,,,,,
KM-J3,07104100037KM,,The Woods Accent Pillow,11.50,,,,11.50,,,,,,,,,,,,
KM07170000983BC,07170000983BC,,Bone Collector Comforter Set - Full,38.50,,,,38.50,,,,,,,,,,,,
KM07172300047BR,07172300047BRN,,Browning Pink Buckmark Rod Pocket Drapes,19.50,,,,19.50,,,,,,,,,,,,
KM07175300080RT,07175300080RT,,Realtree All Purpose Camo Comforter Set - Cal King,53.00,,,,53.00,,,,,,,,,,,,
KM09009500165KM,09009500165KM,,American Denim Bedskirt - XL Twin,19.50,,,,19.50,,,,,,,,,,,,
KM09023500081BR,09023500081BRT,,Duck Approach Comforter Set - King,104.50,,,,104.50,,,,,,,,,,,,
KM09072210000BR,09072210000BRN,,Browning Whitetails Shower Curtain,19.50,,,,19.50,,,,,,,,,,,,
KM07102210000RT,07102210000RT,,Realtree Timber Shower Curtain,11.50,,,,11.50,,,,,,,,,,,,
KM07180500012BR,07180500012BRN,,Browning Country Sheet Set - Queen,29.50,,,,29.50,,,,,,,,,,,,
KM07180500082BR,07180500082BRN,,Browning Country Comforter Set - Queen,54.50,,,,54.50,,,,,,,,,,,,
KM09049000141KM,09049000141KM,,Palm Grove Oblong Stripe Pillow,14.00,,,,14.00,,,,,,,,,,,,
KM09072200037BR,09072200037BRN,,Browning Whitetails Square Deer Pillow,11.75,,,,11.75,,,,,,,,,,,,
KM-OOOO,07104100013KM - 07104100083KM,,The Woods EZ Bed Set - Full,103.00,,,,103.00,,,,,,,,,,,,
KM07102610000DU,07102610000DU,730733134474,Ducks Unlimited Plaid Shower Curtain,11.50,,,,11.50,,,,,,,,,,,,
KM07141000084KM,07141000084KM,,Realtree Max-4 Camo Comforter Set - Twin,35.00,,,,35.00,,,,,,,,,,,,
KM07172800244BR,07172800244BRN,,Buckmark Camo Green Light Logo Pillow,9.75,,,,9.75,,,,,,,,,,,,
KM07176000084RT,07176000084RT,730733124222,Realtree AP Lavender Camo Comforter Set - Twin,35.00,,,,35.00,,,,,,,,,,,,
KM07176100034RT,07176100034RT,,Xtra Realtree Camo Drapes,19.50,,,,19.50,,,,,,,,,,,,
KM09009500021KM,09009500021KM,,American Denim Bolster Pillow,12.50,,,,12.50,,,,,,,,,,,,
KM09049000088KM,09049000088KM,,Palm Grove Daybed Ensemble,114.25,,,,114.25,,,,,,,,,,,,
KM09072200082BR,09072200082BRN,,Browning Whitetails Comforter Set - Queen,89.50,,,,89.50,,,,,,,,,,,,
KM09080200081BR,09080200081BRN,730733133170,3D Buckmark Comforter Set - King,79.50,,79.50,,79.50,,79.50,,,,,,,,,,
KM07170000037BC,07170000037BC,,Bone Collector Brown Square Logo Pillow,9.75,,,,9.75,,,,,,,,,,,,
KM07170100244BC,07170100244BC,,Bone Collector Black Gray Square Pillow,9.75,,,,9.75,,,,,,,,,,,,
KM07172610000BR,07172610000BRN,,Buckmark Camo Pink Shower Curtain,12.50,,,,12.50,,,,,,,,,,,,
KM072017000EZFU,07201700083KM - 07201700013KM,,Laura EZ Bed Set - Full,78.00,,,,78.00,,,,,,,,,,,,
KM-SS,07104100013KM,730733017586,Moose & Bear Buffalo Check Sheet Set - Full - OVERSTOCK,33.25,,,,33.25,,,,,,,,,,,,
KM-WTDC-SPIL,09083000037BRT,,Whitetail Dreams Accent Pillow,13.25,,,,13.25,,,,,,,,,,,,
KM07141050002KM,07141050002KM,,Realtree Max-4 Diaper Stacker,12.00,,,,12.00,,,,,,,,,,,,
KM07172310000BR,07172310000BRN,,Browning Pink Buckmark Shower Curtain,12.50,,,,12.50,,,,,,,,,,,,
KM07175900014KM,07175900014RT,,Realtree AP Pink Sheet Set - Twin,20.50,,,,20.50,,,,,,,,,,,,
KM07176000013RT,07176000013RT,,Realtree AP Lavender Camo Sheet Set - Full,24.50,,,,24.50,,,,,,,,,,,,
KM07290100013BR,07290100013BRT,,Whitetail Ridge Sheet Set - Full,29.50,,,,29.50,,,,,,,,,,,,
KM09009500141KM,09009500141KM,730733108864,American Denim Oblong Pillow,11.00,,,,11.00,,,,,,,,,,,,
KM09052800034BR,09052800034BRT,,River Fishin' Rod Pocket Drapes,43.50,,,,43.50,,,,,,,,,,,,
KM09080300141BR,09080300141BRN,,Oak Tree Buckmark Oblong Pillow,12.00,,,,12.00,,,,,,,,,,,,
KM02572000026BN,02572000026BRN,,Browning Buckmark Bath Towel,7.25,,,,7.25,,,,,,,,,,,,
KM07141050064KM,07141050064KM,,Realtree Max-4 Crib Bedskirt,12.00,,,,12.00,,,,,,,,,,,,
KM07170100141BC,07170100141BC,,Bone Collector Black Reversible Oblong Pillow,9.75,,,,9.75,,,,,,,,,,,,
KM07180500081BR,07180500081BRN,,Browning Country Comforter Set - King,59.50,,,,59.50,,,,,,,,,,,,
KM07201700012KM,07201700012KM,,Laura Sheet Set - Queen,36.50,,,,36.50,,,,,,,,,,,,
KM09049010000KM,09049010000KM,,Palm Grove Shower Curtain,16.75,,,,16.75,,,,,,,,,,,,
KM09080200034BR,09080200034BRN,730733133194,"3D Buckmark Lined 84"" Drapes",39.50,,39.50,,39.50,,39.50,,,,,,,,,,
KM-WTD-CSFL,09083000083BRT,,Whitetail Dreams Comforter Set - Full - OVERSTOCK,78.50,,,,78.50,,,,,,,,,,,,
KM07186000013KM,07186000013KM,730733093450,Wild Horses Sheet Set - Full,33.25,,,,33.25,,,,,,,,,,,,
KM09072100244BR,09072100244BRN,,Browning Buckmark Tan Square Logo Pillow,14.50,,,,14.50,,,,,,,,,,,,
KM09080000084BR,09080000084BRN,,Buckmark Suede Comforter Set - Twin,49.50,,,,49.50,,,,,,,,,,,,
KM09090100081BR,09090100081BRT,,Whitetail Ridge Comforter Set - King,89.50,,,,89.50,,,,,,,,,,,,
KM07102600082DU,07102600082DU,730733134405,Ducks Unlimited Plaid Comforter Set - Queen,47.00,,,,47.00,,,,,,,,,,,,
KM07102600141DU,07102600141DU,730733134467,Ducks Unlimited Plaid Oblong Pillow,9.00,,,,9.00,,,,,,,,,,,,
KM07151000983RT,07151000983RT,730733135396,Max 5 Realtree Comforter Set - Full,34.50,,,,34.50,,,,,,,,,,,,
KM07172200014BR,07172200014BRN,,Browning Whitetails Sheet Set - Twin,29.50,,,,29.50,,,,,,,,,,,,
KM07180500014BR,07180500014BRN,,Browning Country Sheet Set - Twin,20.50,,,,20.50,,,,,,,,,,,,
KM09080000241BR,09080000241BRN,,Buckmark Suede Oblong Pillow - Tan,9.00,,,,9.00,,,,,,,,,,,,
KM-M7,07107700084KM,,Northern Exposure Comforter Set - Twin,59.75,,,,59.75,,,,,,,,,,,,
KM07162350064BR,07162350064BRN,730733133262,Buckmark Plaid Pink & Gray Bedskirt,12.00,,,,12.00,,,,,,,,,,,,
KM07172150394BR,07172150394BRN,,Browning Buckmark Crib Set - 3 pcs,34.25,,,,34.25,,,,,,,,,,,,
KM07176000012RT,07176000012RT,,Realtree AP Lavender Camo Sheet Set - Queen,29.50,,,,29.50,,,,,,,,,,,,
KM07141000037KM,07141000037KM,,Realtree Max-4 Camo Square Accent Pillow,9.00,,,,9.00,,,,,,,,,,,,
KM07172150075BR,07172150075BRN,,Browning Buckmark Comforter,15.50,,,,15.50,,,,,,,,,,,,
KM07174800037RT,07174800037RT,,Realtree AP Black and Snow Square Pillow,9.00,,,,9.00,,,,,,,,,,,,
KM07174800981RT,07174800981RT,,Realtree AP Black Comforter Set - King,43.50,,,,43.50,,,,,,,,,,,,
KM07175300013RT,07175300013RT,,Realtree All Purpose Camo Sheet Set - Full,24.50,,,,24.50,,,,,,,,,,,,
KM-WTD-DRPS,09083000034BRT,730733085318,Whitetail Dreams Curtain Drapes,43.50,,,,43.50,,,,,,,,,,,,
KM07176050394RT,07176050394RT,,Realtree AP Lavender Crib Set - 3 pcs,34.25,,,,34.25,,,,,,,,,,,,
KM072017000EZKI,07201700081KM - 07201700011KM,,Laura EZ Bed Set - King,89.50,,,,89.50,,,,,,,,,,,,
KM07223500014BR,07223500014BRT,,Duck Approach Sheet Set - Twin,29.50,,,,29.50,,,,,,,,,,,,
KM09009500048KM,09009500048KM,,American Denim Tab Top Curtains,39.50,,,,39.50,,,,,,,,,,,,
KM09080000083BR,09080000083BRN,,Buckmark Suede Comforter Set - Full,59.50,,,,59.50,,,,,,,,,,,,
KM09086000084KM,09086000084KM,,Wild Horses Comforter Set - Twin,68.00,,,,68.00,,,,,,,,,,,,
KM07141000080KM,07141000080KM,,Realtree Max-4 Camo Comforter Set - Cal King,53.00,,,,53.00,,,,,,,,,,,,
KM07152800011BR,07152800011BRT,,River Fishin' Sheet Set - King,39.75,,,,39.75,,,,,,,,,,,,
KM07162300082BR,07162300082BRN,,Buckmark Plaid Pink & Gray Comforter Set - Queen,54.50,,,,54.50,,,,,,,,,,,,
KM07170100984BC,07170100984BC,730733123799,Bone Collector Black Comforter and Sham Set - Twin,33.50,,,,33.50,,,,,,,,,,,,
KM07172300083BR,07172300083BRN,,Browning Pink Buckmark Comforter Set - Full,49.50,,,,49.50,,,,,,,,,,,,
KM07175300082RT,07175300082RT,,Realtree All Purpose Camo Comforter Set - Queen,47.00,,,,47.00,,,,,,,,,,,,
TEST-12346-DF,TEST-12346-DF,,TEST-Moose Comforter Set,1.00,,,,99.00,,,,,,,,,,,,
KM09023500032BR,09023500032BRT,,Duck Approach Valance,15.50,,,,15.50,,,,,,,,,,,,
KM09049000034KM,09049000034KM,,Palm Grove Rod Pocket Drape Set,59.50,,,,59.50,,,,,,,,,,,,
KM-BB-SHTW,07175600014BRT,730733089521,Black Bear Sheet Set - Twin - OVERSTOCK,26.00,,,,26.00,,,,,,,,,,,,
KM02570070004BC,02570070004BC,,Bone Collector Toothbrush Holder,8.75,,,,8.75,,,,,,,,,,,,
KM07102600012DU,07102600012DU,730733134368,Ducks Unlimited Plaid Sheet Set - Queen,28.50,,,,28.50,,,,,,,,,,,,
KM07162300084BR,07162300084BRN,730733130346,Buckmark Plaid Pink & Gray Comforter Set - Twin,39.50,,,,39.50,,,,,,,,,,,,
KM07162350002BR,07162350002BRN,,Buckmark Plaid Pink & Gray Diaper Stacker,12.00,,,,12.00,,,,,,,,,,,,
KM07164000081MO,07164000081MO,,Mossy Oak New Break-Up Camo Comforter Set - King,53.00,,,,53.00,,,,,,,,,,,,
KM07170000034BC,07170000034BC,,Bone Collector Rod Pocket Drapes,19.50,,,,19.50,,,,,,,,,,,,
KM07172600037BR,07172600034BRN,,Buckmark Camo Pink Square Pillow,9.75,,,,9.75,,,,,,,,,,,,
KM07175000032RT,07175000032RT,,Realtree AP Fuchsia Valance,9.75,,,,9.75,,,,,,,,,,,,
KM07175900012KM,07175900012RT,,Realtree AP Pink Sheet Set - Queen,29.50,,,,29.50,,,,,,,,,,,,
KM09023700082BR,09023700082BRT,730733133019,Whitetail Birch Comforter Set - Queen,89.00,,89.00,,89.00,,89.00,,,,,,,,,,
KM09090100032BR,09090100032BRT,,Whitetail Ridge Valance,12.50,,,,12.50,,,,,,,,,,,,
KM-BB-CSQN,09075600082BRT,730733089590,Black Bear Comforter Set - Queen,89.00,,,,89.00,,,,,,,,,,,,
KM-G3,07107700082KM,730733021781,Northern Exposure Comforter Set - Queen,79.75,,,,79.75,,,,,,,,,,,,
KM02572000027BN,02572000027BRN,730733114322,Browning Buckmark Hand Towel,4.50,,,,4.50,,,,,,,,,,,,
KM02572070005BN,02572070005BRN,730733119358,Browning Buckmark Waste Basket,19.75,,,,19.75,,,,,,,,,,,,
KM02576170005RT,02576170005RT,,Realtree Xtra Camo Waste Basket,19.75,,,,19.75,,,,,,,,,,,,
KM07172300244BR,07172300244BRN,,Browning Pink Buckmark Brown Square Logo Pillow,9.75,,,,9.75,,,,,,,,,,,,
KM07176050002RT,07176050002RT,,Realtree AP Lavender Diaper Stacker,12.00,,,,12.00,,,,,,,,,,,,
TEST-OO730121-1,TEST-OO730121-1 Black,,TEST-Moose Towel bar,1.00,,,,59.00,,,,,,,Black,,,,,
KM09072110000BR,09072110000BRN,,Browning Buckmark Shower Curtain,19.50,,,,19.50,,,,,,,,,,,,
KM-O7,07107700014KM,730733017791,Great Outdoors Sheet Set - Twin,26.00,,,,26.00,,,,,,,,,,,,
KM-WTD-CSQN,09083000082BRT,,Whitetail Dreams Comforter Set - Queen,89.00,,,,89.00,,,,,,,,,,,,
KM07151000011RT,07151000011RT,,Max 5 Realtree Sheet Set - King,32.50,,,,32.50,,,,,,,,,,,,
KM07172200011BR,07172200011BRN,,Browning Whitetails Sheet Set - King,42.50,,,,42.50,,,,,,,,,,,,
KM07176100014RT,07176100014RT,,Xtra Realtree Camo Sheet Set - Twin,20.50,,,,20.50,,,,,,,,,,,,
KM07290100011BR,07290100011BRT,,Whitetail Ridge Sheet Set - King,38.50,,,,38.50,,,,,,,,,,,,
KM-B8,07104100011KM - 07104100081KM,,The Woods EZ Bed Set - King,129.50,,,,129.50,,,,,,,,,,,,
KM07172600014BR,07172600014BRN,,Buckmark Camo Pink Sheet Set - Twin - OVERSTOCK,20.50,,,,20.50,,,,,,,,,,,,
KM07174700015RT,07174700015RT,,Realtree AP Snow Sheet Set - XL Twin,21.50,,,,21.50,,,,,,,,,,,,
KM07162300083BR,07162300083BRN,,Buckmark Plaid Pink & Gray Comforter Set - Full,49.50,,,,49.50,,,,,,,,,,,,
KM07170000011BC,07170000011BC,,Bone Collector Sheet Set - King,32.50,,,,32.50,,,,,,,,,,,,
KM07172300013BR,07172300013BRN,,Browning Pink Buckmark Sheet Set - Full,24.50,,,,24.50,,,,,,,,,,,,
KM07172350064BR,07172350064BRN,,Buckmark Pink Bedskirt,12.00,,,,12.00,,,,,,,,,,,,
KM07175910000KM,07175910000RT,,Realtree AP Pink Shower Curtain,11.50,,,,11.50,,,,,,,,,,,,
KM07176100037RT,07176100037RT,,Xtra Realtree Camo Square Pillow,9.00,,,,9.00,,,,,,,,,,,,
KM07180500083BR,07180500083BRN,,Browning Country Comforter Set - Full,49.50,,,,49.50,,,,,,,,,,,,
KM09080000237BR,09080000237BRN,,Buckmark Suede Square Pillow with Flange - Tan,9.00,,,,9.00,,,,,,,,,,,,
KM07223500011BR,07223500011BRT,,Duck Approach Sheet Set - King,42.50,,,,42.50,,,,,,,,,,,,
KM07223700013BR,07223700013BRT,730733132968,Whitetail Birch Sheet Set - Full,33.25,,33.25,,33.25,,33.25,,,,,,,,,,
KM09009500071KM,09009500071KM,,American Denim Comforter - King,69.50,,,,69.50,,,,,,,,,,,,
KM07102600084DU,07102600084DU,,Ducks Unlimited Plaid Comforter Set - Twin,35.00,,,,35.00,,,,,,,,,,,,
KM07175900084KM,07175900084RT,,Realtree AP Pink Comforter Set - Twin,35.00,,,,35.00,,,,,,,,,,,,
KM07176000037RT,07176000037RT,,Realtree AP Lavender Camo Square Pillow,9.00,,,,9.00,,,,,,,,,,,,
KM07186000012KM,07186000012KM,730733093467,Wild Horses Sheet Set - Queen,36.50,,,,36.50,,,,,,,,,,,,
KM09086000144KM,09086000144KM,,Wild Horses Square Fringed Pillow,13.25,,,,13.25,,,,,,,,,,,,
KM09090100084BR,09090100084BRT,,Whitetail Ridge Comforter Set - Twin,59.50,,,,59.50,,,,,,,,,,,,
KM-KKKK,07107700083KM,,Northern Exposure Comforter Set - Full,69.75,,,,69.75,,,,,,,,,,,,
KM07162300032BR,07162300032BRN,,Buckmark Plaid Pink & Gray Valance,9.75,,,,9.75,,,,,,,,,,,,
KM07174700010RT,07174700010RT,,Realtree AP Snow Sheet Set - Cal King,32.50,,,,32.50,,,,,,,,,,,,
KM07201700032KM,07201700032KM,,Laura Valance,14.00,,,,14.00,,,,,,,,,,,,
KM07280200011BR,07280200011BRN,730733133132,3D Buckmark Sheet Set - King,39.50,,39.50,,39.50,,39.50,,,,,,,,,,
KM09086011000KM,09086010000KM,730733094952,Wild Horses Shower Curtain,16.75,,,,16.75,,,,,,,,,,,,
KM02541000027KM,02541000027KM,,Realtree Max-4 Hand Towel,5.00,,,,5.00,,,,,,,,,,,,
KM07162300013BR,07162300013BRN,,Buckmark Plaid Pink & Gray Sheet Set - Full,24.50,,,,24.50,,,,,,,,,,,,
KM07162350075BR,07162350075BRN,,Buckmark Plaid Pink & Gray Comforter,15.50,,,,15.50,,,,,,,,,,,,
KM07164050002MO,07164050002MO,,Mossy Oak New Break-Up Diaper Stacker,12.00,,,,12.00,,,,,,,,,,,,
KM07170200012BC,07170200012BC,,Bone Collector Pink & Gray Sheet Set - Queen,29.50,,,,29.50,,,,,,,,,,,,
KM07172200012BR,07172200012BRN,,Browning Whitetails Sheet Set - Queen,39.50,,,,39.50,,,,,,,,,,,,
KM07172600012BR,07172600012BRN,,Buckmark Camo Pink Sheet Set - Queen,29.50,,,,29.50,,,,,,,,,,,,
KM07172600983BR,07172600983BRN,,Buckmark Camo Pink Comforter and Sham Set - Full,44.50,,,,44.50,,,,,,,,,,,,
KM07175000083RT,07175000083RT,,Realtree AP Fuchsia Comforter Set - Full,43.00,,,,43.00,,,,,,,,,,,,
KM07176000014RT,07176000014RT,,Realtree AP Lavender Camo Sheet Set - Twin,20.50,,,,20.50,,,,,,,,,,,,
KM09090110000BR,09090110000BRT,,Whitetail Ridge Shower Curtain,16.00,,,,16.00,,,,,,,,,,,,
KM-BB-CSTW,09075600084BRT,,Black Bear Comforter Set - Twin,68.00,,,,68.00,,,,,,,,,,,,
KM07170100981BC,07170100981BC,,Bone Collector Black Comforter and Sham Set - King,48.50,,,,48.50,,,,,,,,,,,,
KM07172800013BR,07172800013BRN,,Buckmark Camo Green Sheet Set - Full,24.50,,,,24.50,,,,,,,,,,,,
KM07180300012BR,07180300012BRN,,Oak Tree Buckmark Sheet Set - Queen,33.25,,,,33.25,,,,,,,,,,,,
KM09052800081BR,09052800081BRT,,River Fishin' Comforter Set - King,99.50,,,,99.50,,,,,,,,,,,,
KM-BB-SPIL,09075600037BRT,,Black Bear Accent Pillow,13.25,,,,13.25,,,,,,,,,,,,
KM07172200013BR,07172200013BRN,,Browning Whitetails Sheet Set - Full,36.50,,,,36.50,,,,,,,,,,,,
KM07172300032BR,07172300032BRN,,Browning Pink Buckmark Valance,9.75,,,,9.75,,,,,,,,,,,,
KM07175000014RT,07175000014RT,,Realtree AP Fuchsia Sheet Set - Twin,20.50,,,,20.50,,,,,,,,,,,,
