KM09009500032KM,09009500032KM,,American Denim Tab Top Valance,13.50,,,,13.50,,,,,,,,,,,,
KM09023700034BR,09023700034BRT,730733133033,"Whitetail Birch Lined 84"" Drapes",43.50,,43.50,,43.50,,43.50,,,,,,,,,,
KM09049000037KM,09049000037KM,,Palm Grove Square Pillow,14.00,,,,14.00,,,,,,,,,,,,
KM02572100029BN,02572100029BRN,730733119532,Browning Buckmark Bath Mat,14.50,,,,14.50,,,,,,,,,,,,
KM07141000032KM,07141000032KM,,Realtree Max-4 Camo Valance,9.75,,,,9.75,,,,,,,,,,,,
KM07170100983BC,07170100983BC,,Bone Collector Black Comforter and Sham Set - Full,38.50,,,,38.50,,,,,,,,,,,,
KM07172300015BR,07172300015BRN,,Browning Pink Buckmark Sheet Set - XL Twin,21.50,,,,21.50,,,,,,,,,,,,
KM07172350014BR,07172350014BRN,,Buckmark Pink Sheet Set,12.00,,,,12.00,,,,,,,,,,,,
KM07174700011RT,07174700011RT,,Realtree AP Snow Sheet Set - King,32.50,,,,32.50,,,,,,,,,,,,
KM07186000141KM,07186000141KM,,Wild Horses Oblong Fringed Pillow,14.00,,,,14.00,,,,,,,,,,,,
KM09023500083BR,09023500083BRT,,Duck Approach Comforter Set - Full,79.50,,,,79.50,,,,,,,,,,,,
KM09080300082BR,09080300082BRN,,Oak Tree Buckmark Comforter Set - Queen,69.50,,,,69.50,,,,,,,,,,,,
KM09086000081KM,09086000081KM,,Wild Horses Comforter Set - King,99.50,,,,99.50,,,,,,,,,,,,
KM-BB-EZFL,09075600083BRT - 07175600013BRT,,Black Bear EZ Bed Set - Full,111.75,,,,111.75,,,,,,,,,,,,
KM07151000014RT,07151000014RT,,Max 5 Realtree Sheet Set - Twin,20.50,,,,20.50,,,,,,,,,,,,
KM07152800014BR,07152800014BRT,,River Fishin' Sheet Set - Twin,26.00,,,,26.00,,,,,,,,,,,,
KM07162350014BR,07162350014BRN,730733133279,Buckmark Plaid Pink & Gray Sheet Set (2 pcs),12.00,,,,12.00,,,,,,,,,,,,
KM07164000014MO,07164000014MO,,Mossy Oak New Break-Up Camo Sheet Set - Twin,20.50,,,,20.50,,,,,,,,,,,,
KM07164050064MO,07164050064MO,,Mossy Oak New Break-Up Crib Bedskirt,12.00,,,,12.00,,,,,,,,,,,,
KM07172100012BR,07172100012BRN,,Browning Buckmark Sheet Set - Queen,39.50,,,,39.50,,,,,,,,,,,,
KM07175300083RT,07175300083RT,,Realtree All Purpose Camo Comforter Set - Full,43.00,,,,43.00,,,,,,,,,,,,
KM07175311000RT,07175310000RT,,Realtree All Purpose Camo Shower Curtain,11.50,,,,11.50,,,,,,,,,,,,
KM09009500088KM,09009500088KM,,American Denim Daybed Set,99.00,,,,99.00,,,,,,,,,,,,
KM09049000032KM,09049000032KM,,Palm Grove Valance,19.50,,,,19.50,,,,,,,,,,,,
KM09090100083BR,09090100083BRT,,Whitetail Ridge Comforter Set - Full,69.50,,,,69.50,,,,,,,,,,,,
KM07102600014DU,07102600014DU,,Ducks Unlimited Plaid Sheet Set - Twin,20.50,,,,20.50,,,,,,,,,,,,
KM07162300014BR,07162300014BRN,,Buckmark Plaid Pink & Gray Sheet Set - Twin,20.50,,,,20.50,,,,,,,,,,,,
KM07175300032RT,07175300032RT,,Realtree All Purpose Camo Valance,9.75,,,,9.75,,,,,,,,,,,,
KM09052800083BR,09052800083BRT,,River Fishin' Comforter Set - Full,78.50,,,,78.50,,,,,,,,,,,,
KM-BB-EZQN,09075600082BRT - 07175600012BRT,,Black Bear EZ Bed Set - Queen,125.50,,,,125.50,,,,,,,,,,,,
KM0717590075KM,07175950075RT,,Realtree AP Pink Crib Comforter,15.50,,,,15.50,,,,,,,,,,,,
KM07176010000RT,07176010000RT,,Realtree AP Lavender Camo Shower Curtain,11.50,,,,11.50,,,,,,,,,,,,
KM07176100011RT,07176100011RT,,Xtra Realtree Camo Sheet Set - King,32.50,,,,32.50,,,,,,,,,,,,
KM07201700081KM,07201700081KM,,Laura Comforter Set - King,49.75,,,,49.75,,,,,,,,,,,,
KM09052800082BR,09052800082BRT,,River Fishin' Comforter Set - Queen,89.00,,,,89.00,,,,,,,,,,,,
KM02541000028KM,02541000028KM,730733065808,Realtree Max-4 Wash Cloth,3.00,,,,3.00,,,,,,,,,,,,
KM02572070007BN,02572070007BRN,730733113417,Browning Buckmark Shower Curtain Hooks - Set of 12,9.25,,,,9.25,,,,,,,,,,,,
KM-07107700021,07107700021KM,730733008935,Northern Exposure Bolster Pillow,14.00,,,,14.00,,,,,,,,,,,,
KM07141050014KM,07141050014KM,,Realtree Max-4 Crib Sheet Set - 2 pcs,12.00,,,,12.00,,,,,,,,,,,,
KM07151000982RT,07151000982RT,,Max 5 Realtree Comforter Set - Queen,37.50,,,,37.50,,,,,,,,,,,,
KM07102600081DU,07102600081DU,,Ducks Unlimited Plaid Comforter Set - King,53.00,,,,53.00,,,,,,,,,,,,
KM07164000083MO,07164000083MO,,Mossy Oak New Break-Up Camo Comforter Set - Full,43.00,,,,43.00,,,,,,,,,,,,
KM07172150014BR,07172150014BRN,,Browning Buckmark Sheet Set,12.00,,,,12.00,,,,,,,,,,,,
KM07174800982RT,07174800982RT,,Realtree AP Black Comforter Set - Queen,37.50,,,,37.50,,,,,,,,,,,,
KM09080000081BR,09080000081BRN,,Buckmark Suede Comforter Set - King,74.50,,,,74.50,,,,,,,,,,,,
KM07102600011DU,07102600011DU,,Ducks Unlimited Plaid Sheet Set - King,32.50,,,,32.50,,,,,,,,,,,,
KM07151000032RT,07151000032RT,,Max 5 Realtree Valance,9.75,,,,9.75,,,,,,,,,,,,
KM07172100013BR,07172100013BRN,,Browning Buckmark Sheet Set - Full,36.50,,,,36.50,,,,,,,,,,,,
KM07172100014BR,07172100014BRN,,Browning Buckmark Sheet Set - Twin,29.50,,,,29.50,,,,,,,,,,,,
KM07175900032KM,07175900032RT,,Realtree AP Pink Valance,9.75,,,,9.75,,,,,,,,,,,,
KM09009500061KM,09009500061KM,,American Denim Bedskirt - King,25.00,,,,25.00,,,,,,,,,,,,
KM09080200083BR,09080200083BRN,730733133156,3D Buckmark Comforter Set - Full,64.50,,64.50,,64.50,,64.50,,,,,,,,,,
KM09080300083BR,09080300083BRN,730733134559,Oak Tree Buckmark Comforter Set - Full,64.50,,,,64.50,,,,,,,,,,,,
KM07175300011RT,07175300011RT,,Realtree All Purpose Camo Sheet Set - King,32.50,,,,32.50,,,,,,,,,,,,
KM07175950064KM,07175950064RT,,Realtree AP Pink Crib Bedskirt,12.00,,,,12.00,,,,,,,,,,,,
KM-WTD-CSKG,09083000081BRT,,Whitetail Dreams Comforter Set - King,99.50,,,,99.50,,,,,,,,,,,,
KM07151000981RT,07151000981RT,,Max 5 Realtree Comforter Set - King,43.50,,,,43.50,,,,,,,,,,,,
KM07162300012BR,07162300012BRN,,Buckmark Plaid Pink & Gray Sheet Set - Queen,29.50,,,,29.50,,,,,,,,,,,,
KM07102200032RT,07102200032RT,,Realtree Timber Valance,9.75,,,,9.75,,,,,,,,,,,,
KM07151000984RT,07151000984RT,,Max 5 Realtree Comforter Set - Twin,28.00,,,,28.00,,,,,,,,,,,,
KM07170000032BC,07170000032BC,,Bone Collector Valance,9.75,,,,9.75,,,,,,,,,,,,
KM07170100014BC,07170100014BC,,Bone Collector Black Sheet Set - Twin,20.50,,,,20.50,,,,,,,,,,,,
KM09052800084BR,09052800084BRT,,River Fishin' Comforter Set - Twin,68.00,,,,68.00,,,,,,,,,,,,
KM09080010000BR,09080010000BRN,,Buckmark Suede Shower Curtain,10.00,,,,10.00,,,,,,,,,,,,
KM09080200082BR,09080200082BRN,730733133163,3D Buckmark Comforter Set - Queen,69.50,,69.50,,69.50,,69.50,,,,,,,,,,
KM-BB-VAL,09075600032BRT,,Black Bear Window Valance,16.25,,,,16.25,,,,,,,,,,,,
KM07175900047KM,07175900047RT,,Realtree AP Pink Rod Pocket Drapes,19.50,,,,19.50,,,,,,,,,,,,
KM07201700038KM,07201700038KM,,Laura Neckroll,11.25,,,,11.25,,,,,,,,,,,,
KM09009500075XL,09009500075XL,,American Denim Comforter - XL Twin,53.50,,,,53.50,,,,,,,,,,,,
KM09023700032BR,09023700032BRT,730733133040,Whitetail Birch Valance,16.25,,16.25,,16.25,,16.25,,,,,,,,,,
KM-G7,07104100082KM,,The Woods Comforter Set - Queen,79.75,,,,79.75,,,,,,,,,,,,
KM-I6,07104100012KM,730733090466,Moose & Bear Buffalo Check Sheet Set - Queen,36.50,,,,36.50,,,,,,,,,,,,
KM-N6,07107700014KM - 07107700084KM,,Northern Exposure EZ Bed Set - Twin,85.75,,,,85.75,,,,,,,,,,,,
KM07170100013BC,07170100013BC,,Bone Collector Black Sheet Set - Full,24.50,,,,24.50,,,,,,,,,,,,
KM07172800037BR,07172800037BRN,,Buckmark Camo Green Square Pillow,9.75,,,,9.75,,,,,,,,,,,,
KM09072200080BR,09072200080BRN,,Browning Whitetails Comforter Set - Cal King,104.50,,,,104.50,,,,,,,,,,,,
KM-BB-EZTW,09075600084BRT - 07175600014BRT,,Black Bear EZ Bed Set - Twin,94.00,,,,94.00,,,,,,,,,,,,
KM-WTD-SHTW,07183000014BRT,,Whitetail Dreams Sheet Set - Twin,26.00,,,,26.00,,,,,,,,,,,,
KM07164000012MO,07164000012MO,,Mossy Oak New Break-Up Camo Sheet Set - Queen,29.50,,,,29.50,,,,,,,,,,,,
KM07170000984BC,07170000984BC,,Bone Collector Comforter Set - Twin,33.50,,,,33.50,,,,,,,,,,,,
KM07170200013BC,07170200013BC,,Bone Collector Pink & Gray Sheet Set - Full,24.50,,,,24.50,,,,,,,,,,,,
KM07180500141BR,07180500141BRN,,Browning Country Oblong Pillow,9.75,,,,9.75,,,,,,,,,,,,
KM07201700083KM,07201700083KM,,Laura Comforter Set - Full,44.75,,,,44.75,,,,,,,,,,,,
KM07290100014BR,07290100014BRT,,Whitetail Ridge Sheet Set - Twin,24.50,,,,24.50,,,,,,,,,,,,
KM09009500072KM,09009500072KM,,American Denim Comforter - Queen,64.50,,,,64.50,,,,,,,,,,,,
KM09009500075KM,09009500075KM,,American Denim Comforter - Twin,49.50,,,,49.50,,,,,,,,,,,,
KM09023700084BR,09023700084BRT,730733132999,Whitetail Birch Comforter Set - Twin,68.00,,68.00,,68.00,,68.00,,,,,,,,,,
KM09049000080KM,09049000080KM,,Palm Grove Comforter Set - Cal King,149.50,,,,149.50,,,,,,,,,,,,
KM-090860-QNSET,07186000012KM - 09086000082KM,,Wild Horses EZ Bed Set - Queen,125.50,,,,125.50,,,,,,,,,,,,
KM07175310000RT,07175310000RT,,Realtree All Purpose Camo Shower Curtain w\o Liner,11.50,,,,11.50,,,,,,,,,,,,
KM07176100984RT,07176100984RT,,Xtra Realtree Camo Comforter Set - Twin,28.00,,,,28.00,,,,,,,,,,,,
KM07180500144BR,07180500144BRN,,Browning Country Square Camo Pillow,9.75,,,,9.75,,,,,,,,,,,,
KM07223700012BR,07223700012BRT,730733132975,Whitetail Birch Sheet Set - Queen,36.50,,36.50,,36.50,,36.50,,,,,,,,,,
KM09052800032BR,09052800032BRT,,River Fishin' Valance,16.25,,,,16.25,,,,,,,,,,,,
KM09072100082BR,09072100082BRN,,Browning Buckmark Comforter Set - Queen,89.50,,,,89.50,,,,,,,,,,,,
KM09072200084BR,09072200084BRN,,Browning Whitetails Comforter Set - Twin,64.50,,,,64.50,,,,,,,,,,,,
KM02541000026KM,02541000026KM,,Realtree Max-4 Bath Towel,10.75,,,,10.75,,,,,,,,,,,,
KM07170000013BC,07170000013BC,,Bone Collector Sheet Set - Full,24.50,,,,24.50,,,,,,,,,,,,
KM07172100010BR,07172100010BRN,,Browning Buckmark Sheet Set - Cal King,42.50,,,,42.50,,,,,,,,,,,,
KM07175300010RT,07175300010RT,730733089200,Realtree All Purpose Camo Sheet Set - Cal King,32.50,,,,32.50,,,,,,,,,,,,
KM07175300081RT,07175300081RT,,Realtree All Purpose Camo Comforter Set - King,53.00,,,,53.00,,,,,,,,,,,,
KM07102600144DU,07102600144DU,,Ducks Unlimited Plaid Light Square Pillow,9.00,,,,9.00,,,,,,,,,,,,
KM07172350075BR,07172350075BRN,,Buckmark Pink Comforter,15.50,,,,15.50,,,,,,,,,,,,
KM07176100982RT,07176100982RT,,Xtra Realtree Camo Comforter Set - Queen,37.50,,,,37.50,,,,,,,,,,,,
KM07180500013BR,07180500013BRN,,Browning Country Sheet Set - Full,24.50,,,,24.50,,,,,,,,,,,,
KM07223500141BR,07223500141BRT,,Duck Approach Tan Oblong Accent Pillow,11.75,,,,11.75,,,,,,,,,,,,
KM09072100144BR,09072100144BRN,,Browning Buckmark Brown Square Logo Pillow,14.50,,,,14.50,,,,,,,,,,,,
KM09080000082BR,09080000082BRN,,Buckmark Suede Comforter Set - Queen,64.50,,,,64.50,,,,,,,,,,,,
KM09080300032BR,09080300032BRN,730733134634,Oak Tree Buckmark Valance,12.50,,,,12.50,,,,,,,,,,,,
KM09090100034BR,09090100034BRT,,Whitetail Ridge Lined Drape Set,39.50,,,,39.50,,,,,,,,,,,,
KM-X11,07107700037KM,,Northern Exposure Accent Pillow,11.50,,,,11.50,,,,,,,,,,,,
KM07141000012KM,07141000012KM,,Realtree Max-4 Camo Sheet Set - Queen,29.50,,,,29.50,,,,,,,,,,,,
KM07141000014KM,07141000014KM,,Realtree Max-4 Camo Sheet Set - Twin,20.50,,,,20.50,,,,,,,,,,,,
KM07162310000BR,07162310000BRN,,Buckmark Plaid Pink & Gray Shower Curtain,12.50,,,,12.50,,,,,,,,,,,,
KM07174810000RT,07174810000RT,,Realtree AP Black Shower Curtain,11.50,,,,11.50,,,,,,,,,,,,
KM07175300037RT,07175300037RT,,Realtree All Purpose Camo Square Accent Pillow,9.00,,,,9.00,,,,,,,,,,,,
KM07180500085BR,07180500084BRN,,Browning Country Comforter Set - Twin,39.50,,,,39.50,,,,,,,,,,,,
KM-BB-SHQN,07175600012BRT,730733089545,Black Bear Sheet Set - Queen,36.50,,,,36.50,,,,,,,,,,,,
KM07172600032BR,07172600032BRN,,Buckmark Camo Pink Valance,9.75,,,,9.75,,,,,,,,,,,,
KM07174700012RT,07174700012RT,,Realtree AP Snow Sheet Set - Queen,29.50,,,,29.50,,,,,,,,,,,,
KM09023700081BR,09023700081BRT,730733133026,Whitetail Birch Comforter Set - King,99.50,,99.50,,99.50,,99.50,,,,,,,,,,
KM09023710000BR,09023710000BRT,730733133071,Whitetail Birch Shower Curtain,15.25,,15.25,,15.25,,15.25,,,,,,,,,,
KM09049000021KM,09049000021KM,,Palm Grove Bolster Pillow,20.50,,,,20.50,,,,,,,,,,,,
KM-WTD-VAL,09083000032BRT,730733085325,Whitetail Dreams Window Valance,16.25,,,,16.25,,,,,,,,,,,,
KM07170000012BC,07170000012BC,,Bone Collector Sheet Set - Queen,29.50,,,,29.50,,,,,,,,,,,,
KM07170100982BC,07170100982BC,,Bone Collector Black Comforter and Sham Set - Queen,43.50,,,,43.50,,,,,,,,,,,,
KM07172300144BR,07172300144BRN,,Browning Pink Buckmark Pink Square Logo Pillow,9.75,,,,9.75,,,,,,,,,,,,
KM07176100015RT,07176100015RT,,Xtra Realtree Camo Sheet Set - XL Twin,21.50,,,,21.50,,,,,,,,,,,,
KM072017000EZQU,07201700082KM - 07201700012KM,,Laura EZ Bed Set - Queen,86.25,,,,86.25,,,,,,,,,,,,
KM09009500073KM,09009500073KM,,American Denim Comforter - Full,59.50,,,,59.50,,,,,,,,,,,,
KM-090860-KGSET,07186000011KM - 09086000081KM,,Wild Horses EZ Bed Set - King,139.25,,,,139.25,,,,,,,,,,,,
KM7181600094BRT,07181600094BRT (Rocky Mountain Elk Complete Bed Set),,Rocky Mountain Elk Complete Bed Set,39.50,,,,39.50,,,,,,,,,,,,
KM-CCCC,07107700034KM,730733177341,Northern Exposure Curtain Drapes,30.50,,,,30.50,,,,,,,,,,,,
KM-D7,07104100011KM,730733017579,Moose & Bear Buffalo Check Sheet Set - King - OVERSTOCK,39.75,,,,39.75,,,,,,,,,,,,
KM07102600013DU,07102600013DU,730733134351,Ducks Unlimited Plaid Sheet Set - Full,24.50,,,,24.50,,,,,,,,,,,,
KM07162350394BR,07162350394BRN,,Buckmark Plaid Pink & Gray Crib Set (3 pcs),34.25,,,,34.25,,,,,,,,,,,,
KM07172600047BR,07172600047BRN,,Buckmark Camo Pink Curtains,19.50,,,,19.50,,,,,,,,,,,,
KM07172800032BR,07172800032BRN,,Buckmark Camo Green Valance,9.75,,,,9.75,,,,,,,,,,,,
KM07174800034RT,07174800034RT,,Realtree AP Black Rod Pocket Drapes,19.50,,,,19.50,,,,,,,,,,,,
KM07175000015RT,07175000015RT,,Realtree AP Fuchsia Sheet Set - XL Twin,21.50,,,,21.50,,,,,,,,,,,,
KM07176110000RT,07176110000RT,730733135594,Xtra Realtree Camo Shower Curtain,11.50,,,,11.50,,,,,,,,,,,,
KM-A9,07104100081KM,,The Woods Comforter Set - King,89.75,,,,89.75,,,,,,,,,,,,
KM07164050075MO,07164050075MO,,Mossy Oak New Break-Up Crib Comforter,15.50,,,,15.50,,,,,,,,,,,,
KM07170000981BC,07170000981BC,,Bone Collector Comforter and Sham Set - King,48.50,,,,48.50,,,,,,,,,,,,
KM07172600982BR,07172600982BRN,,Buckmark Camo Pink Comforter and Sham Set - Queen,47.00,,,,47.00,,,,,,,,,,,,
KM07175300012RT,07175300012RT,,Realtree All Purpose Camo Sheet Set - Queen,29.50,,,,29.50,,,,,,,,,,,,
KM09009500070KM,09009500070KM,,American Denim Comforter - Cal King,69.50,,,,69.50,,,,,,,,,,,,
KM09049000084KM,09049000084KM,,Palm Grove Comforter Set - Twin,89.50,,,,89.50,,,,,,,,,,,,
KM09072100084BR,09072100084BRN,,Browning Buckmark Comforter Set - Twin,64.50,,,,64.50,,,,,,,,,,,,
KM09072200034BR,09072200034BRN,,Browning Whitetails Rod Pocket Drapes,44.50,,,,44.50,,,,,,,,,,,,
KM09080300144BR,09080300144BRN,,Oak Tree Buckmark Square Logo Pillow - Tan,12.00,,,,12.00,,,,,,,,,,,,
KM09090100037BR,09090100037BRT,,Whitetail Ridge Square Pillow,11.00,,,,11.00,,,,,,,,,,,,
KM-N2,07104100084KM,,The Woods Comforter Set - Twin,59.75,,,,59.75,,,,,,,,,,,,
KM-O1,07104100014KM - 07104100084KM,,The Woods EZ Bed Set - Twin,85.75,,,,85.75,,,,,,,,,,,,
KM07164000082MO,07164000082MO,,Mossy Oak New Break-Up Camo Comforter Set - Queen,47.00,,,,47.00,,,,,,,,,,,,
KM09072100032BR,09072100032BRN,,Browning Buckmark Valance,15.50,,,,15.50,,,,,,,,,,,,
KM09086000082KM,09086000082KM,,Wild Horses Comforter Set - Queen,89.00,,,,89.00,,,,,,,,,,,,
KM-QQQQ,07107700013KM,730733017784,Great Outdoors Sheet Set - Full - OVERSTOCK,33.25,,,,33.25,,,,,,,,,,,,
KM07152800012BR,07152800012BRT,730733095072,River Fishin' Sheet Set - Queen,36.50,,,,36.50,,,,,,,,,,,,
KM07175900037KM,07175900037RT,,Realtree AP Pink Square Accent Pillow,9.00,,,,9.00,,,,,,,,,,,,
KM07176000015RT,07176000015RT,,Realtree AP Lavender Camo Sheet Set - XL Twin,21.50,,,,21.50,,,,,,,,,,,,
KM07180300014BR,07180300014BRN,,Oak Tree Buckmark Sheet Set - Twin,24.25,,,,24.25,,,,,,,,,,,,
KM07180500037BR,07180500037BRN,,Browning Country Square Patchwork Pillow,9.75,,,,9.75,,,,,,,,,,,,
KM09049000142KM,09049000142KM,,Palm Grove Euro Sham,21.00,,,,21.00,,,,,,,,,,,,
KM09072200144BR,09072200144BRN,,Browning Whitetails Square Logo Pillow,14.50,,,,14.50,,,,,,,,,,,,
KM09080300084BR,09080300084BRN,,Oak Tree Buckmark Comforter Set - Twin,49.50,,,,49.50,,,,,,,,,,,,
KM-090860-TWSET,07186000014KM - 09086000084KM,,Wild Horses EZ Bed Set - Twin,94.00,,,,94.00,,,,,,,,,,,,
KM-BB-SHKG,07175600011BRT,730733089552,Black Bear Sheet Set - King,39.75,,,,39.75,,,,,,,,,,,,
KM-I2,07107700012KM,730733012710,Great Outdoors Sheet Set - Queen,36.50,,,,36.50,,,,,,,,,,,,
KM-WTD-SHFL,07183000013BRT,,Whitetail Dreams Sheet Set - Full,33.25,,,,33.25,,,,,,,,,,,,
KM07164011000MO,07164010000MO,,Mossy Oak New Break-Up Camo Shower Curtain,11.50,,,,11.50,,,,,,,,,,,,
KM07170110000BC,07170110000BC,,Bone Collector Black Shower Curtain,9.75,,,,9.75,,,,,,,,,,,,
KM07172100011BR,07172100011BRN,,Browning Buckmark Sheet Set - King,42.50,,,,42.50,,,,,,,,,,,,
KM07174800032RT,07174800032RT,,Realtree AP Black Valance,9.75,,,,9.75,,,,,,,,,,,,
KM07176100012RT,07176100012RT,,Xtra Realtree Camo Sheet Set - Queen,29.50,,,,29.50,,,,,,,,,,,,
KM07176100981RT,07176100981RT,,Xtra Realtree Camo Comforter Set - King,43.50,,,,43.50,,,,,,,,,,,,
KM09009500040KM,09009500040KM,,American Denim Jumbo Bolster Pillow,14.50,,,,14.50,,,,,,,,,,,,
KM09023700141BR,09023700141BRT,730733133064,Whitetail Birch Corded Oblong Pillow,13.25,,13.25,,13.25,,13.25,,,,,,,,,,
KM09080300244BR,09080300244BRN,,Oak Tree Buckmark Square Logo Pillow - Brown,12.00,,,,12.00,,,,,,,,,,,,
KM09072100034BR,09072100034BRN,,Browning Buckmark Rod Pocket Drapes,44.50,,,,44.50,,,,,,,,,,,,
KM09080000037BR,09080000037BRN,,Buckmark Suede Square Pillow with Flange - Brown,9.00,,,,9.00,,,,,,,,,,,,
KM09080300081BR,09080300081BRN,,Oak Tree Buckmark Comforter Set - King,79.50,,,,79.50,,,,,,,,,,,,
KM09080310000BR,09080310000BRN,,Oak Tree Buckmark Shower Curtain,16.25,,,,16.25,,,,,,,,,,,,
KM-D3,07107700011KM,730733017777,Northern Exposure Sheet Set - King - OVERSTOCK,39.75,,,,39.75,,,,,,,,,,,,
KM-H1,07107700012KM - 07107700082KM,,Northern Exposure EZ Bed Set - Queen,116.25,,,,116.25,,,,,,,,,,,,
KM02572300029BR,02572300029BRN,,Browning Buckmark Pink Bath Mat,14.50,,,,14.50,,,,,,,,,,,,
KM07102200037RT,07102200037RT,,Realtree Timber Square Accent Pillow,9.00,,,,9.00,,,,,,,,,,,,
KM07102600032DU,07102600032DU,,Ducks Unlimited Plaid Valance,9.75,,,,9.75,,,,,,,,,,,,
KM07141000082KM,07141000082KM,,Realtree Max-4 Camo Comforter Set - Queen,47.00,,,,47.00,,,,,,,,,,,,
KM07172300084BR,07172300084BRN,,Browning Pink Buckmark Comforter Set - Twin,39.50,,,,39.50,,,,,,,,,,,,
KM07172350002BR,07172350002BRN,,Buckmark Pink Diaper Stacker,12.00,,,,12.00,,,,,,,,,,,,
KM07172600144BR,07172600144BRN,,Buckmark Camo Pink Dark Logo Pillow,9.75,,,,9.75,,,,,,,,,,,,
KM07174800141RT,07174800141RT,,Realtree AP Black and Snow Oblong Pillow,9.00,,,,9.00,,,,,,,,,,,,
KM07175900013KM,07175900013RT,,Realtree AP Pink Sheet Set - Full,24.50,,,,24.50,,,,,,,,,,,,
KM07176000032RT,07176000032RT,,Realtree AP Lavender Camo Valance,9.75,,,,9.75,,,,,,,,,,,,
KM07223500013BR,07223500013BRT,,Duck Approach Sheet Set - Full,36.50,,,,36.50,,,,,,,,,,,,
KM07223700014BR,07223700014BRT,730733132951,Whitetail Birch Sheet Set - Twin,26.00,,26.00,,26.00,,26.00,,,,,,,,,,
KM09023500082BR,09023500082BRT,730733131909,Duck Approach Comforter Set - Queen,89.50,,,,89.50,,,,,,,,,,,,
KM09023510000BR,09023510000BRT,,Duck Approach Shower Curtain,19.25,,,,19.25,,,,,,,,,,,,
TEST-FD-14785,TEST-FD-14785,987654321,TEST-Bear Paper Towel holder,1.00,,,,12.50,,,,,,,,,,,,
KM07141011000KM,07141010000KM,,Realtree Max-4 Camo Shower Curtain,11.50,,,,11.50,,,,,,,,,,,,
KM07170000014BC,07170000014BC,,Bone Collector Sheet Set - Twin,20.50,,,,20.50,,,,,,,,,,,,
KM07170000144BC,07170000144BC,,Bone Collector Tan Square Logo Pillow,9.75,,,,9.75,,,,,,,,,,,,
KM07170000982BC,07170000982BC,,Bone Collector Comforter Set - Queen,43.50,,,,43.50,,,,,,,,,,,,
KM07170010000BC,07170010000BC,,Bone Collector Shower Curtain,9.75,,,,9.75,,,,,,,,,,,,
KM07172600013BR,07172600013BRN,,Buckmark Camo Pink Sheet Set - Full,24.50,,,,24.50,,,,,,,,,,,,
KM07201700037KM,07201700037KM,,Laura Square Pillow,11.25,,,,11.25,,,,,,,,,,,,
KM07280200013BR,07280200013BRN,730733133118,3D Buckmark Sheet Set - Full,29.75,,29.75,,29.75,,29.75,,,,,,,,,,
KM09023700037BR,09023700037BRT,730733133057,Whitetail Birch Corded Square Pillow,13.25,,13.25,,13.25,,13.25,,,,,,,,,,
KM09072100083BR,09072100083BRN,,Browning Buckmark Comforter Set - Full,79.50,,,,79.50,,,,,,,,,,,,
KM09080200141BR,09080200141BRN,730733133224,3D Buckmark Oblong Pillow,12.50,,12.50,,12.50,,12.50,,,,,,,,,,
KM07151000015RT,07151000015RT,,Max 5 Realtree Sheet Set - XL Twin,21.50,,,,21.50,,,,,,,,,,,,
KM07290100012BR,07290100012BRT,,Whitetail Ridge Sheet Set - Queen,34.50,,,,34.50,,,,,,,,,,,,
KM09023500037BR,09023500037BRT,,Duck Approach Square Accent Pillow,11.75,,,,11.75,,,,,,,,,,,,
KM09023700083BR,09023700083BRT,730733133002,Whitetail Birch Comforter Set - Full,78.50,,78.50,,78.50,,78.50,,,,,,,,,,
KM-BB-CSKG,09075600081BRT,,Black Bear Comforter Set - King,99.50,,,,99.50,,,,,,,,,,,,
KM-BB-EZKG,09075600081BRT - 07175600011BRT,,Black Bear EZ Bed Set - King,139.25,,,,139.25,,,,,,,,,,,,
KM-MM,07104100083KM,,The Woods Comforter Set - Full,69.75,,,,69.75,,,,,,,,,,,,
KM-P2,07104100014KM,730733019214,Moose & Bear Buffalo Check Sheet Set - Twin,26.00,,,,26.00,,,,,,,,,,,,
KM-WTD-CSTW,09083000084BRT,,Whitetail Dreams Comforter Set - Twin,68.00,,,,68.00,,,,,,,,,,,,
KM07175300014RT,07175300014RT,,Realtree All Purpose Camo Sheet Set - Twin,20.50,,,,20.50,,,,,,,,,,,,
KM07176100032RT,07176100032RT,730733135570,Xtra Realtree Camo Valance,9.75,,,,9.75,,,,,,,,,,,,
KM09072200081BR,09072200081BRN,,Browning Whitetails Comforter Set - King,104.50,,,,104.50,,,,,,,,,,,,
KM09080300034BR,09080300034BRN,,Oak Tree Buckmark Drapes,28.50,,,,28.50,,,,,,,,,,,,
KM07102600034DU,07102600034DU,,Ducks Unlimited Plaid Drapes,19.50,,,,19.50,,,,,,,,,,,,
KM07141050394KM,07141050394KM,,Realtree Max-4 Crib Set - 3 pcs,34.25,,,,34.25,,,,,,,,,,,,
KM07151000037RT,07151000037RT,,Max 5 Realtree Square Accent Pillow,9.00,,,,9.00,,,,,,,,,,,,
TEST-KJ-14785,TEST-KJ-14785,,TEST-COW Paper Towel Holder,12.50,,,,12.50,,,,,,,,,,,,
KM07172600984BR,07172600984BRN,,Buckmark Camo Pink Comforter and Sham Set - Twin,37.00,,,,37.00,,,,,,,,,,,,
KM07176100983RT,07176100983RT,730733135532,Xtra Realtree Camo Comforter Set - Full,34.50,,,,34.50,,,,,,,,,,,,
KM072017000EZTW,07201700084KM - 07201700014KM,,Laura EZ Bed Set - Twin,65.75,,,,65.75,,,,,,,,,,,,
KM07223500012BR,07223500012BRT,730733131862,Duck Approach Sheet Set - Queen,39.50,,,,39.50,,,,,,,,,,,,
KM09009510000KM,09009510000KM,,American Denim Shower Curtain,24.50,,,,24.50,,,,,,,,,,,,
KM09072100080BR,09072100080BRN,,Browning Buckmark Comforter Set - Cal King,104.50,,,,104.50,,,,,,,,,,,,
KM07164000032MO,07164000032MO,,Mossy Oak New Break-Up Camo Valance,9.75,,,,9.75,,,,,,,,,,,,
KM07172150064BR,07172150064BRN,,Browning Buckmark Bedskirt,12.00,,,,12.00,,,,,,,,,,,,
KM09080000144BR,09080000144BRN,,Buckmark Suede Square Pillow without Flange - Brown,9.00,,,,9.00,,,,,,,,,,,,
KM-A5,07107700081KM,,Northern Exposure Comforter Set - King,89.75,,,,89.75,,,,,,,,,,,,
KM-WTD-SHQN,07183000012BRT,,Whitetail Dreams Sheet Set - Queen,36.50,,,,36.50,,,,,,,,,,,,
KM07151000012RT,07151000012RT,,Max 5 Realtree Sheet Set - Queen,29.50,,,,29.50,,,,,,,,,,,,
KM07162300144BR,07162300144BRN,,Buckmark Plaid Pink & Gray Pink Accent Pillow,9.75,,,,9.75,,,,,,,,,,,,
KM07172350394BR,07172350394BRN,,Buckmark Pink Crib Set - 3 pcs,34.25,,,,34.25,,,,,,,,,,,,
KM07174700014RT,07174700014RT,,Realtree AP Snow Sheet Set - Twin,20.50,,,,20.50,,,,,,,,,,,,
KM07176000085RT,07176000085RT,,Realtree AP Lavender Camo Comforter Set - XL Twin,36.00,,,,36.00,,,,,,,,,,,,
KM07176050064RT,07176050064RT,,Realtree AP Lavender Crib Bedskirt,12.00,,,,12.00,,,,,,,,,,,,
KM07141000083KM,07141000083KM,,Realtree Max-4 Camo Comforter Set - Full,43.00,,,,43.00,,,,,,,,,,,,
KM07170100032BC,07170100032BC,,Bone Collector Black Valance,9.75,,,,9.75,,,,,,,,,,,,
KM07172200141BR,07172200141BRN,,Browning Whitetails Oblong Pillow,11.75,,,,11.75,,,,,,,,,,,,
