PC6069WH,6069-WH,,Lodge Silhoutte Wall Tapestry,76.50,,,,76.50,,,,,,,,,,,,
PC6655WHROD9B,6655-WH,,Stoclet Frieze Schwarz Tapestry Wall Hanging,180.00,,,,180.00,,,,,,,,,,,,
PC6736WHROD9B,6736-WH,,Twists and Turns Tapestry Wall Hanging - Fireball,139.50,,,,139.50,,,,,,,,,,,,
PC8003T,8003-T,666576810018,Bison Blanket,22.50,,25.00,,22.50,,25.00,,,,,,,,,,
PC3059WH,3059-WH,,Artist&apos;s Garden Wall Hanging - Large,81.00,,,,81.00,,,,,,,,,,,,
PC3062WH,3062-WH,,Ensemble Wall Hanging,76.50,,,,76.50,,,,,,,,,,,,
PC3243WH,3243-WH,,Poker Abstract Wall Hanging,72.00,,,,72.00,,,,,,,,,,,,
PC3591WH,3591-WH,,Serengeti Zebras Wall Hanging,72.00,,,,72.00,,,,,,,,,,,,
PC3645WH,3645-WH,,Chinois Poppy Wall Hanging,63.00,,,,63.00,,,,,,,,,,,,
PC3714WH,3714-WH,,Sassafrass Wall Hanging,76.50,,,,76.50,,,,,,,,,,,,
PC4054WH,4054-WH,,Gena&apos;s Vase Wall Hanging - Small,63.00,,,,63.00,,,,,,,,,,,,
PC4192WH,4192-WH,,Storahammer Wall Hanging,45.00,,,,45.00,,,,,,,,,,,,
PC1512WH,1512-WH,,Martini & Rossi Torino Wall Hanging,72.00,,,,72.00,,,,,,,,,,,,
PC1528WH,1528-WH,,Divine Silhouette Wall Hanging,45.00,,,,45.00,,,,,,,,,,,,
PC2203WH,2203-WH,,Late Afternoon Irises Wall Tapestry,72.00,,,,72.00,,,,,,,,,,,,
PC2210WH,2210-WH,,Potted Geraniums Wall Hanging,58.50,,,,58.50,,,,,,,,,,,,
PC2213WH,2213-WH,,Harborside Reflection Wall Tapestry,76.50,,,,76.50,,,,,,,,,,,,
PC2410WH,2410-WH,,Roses and Lilies Wall Hanging,76.50,,,,76.50,,,,,,,,,,,,
PC2806WH,2806-WH,,Treasured Moment Wall Hanging,23.40,,,,23.40,,,,,,,,,,,,
PC2925WH,2925-WH,,Floral Reflections I Wall Hanging,45.00,,,,45.00,,,,,,,,,,,,
PC1397T,1397-T,,Castle Beach Small Blanket,14.40,,,,14.40,,,,,,,,,,,,
PC4722T,4722-T,,Back Forty Flush Blanket,22.50,,,,22.50,,,,,,,,,,,,
PC5249WH,5249-WH,,Ballooning over Paris Wall Hanging,58.50,,,,58.50,,,,,,,,,,,,
PC5250WH,5250-WH,,Bird Egg Study I Wall Hanging,63.00,,,,63.00,,,,,,,,,,,,
PC5746WH,5746-WH,,Santa&apos;s Notes Wall Hanging,81.00,,,,81.00,,,,,,,,,,,,
PC5772WH,5772-WH,,Double Opium Mariposa Wall Hanging,135.00,,,,135.00,,,,,,,,,,,,
PC5869WH,5869-WH,,Autumn Memories Wall Hanging,45.00,,,,45.00,,,,,,,,,,,,
PC6006WH,6006-WH,,Watteau Autumn I Wall Hanging,90.00,,,,90.00,,,,,,,,,,,,
PC6607WHROD2B,6607-WH,,The Orchard Tapestry Wall Hanging,337.50,,,,337.50,,,,,,,,,,,,
PC6659WHROD9A,6659-WH,,The Mirror II Tapestry Wall Hanging,99.00,,,,99.00,,,,,,,,,,,,
PC6685WHROD2A,6685-WH,,Ascendance Tapestry Wall Hanging - Ruby Velvet,148.50,,,,148.50,,,,,,,,,,,,
PC8117P,8117-P,666576818335,Concho Springs Rose Pillow,16.65,,18.50,,16.65,,18.50,,,,,,,,,,
PC8125PM,8125-PM,6.66577E+11,Rimrock Spring Placemat,4.05,,4.50,,4.05,,4.50,,,,,,,,,,
PCROD2B,ROD2BkPcw,,Fleur de Lis Rod in Gold Finish - 108 inch,17.99,,,,17.99,,,,,,,,,,,,
PC3227WH,3227-WH,,Shellworks Large Wall Tapestry,81.00,,,,81.00,,,,,,,,,,,,
PC3426WH,3426-WH,,Sunflowers II Wall Hanging,76.50,,,,76.50,,,,,,,,,,,,
PC3526WH,3526-WH,,Celtic Words Wall Hanging,22.50,,,,22.50,,,,,,,,,,,,
PC3637T,3637-T,,Western Slant Blanket,22.50,,,,22.50,,,,,,,,,,,,
PC3694WH,3694-WH,,Masala Cinnamon Wall Hanging,121.50,,,,121.50,,,,,,,,,,,,
PC3901P,3901-P,,Southwest Sampler Moccasin Pillow,12.60,,,,12.60,,,,,,,,,,,,
PC3978WH,3978-WH,,Sampler II Wall Hanging,72.00,,,,72.00,,,,,,,,,,,,
PC4549WH,4549-WH,,Koi Pool Wall Hanging,81.00,,,,81.00,,,,,,,,,,,,
PC1573WH,1573-WH,,Morning Light Wall Hanging,81.00,,,,81.00,,,,,,,,,,,,
PC1685WH,1685-WH,,Masterpiece Palm I Wall Tapestry,72.00,,,,72.00,,,,,,,,,,,,
PC1788LS,1788-LS,,Western Boot Small Blanket,22.05,,24.10,,22.05,,24.10,,,,,,,,,,
PC1831WH,1831-WH,,Italian Wine Country Wall Hanging,76.50,,,,76.50,,,,,,,,,,,,
PC2075WH,2075-WH,,Tulip Rosee Wall Hanging,76.50,,,,76.50,,,,,,,,,,,,
PC2411WH,2411-WH,,Gods of Good Fortune Wall Hanging - Large,171.00,,,,171.00,,,,,,,,,,,,
PC2727WH,2727-WH,,Provencial Village Wall Hanging,81.00,,,,81.00,,,,,,,,,,,,
PC3000WH,3000-WH,,Carmen Leggio New Orleans Wall Hanging,81.00,,,,81.00,,,,,,,,,,,,
PC1374WH,1374-WH,,Rustic Reflections Wall Hanging,72.00,,,,72.00,,,,,,,,,,,,
PC4739WH,4739-WH,,Tavola Decapris Wall Hanging - Small,36.00,,,,36.00,,,,,,,,,,,,
PC5796WH,5796-WH,,Amira Wall Hanging,36.00,,,,36.00,,,,,,,,,,,,
PC5913B,5913-B,,Kokopelli Pot Dance Tote Bag,16.20,,18.00,,16.20,,18.00,,,,,,,,,,
PC6038WH,6038-WH,,Monogram Medallion V Wall Hanging,130.50,,,,130.50,,,,,,,,,,,,
PC6047WH,6047-WH,,Godspeed Wall Hanging - Small,49.50,,,,49.50,,,,,,,,,,,,
PC6229T,6229-T,,Southwest Sampler Cornflower and Red Medium Blanket,22.50,,,,25.20,,,,,,,,,,,,
PC6315B,6315-B,,Trailwalker Tote Bag,14.40,,,,14.40,,,,,,,,,,,,
PC8065P,8065-P,666576814092,Arroyo Gold Pillow 17X17,12.60,,14.00,,12.60,,14.00,,,,,,,,,,
PC8085T,8085-T,666576815204,Phoenix Blanket,22.50,,25.00,,22.50,,25.00,,,,,,,,,,
PC8115B,8115-B,666576818182,Cimarron Turquoise Tote Bag,16.65,,18.50,,16.65,,18.50,,,,,,,,,,
PC3082WH,3082-WH,,The Artist Studio Wall Hanging,76.50,,,,76.50,,,,,,,,,,,,
PC3095WH,3095-WH,,Tapestry Landscape Wall Hanging,130.50,,,,130.50,,,,,,,,,,,,
PC3114WH,3114-WH,,Amalfi Dai Cappuccini Wall Hanging - Small,72.00,,,,72.00,,,,,,,,,,,,
PC3229WH,3229-WH,,Nature&apos;s Patchwork I Wall Hanging,76.50,,,,76.50,,,,,,,,,,,,
PC3356WH,3356-WH,,Tuscan Villa I Wall Hanging - Smal,76.50,,,,76.50,,,,,,,,,,,,
PC3558WH,3558-WH,,Billiard Balls Wall Hanging,45.00,,,,45.00,,,,,,,,,,,,
PC3706WH,3706-WH,,Black Gloves Wall Hanging,76.50,,,,76.50,,,,,,,,,,,,
PC3889T,3889-T,,Indian Market Blanket,22.50,,,,22.50,,,,,,,,,,,,
PC4049WH,4049-WH,,Wrought Iron Elegance Wall Hanging,81.00,,,,81.00,,,,,,,,,,,,
PC4165P,4165-P,,Southwest One Thing Pillow,6.30,,,,6.30,,,,,,,,,,,,
PC4554WH,4554-WH,,Saint Guadens Wall Hanging,72.00,,,,72.00,,,,,,,,,,,,
PC1642WH,1642-WH,,Blossoming Elegance II Wall Hanging,36.00,,,,36.00,,,,,,,,,,,,
PC1720WH,1720-WH,,Fire Red Tulip Wall Hanging,36.00,,,,36.00,,,,,,,,,,,,
PC1893WH,1893-WH,,Contemporary Crimson I Wall Hanging,76.50,,,,76.50,,,,,,,,,,,,
PC2073WH,2073-WH,,Tropical Nine Patch Wall Hanging,81.00,,,,81.00,,,,,,,,,,,,
PC2455WH,2455-WH,,Tuscany Terrace Wall Hanging,81.00,,,,81.00,,,,,,,,,,,,
PC2459WH,2459-WH,,Hiawatha Wall Hanging,72.00,,,,72.00,,,,,,,,,,,,
PC2540WH,2540-WH,,Plentitude de Charme Wall Hanging - Small,72.00,,,,72.00,,,,,,,,,,,,
PC2717WH,2717-WH,,Caprice V Wall Hanging,76.50,,,,76.50,,,,,,,,,,,,
PC2796WH,2796-WH,,Italian Villa Wall Hanging,72.00,,,,72.00,,,,,,,,,,,,
PC2827WH,2827-WH,,Windsong Wall Hanging,72.00,,,,72.00,,,,,,,,,,,,
PC2953WH,2953-WH,,Curiosity Wall Hanging,76.50,,,,76.50,,,,,,,,,,,,
PC2975WH,2975-WH,,Summer Bloom Wall Hanging - Small,49.50,,,,49.50,,,,,,,,,,,,
PC3027WH,3027-WH,,Poet&apos;s Cause Wall Hanging - Small,72.00,,,,72.00,,,,,,,,,,,,
PC4765WH,4765-WH,,Dynasty I Wall Hanging,63.00,,,,63.00,,,,,,,,,,,,
PC5231WH,5231-WH,,French Sunflower II Wall Hanging,76.50,,,,76.50,,,,,,,,,,,,
PC5735WH,5735-WH,,Cirque Wall Hanging,80.10,,,,80.10,,,,,,,,,,,,
PC5769WH,5769-WH,,Double Opium Copper Wall Hanging,135.00,,,,135.00,,,,,,,,,,,,
PC6000WH,6000-WH,,Serengeti Elephants Wall Hanging,63.00,,,,63.00,,,,,,,,,,,,
PC6027WH,6027-WH,,Monogram Medallion L Wall Hanging,130.50,,,,130.50,,,,,,,,,,,,
PC6983WHROD6B,6983-WH,,Night and Day Tapestry Wall Hanging,247.50,,,,247.50,,,,,,,,,,,,
PC8005T,8005-T,666576810032,Great Horned Owl Blanket,22.50,,25.00,,22.50,,25.00,,,,,,,,,,
PC8122PM,8122-PM,6.66577E+11,Rimrock Red Placemat,4.05,,4.50,,4.05,,4.50,,,,,,,,,,
PCROD4B,ROD4BPcw,,Fleur de Lis Rod in Bronze Finish - 108 inch,17.99,,,,17.99,,,,,,,,,,,,
PC3063WH,3063-WH,,Full Cry Wall Hanging,72.00,,,,72.00,,,,,,,,,,,,
PC3116WH,3116-WH,,Tulip Montage Wall Hanging - Large,81.00,,,,81.00,,,,,,,,,,,,
PC3159WH,3159-WH,,Oriental Jar I Wall Hanging - Small,36.00,,,,36.00,,,,,,,,,,,,
PC3791WH,3791-WH,,Bay Regatta Wall Tapestry,72.00,,,,72.00,,,,,,,,,,,,
PC4310T,4310-T,,Horse Feathers Blanket,22.50,,,,22.50,,,,,,,,,,,,
PC4566WH,4566-WH,,Tropical Urn II Wall Hanging,76.50,,,,76.50,,,,,,,,,,,,
PC4610WH,4610-WH,,Overlook Cafe I Wall Tapestry,76.50,,,,76.50,,,,,,,,,,,,
PC1723WH,1723-WH,,Tulip Unveiled III Wall Hanging,36.00,,,,36.00,,,,,,,,,,,,
PC1750WH,1750-WH,,Royal Palms Princess of Wales Wall Hanging,30.15,,,,30.15,,,,,,,,,,,,
PC207A,207-A,,Lake Breeze Blanket,20.70,,,,20.70,,,,,,,,,,,,
PC2389WH,2389-WH,,Honeycomb Quilt Wall Hanging,76.50,,,,76.50,,,,,,,,,,,,
PC2726WH,2726-WH,,Morning in Spain Wall Hanging,76.50,,,,76.50,,,,,,,,,,,,
PC2775WH,2775-WH,,Tulip Study I Wall Hanging,36.00,,,,36.00,,,,,,,,,,,,
PC2780WH,2780-WH,,Still Life with Black and White Wall Hanging,72.00,,,,72.00,,,,,,,,,,,,
PC2826WH,2826-WH,,Bar with Pink Drink Wall Hanging,72.00,,,,72.00,,,,,,,,,,,,
PC2836WH,2836-WH,,Alpha Wall Hanging,67.50,,,,67.50,,,,,,,,,,,,
PC2848WH,2848-WH,,Summer Memories Wall Hanging - Large,72.00,,,,72.00,,,,,,,,,,,,
PC2894WH,2894-WH,,Floating Botanical Butter Wall Hanging,45.00,,,,45.00,,,,,,,,,,,,
PC3029WH,3029-WH,,Daybreak On Coast Wall Tapestry,72.00,,,,72.00,,,,,,,,,,,,
PC3053WH,3053-WH,,Source II Wall Hanging,72.00,,,,72.00,,,,,,,,,,,,
PC1281WH,1281-WH,,Tournee Chat Noir Wall Hanging,72.00,,,,72.00,,,,,,,,,,,,
PC1502WH,1502-WH,,Perfect Vintage Wall Hanging,72.00,,,,72.00,,,,,,,,,,,,
PC4761WH,4761-WH,,Floral Division Red/Gold/Black Wall Hanging,63.00,,,,63.00,,,,,,,,,,,,
PC6619T,6619-T,,Southwest Petroglyphs Blanket,22.50,,,,22.50,,,,,,,,,,,,
PC6695WHROD2B,6695-WH,,Persia Tapestry Wall Hanging - Chocolate,121.50,,,,121.50,,,,,,,,,,,,
PC8063P,8063-P,666576814061,Saddleblanket Red Pillow 17X17,13.50,,15.00,,13.50,,15.00,,,,,,,,,,
PC3187WH,3187-WH,,Row of Chairs Wall Hanging,72.00,,,,72.00,,,,,,,,,,,,
PC3211WH,3211-WH,,Boulangerie Wall Hanging,72.00,,,,72.00,,,,,,,,,,,,
PC3237WH,3237-WH,,Boulevard Wall Hanging,72.00,,,,72.00,,,,,,,,,,,,
PC3275WH,3275-WH,,Sampler I Wall Hanging,76.50,,,,76.50,,,,,,,,,,,,
PC3563WH,3563-WH,,Rooster Rustic Wall Hanging,49.50,,,,49.50,,,,,,,,,,,,
PC4088WH,4088-WH,,Peony Branch I Wall Hanging,76.50,,,,76.50,,,,,,,,,,,,
PC4157T,4157-T,,Taos Blanket,25.20,,28.00,,25.20,,28.00,,,,,,,,,,
PC1508WH,1508-WH,,Sunset Palm Wall Tapestry,72.00,,,,72.00,,,,,,,,,,,,
PC1682WH,1682-WH,,French Wine Country Wall Hanging,76.50,,,,76.50,,,,,,,,,,,,
PC1714WH,1714-WH,,Uncorked Wall Hanging,81.00,,,,81.00,,,,,,,,,,,,
PC1895WH,1895-WH,,Whimsical Dragonfly I Wall Hanging,72.00,,,,72.00,,,,,,,,,,,,
PC2272WH,2272-WH,,Summer Lily Wall Hanging - Large,117.00,,,,117.00,,,,,,,,,,,,
PC2472WH,2472-WH,,Cherished Bliss Wall Hanging,76.50,,,,76.50,,,,,,,,,,,,
PC2477WH,2477-WH,,Harmony Cotton Wall Hanging,130.50,,,,130.50,,,,,,,,,,,,
PC2824WH,2824-WH,,White Sails II Medium Wall Tapestry,81.00,,,,81.00,,,,,,,,,,,,
PC2998WH,2998-WH,,Unicorn Dips His Horn Wool Wall Hanging,184.50,,,,184.50,,,,,,,,,,,,
PC5191WH,5191-WH,,Rangoli Sunrise Wall Hanging,85.50,,,,85.50,,,,,,,,,,,,
PC-5230-WH,5230-WH,,Legend of the Fall Tapestry Wall Hanging,22.50,,,,22.50,,,,,,,,,,,,
PC5298WH,5298-WH,,Floral Division Black and White Wall Hanging,81.00,,,,81.00,,,,,,,,,,,,
PC5567WH,5567-WH,,Flower Power Wall Hanging,36.00,,,,36.00,,,,,,,,,,,,
PC5770WH,5770-WH,,Double Opium Silver Wall Hanging,135.00,,,,135.00,,,,,,,,,,,,
PC6011WH,6011-WH,,Eastward Gallop Wall Hanging,81.00,,,,81.00,,,,,,,,,,,,
PC6896WHROD9A,6896-WH,,Composition Seven Tapestry Wall Hanging,72.00,,,,72.00,,,,,,,,,,,,
PC693T,693-T,,Lighthouses of the Southeast Blanket,22.50,,,,22.50,,,,,,,,,,,,
PC3084WH,3084-WH,,Tropical Coast Wall Tapestry,72.00,,,,72.00,,,,,,,,,,,,
PC3135WH,3135-WH,,Red Tulip Study II Wall Hanging,45.00,,,,45.00,,,,,,,,,,,,
PC3292T,3292-T,,Wild Horses Green Blanket,22.50,,,,22.50,,,,,,,,,,,,
PC3421WH,3421-WH,,Gazebo Wall Hanging,76.50,,,,76.50,,,,,,,,,,,,
PC3617WH,3617-WH,,Safari Floral II Wall Hanging,45.00,,,,45.00,,,,,,,,,,,,
PC3629WH,3629-WH,,Masala Clove Wall Hanging,121.50,,,,121.50,,,,,,,,,,,,
PC3672WH,3672-WH,,Black Shinwa II Wall Hanging,36.00,,,,36.00,,,,,,,,,,,,
PC3753WH,3753-WH,,Vintage Girl Wall Hanging - Large,76.50,,,,76.50,,,,,,,,,,,,
PC4094WH,4094-WH,,Lavender Fields Wall Hanging,81.00,,,,81.00,,,,,,,,,,,,
PC4361P,4361-P,,Late Night Express Pillow,12.60,,,,12.60,,,,,,,,,,,,
PC4370WH,4370-WH,,Floral Division Gold Wall Hanging,63.00,,,,63.00,,,,,,,,,,,,
PC4577WH,4577-WH,,Vista de Deta Wall Hanging,76.50,,,,76.50,,,,,,,,,,,,
PC4683WH,4683-WH,,Wish You Were Here Medium Wall Tapestry,76.50,,,,76.50,,,,,,,,,,,,
PC1803WH,1803-WH,,June Botanical Wall Hanging,36.00,,,,36.00,,,,,,,,,,,,
PC2072WH,2072-WH,,Iris Nine Patch II Wall Hanging,81.00,,,,81.00,,,,,,,,,,,,
PC2230WH,2230-WH,,Black Poplar Wall Hanging,76.50,,,,76.50,,,,,,,,,,,,
PC2249WH,2249-WH,,Vino Wall Hanging,72.00,,,,72.00,,,,,,,,,,,,
PC2734WH,2734-WH,,Summer&apos;s Bounty Wall Hanging,90.00,,,,90.00,,,,,,,,,,,,
PC2926WH,2926-WH,,Floral Reflections II Wall Hanging,45.00,,,,45.00,,,,,,,,,,,,
PC2957WH,2957-WH,,Floating Botanicals Apricot Wall Hanging,45.00,,,,45.00,,,,,,,,,,,,
PC3057WH,3057-WH,,Hollyhock Garden II Wall Hanging - Large,81.00,,,,81.00,,,,,,,,,,,,
PC6684WHROD2A,6684-WH,,Avian Ascendance Tapestry Wall Hanging - Ruby Velvet,148.50,,,,148.50,,,,,,,,,,,,
PC6749WHROD2B,6749-WH,,Global Paradise Tapestry Wall Hanging,130.50,,,,130.50,,,,,,,,,,,,
PC6919WHROD4A,6919-WH,,Needlepoint Anenome Tapestry Wall Hanging,94.50,,,,94.50,,,,,,,,,,,,
PC8048B,8048-B,666576813576,WhirlwindSage Tote Bag,14.40,,16.00,,14.40,,16.00,,,,,,,,,,
PC8111PM,8111-PM,666576817925,Antelope Ridge Placemat,4.05,,4.50,,4.05,,4.50,,,,,,,,,,
PC8121T,8121-T,666576818588,Rimrock Tapestry Throw,25.20,,28.00,,25.20,,28.00,,,,,,,,,,
PC1099PM,1099-PM,,Wolf Lodge Placemat,4.05,,,,4.05,,,,,,,,,,,,
PC1545WH,1545-WH,,Jewel Wall Hanging,36.00,,,,36.00,,,,,,,,,,,,
PC1826WH,1826-WH,,Bel Tesoro I Wall Hanging,36.00,,,,36.00,,,,,,,,,,,,
PC1828WH,1828-WH,,Masoala Panel I Wall Tapestry,45.00,,,,45.00,,,,,,,,,,,,
PC1901WH,1901-WH,,Nature&apos;s Bounty I Wall Hanging,58.50,,,,58.50,,,,,,,,,,,,
PC2119T,2119-T,,Lighthouses of the Great Lakes II Blanket,22.50,,,,22.50,,,,,,,,,,,,
PC2265WH,2265-WH,,Bayeux Tapestry Wall Hanging,72.00,,,,72.00,,,,,,,,,,,,
PC2460WH,2460-WH,,Courtyard View II Wall Tapestry,72.00,,,,72.00,,,,,,,,,,,,
PC2732WH,2732-WH,,Classic Tails Wall Hanging - Large,72.00,,,,72.00,,,,,,,,,,,,
PC2846WH,2846-WH,,Galerie du Bord de L&apos;Eau Wall Hanging - Small,76.50,,,,76.50,,,,,,,,,,,,
PC294T,294-T,,Coastal Splendor Blanket,22.50,,,,22.50,,,,,,,,,,,,
PC3100WH,3100-WH,,Vitruvian Man Wall Hanging,72.00,,,,72.00,,,,,,,,,,,,
PC3205WH,3205-WH,,Potted Folk Floral Wall Hanging,72.00,,,,72.00,,,,,,,,,,,,
PC3675WH,3675-WH,,Fretwork Wall Hanging,49.50,,,,49.50,,,,,,,,,,,,
PC3985WH,3985-WH,,Rural Landscape II Wall Hanging,63.00,,,,63.00,,,,,,,,,,,,
PC4127WH,4127-WH,,Dancers in Blue Wall Hanging,76.50,,,,76.50,,,,,,,,,,,,
PC4712T,4712-T,,Bad Attitude Blanket,22.50,,,,22.50,,,,,,,,,,,,
PC5673WH,5673-WH,,African Trees II Wall Hanging,45.00,,,,45.00,,,,,,,,,,,,
PC5872WH,5872-WH,,The First Kiss Wall Hanging,81.00,,,,81.00,,,,,,,,,,,,
PC6034WH,6034-WH,,Monogram Medallion R Wall Hanging,130.50,,,,130.50,,,,,,,,,,,,
PC6881WHROD9B,6881-WH,,New Horizons Tapestry Wall Hanging,90.00,,,,90.00,,,,,,,,,,,,
PC6898WHROD2B,6898-WH,,Lady and the Unicorn Tapestry Wall Hanging - Taste,121.50,,,,121.50,,,,,,,,,,,,
PC6901WHROD2B,6901-WH,,Lady and the Unicorn Tapestry Wall Hanging - Sight,90.00,,,,90.00,,,,,,,,,,,,
PC6982WHROD9B,6982-WH,,New England Scene Tapestry Wall Hanging,108.00,,,,108.00,,,,,,,,,,,,
PC8058P,8058-P,666576814030,Pasqual Pillow 17X17,12.60,,,,13.50,,,,,,,,,,,,
PC8114T,8114-T,666576817826,Cimarron Tapestry Throw,25.20,,28.00,,25.20,,28.00,,,,,,,,,,
PC1100P,1100-P,,Buffalo Lodge Pillow,13.50,,15.00,,13.50,,15.00,,,,,,,,,,
PC1503WH,1503-WH,,Perfect Vintage II Wall Hanging,72.00,,,,72.00,,,,,,,,,,,,
PC1504WH,1504-WH,,Among Family Wall Hanging,72.00,,,,72.00,,,,,,,,,,,,
PC1827WH,1827-WH,,Bel Tesoro IV Wall Hanging,36.00,,,,36.00,,,,,,,,,,,,
PC1842WH,1842-WH,,Textured View I Wall Tapestry,45.00,,,,45.00,,,,,,,,,,,,
PC2024WH,2024-WH,,Red Pear Wall Hanging,49.50,,,,49.50,,,,,,,,,,,,
PC2032WH,2032-WH,,Green Apple Wall Hanging,49.50,,,,49.50,,,,,,,,,,,,
PC2058WH,2058-WH,,Harmony Wool Wall Hanging,220.50,,,,220.50,,,,,,,,,,,,
PC2187WH,2187-WH,,Grapes of Venice Wall Hanging - Large,130.50,,,,130.50,,,,,,,,,,,,
PC2227WH,2227-WH,,Poppies in Black Vase Wall Hanging,76.50,,,,76.50,,,,,,,,,,,,
PC2262WH,2262-WH,,Venetian Gondolas I Wall Hanging,81.00,,,,81.00,,,,,,,,,,,,
PC2269WH,2269-WH,,Sunlit Courtyard Wall Hanging - Large,130.50,,,,130.50,,,,,,,,,,,,
PC2697WH,2697-WH,,Poise Wall Hanging,45.00,,,,45.00,,,,,,,,,,,,
PC2809WH,2809-WH,,Summer&apos;s Bounty Wall Hanging,72.00,,,,72.00,,,,,,,,,,,,
PC2823WH,2823-WH,,No Worries Wall Tapestry,72.00,,,,72.00,,,,,,,,,,,,
PC2893WH,2893-WH,,Piano Extraordinaire Wall Hanging,81.00,,,,81.00,,,,,,,,,,,,
PC3054WH,3054-WH,,Parchment Trees I Wall Hanging,72.00,,,,72.00,,,,,,,,,,,,
PC3125WH,3125-WH,,Butterfly Dragonfly I Wall Hanging,36.00,,,,36.00,,,,,,,,,,,,
PC3139WH,3139-WH,,Pink Tulip II Wall Hanging,45.00,,,,45.00,,,,,,,,,,,,
PC3186WH,3186-WH,,Capri Wall Tapestry,76.50,,,,76.50,,,,,,,,,,,,
PC3215T,3215-T,,Moonlight Moose Blanket,22.50,,,,22.50,,,,,,,,,,,,
PC3424WH,3424-WH,,Inlet Wall Tapestry,72.00,,,,72.00,,,,,,,,,,,,
PC3619WH,3619-WH,,Expedition Wall Hanging,45.00,,,,45.00,,,,,,,,,,,,
PC3988WH,3988-WH,,Squares I Wall Hanging,76.50,,,,76.50,,,,,,,,,,,,
PC-4018-WH,4018-WH,,Ghosts of the Tall Timber Tapestry Wall Hanging,72.00,,,,72.00,,,,,,,,,,,,
PC4166P,4166-P,,Southwest Year Older Pillow,6.30,,,,6.30,,,,,,,,,,,,
PC4190WH,4190-WH,,Shell Collection Small Wall Tapestry,63.00,,,,63.00,,,,,,,,,,,,
PC4567WH,4567-WH,,Flos Solis Major Wall Hanging,76.50,,,,76.50,,,,,,,,,,,,
PC4756WH,4756-WH,,Floral Division Aqua/Brown Wall Hanging,63.00,,,,63.00,,,,,,,,,,,,
PC5742WH,5742-WH,,Chocolate Box Wall Hanging,81.00,,,,81.00,,,,,,,,,,,,
PC6026WH,6026-WH,,Monogram Medallion K Wall Hanging,130.50,,,,130.50,,,,,,,,,,,,
PC6050WH,6050-WH,,Chateau Medallion Wall Hanging,130.50,,,,130.50,,,,,,,,,,,,
PC656T,656-T,,Native American Art Blanket,22.50,,,,22.50,,,,,,,,,,,,
PC6636T,6636-T,,Southwest Geometric Deep Red Throw,25.20,,28.00,,25.20,,28.00,,,,,,,,,,
PC6653B,6653-B,,Sevah Tote Bag,14.40,,,,14.40,,,,,,,,,,,,
PC6681WHROD9B,6681-WH,,Morris Medley Tapestry Wall Hanging,225.00,,,,225.00,,,,,,,,,,,,
PC7100T,7100-T,,Pueblo Sunset Blanket,23.40,,,,23.40,,,,,,,,,,,,
PC8045T,8045-T,666576811268,Cascadia Blanket,22.50,,25.00,,22.50,,25.00,,,,,,,,,,
PC8123PM,8123-PM,6.66577E+11,Rimrock Sun Placemat,4.05,,4.50,,4.05,,4.50,,,,,,,,,,
PC1407T,1407-T,,Gone Fishing Blanket,22.50,,,,22.50,,,,,,,,,,,,
PC-1810-T,1810-LS,,Cowboy Days Throw,19.35,,,,19.35,,,,,,,,,,,,
PC1907T,1907-T,666576044635,Koko Quartet Blanket,22.50,,,,22.50,,,,,,,,,,,,
PC2260WH,2260-WH,,From the Garden I Wall Hanging,72.00,,,,72.00,,,,,,,,,,,,
PC2293WH,2293-WH,,Portieve du Char Wool Wall Hanging - Small,126.00,,,,126.00,,,,,,,,,,,,
PC2464T,2464-T,,Boston Lighthouse Blanket,22.50,,,,22.50,,,,,,,,,,,,
PC2537WH,2537-WH,,Abigail&apos;s Watch Wall Hanging,76.50,,,,76.50,,,,,,,,,,,,
PC2544WH,2544-WH,,Terrazo II Wall Tapestry,76.50,,,,76.50,,,,,,,,,,,,
PC2715WH,2715-WH,,Tulipa Vidoncello IV Wall Hanging,45.00,,,,45.00,,,,,,,,,,,,
PC2777WH,2777-WH,,Poetic Poppies Wall Hanging,76.50,,,,76.50,,,,,,,,,,,,
PC2940WH,2940-WH,,Timeless Grace I Wall Hanging,76.50,,,,76.50,,,,,,,,,,,,
PC2955WH,2955-WH,,Argenteuil Wall Tapestry,81.00,,,,81.00,,,,,,,,,,,,
PC3008WH,3008-WH,,Blossoming Elegance III Wall Hanging,76.50,,,,76.50,,,,,,,,,,,,
PC3020WH,3020-WH,,Passage to India Wall Hanging - Small,72.00,,,,72.00,,,,,,,,,,,,
PC3034WH,3034-WH,,Solar Ice II Wall Hanging,81.00,,,,81.00,,,,,,,,,,,,
PC3069WH,3069-WH,,Godspeed Wall Hanging,76.50,,,,76.50,,,,,,,,,,,,
PC3286T,3286-T,,Wild Horses Beige Blanket,22.50,,,,22.50,,,,,,,,,,,,
PC3357WH,3357-WH,,St. Moritz Cafe Wall Hanging - Small,76.50,,,,76.50,,,,,,,,,,,,
PC3575WH,3575-WH,,October Song II Wall Hanging,45.00,,,,45.00,,,,,,,,,,,,
PC3640WH,3640-WH,,Italian Country Village I Wall Hanging,117.00,,,,117.00,,,,,,,,,,,,
PC3957WH,3957-WH,,Folk Robins Wall Hanging,72.00,,,,72.00,,,,,,,,,,,,
PC4027WH,4027-WH,,Bull Terrier Wall Hanging,72.00,,,,72.00,,,,,,,,,,,,
PC4128WH,4128-WH,,Nature&apos;s Elements II Wall Hanging,81.00,,,,81.00,,,,,,,,,,,,
PC4177WH,4177-WH,,Night on the Town Wall Hanging,76.50,,,,76.50,,,,,,,,,,,,
PC4570WH,4570-WH,,Damask Coffee White Wall Hanging,63.00,,,,63.00,,,,,,,,,,,,
PC4587WH,4587-WH,,Tropical Urn I Wall Hanging - Large,117.00,,,,117.00,,,,,,,,,,,,
PC4641WH,4641-WH,,Warm Impressions Wall Hanging,63.00,,,,63.00,,,,,,,,,,,,
PC4709WH,4709-WH,,Fruit Study Natural Wall Hanging,130.50,,,,130.50,,,,,,,,,,,,
PC4719T,4719-T,,Sudden Encounter Blanket,25.20,,28.00,,25.20,,28.00,,,,,,,,,,
PC4807T,4807-T,,In Harmony Small Blanket,19.35,,,,22.05,,,,,,,,,,,,
PC5141WH,5141-WH,,Bamboo Nine Patch Wall Hanging - Small,63.00,,,,63.00,,,,,,,,,,,,
PC5284WH,5284-WH,,Autumn Glory Maple Wall Hanging,76.50,,,,76.50,,,,,,,,,,,,
PC5380P,5380-P,666576116738,Mesa Tapestry Pillow,12.60,,14.00,,12.60,,14.00,,,,,,,,,,
PC5713WH,5713-WH,,April Light Wall Hanging,81.00,,,,81.00,,,,,,,,,,,,
PC5881WH,5881-WH,,Watteau Spring II Wall Hanging,90.00,,,,90.00,,,,,,,,,,,,
PC6031WH,6031-WH,,Monogram Medallion O Wall Hanging,130.50,,,,130.50,,,,,,,,,,,,
PC6073WH,6073-WH,,Paisley Light Wall Hanging,87.30,,,,87.30,,,,,,,,,,,,
PC6643WHROD18A,6643-WH,,Union Jack Tapestry Wall Hanging,81.00,,,,81.00,,,,,,,,,,,,
PC6656WHROD5B,6656-WH,,Ornamentatia Tapestry Wall Hanging,288.00,,,,288.00,,,,,,,,,,,,
PC6658WHROD9B,6658-WH,,Unity II Tapestry Wall Hanging,81.00,,,,81.00,,,,,,,,,,,,
PC8047P,8047-P,666576813590,Whirlwind Fire Pillow,12.60,,14.00,,12.60,,14.00,,,,,,,,,,
PC815T,815-T,,Mule Deer Blanket,22.50,,,,22.50,,,,,,,,,,,,
PC918A,918-A,,Woodlands Blanket,20.70,,,,20.70,,,,,,,,,,,,
PCTASSEL2,Tassel2,,Jhalar Tassel - Beige,12.60,,,,12.60,,,,,,,,,,,,
PCTASSEL4,Tassel4,,Jhalar Tassel - Sage,12.60,,,,12.60,,,,,,,,,,,,
PC1981WH,1981-WH,,Wheatfields Cypress Wall Hanging,76.50,,,,76.50,,,,,,,,,,,,
PC2025WH,2025-WH,,Orange Wall Hanging,49.50,,,,49.50,,,,,,,,,,,,
PC2182WH,2182-WH,,Fruits of Labor Wall Hanging - Large,130.50,,,,130.50,,,,,,,,,,,,
PC2336WH,2336-WH,,Exposition Internationale Wall Hanging,72.00,,,,72.00,,,,,,,,,,,,
PC2543WH,2543-WH,,Italian Feast Wall Hanging,76.50,,,,76.50,,,,,,,,,,,,
PC2849WH,2849-WH,,Summer Memories Wall Hanging - Small,45.00,,,,45.00,,,,,,,,,,,,
PC2921WH,2921-WH,,Dress Rehearsal Wall Hanging,72.00,,,,72.00,,,,,,,,,,,,
PC2974WH,2974-WH,,Restful Moorings Small Wall Tapestry,49.50,,,,49.50,,,,,,,,,,,,
PC3112WH,3112-WH,,Mykonos II Wall Tapestry,76.50,,,,76.50,,,,,,,,,,,,
PC3360WH,3360-WH,,Running Horses Wall Hanging,76.50,,,,76.50,,,,,,,,,,,,
PC3611WH,3611-WH,,Waters Mist Wall Hanging,72.00,,,,72.00,,,,,,,,,,,,
PC3641WH,3641-WH,,Italian Country Village II Wall Hanging,117.00,,,,117.00,,,,,,,,,,,,
PC3683WH,3683-WH,,Panel of Tiles Wall Hanging - Medium,72.00,,,,72.00,,,,,,,,,,,,
PC3824WH,3824-WH,,Mexican Potted Folk Wall Hanging,72.00,,,,72.00,,,,,,,,,,,,
PC3868P,3868-P,,Southwest Geometric Flame Pillow,12.60,,,,13.50,,,,,,,,,,,,
PC3990WH,3990-WH,,Renaissance Landscape I Wall Hanging,76.50,,,,76.50,,,,,,,,,,,,
PC4059WH,4059-WH,,Silk Road Wall Hanging,112.50,,,,112.50,,,,,,,,,,,,
PC4090WH,4090-WH,,Prelude in Rust I Wall Hanging,63.00,,,,63.00,,,,,,,,,,,,
PC4149WH,4149-WH,,Lizard Mirror Wall Hanging,73.80,,,,73.80,,,,,,,,,,,,
PC4191WH,4191-WH,,Water Wall Tapestry,72.00,,,,72.00,,,,,,,,,,,,
PC4716T,4716-T,,Afternoon Procession Blanket,22.50,,,,22.50,,,,,,,,,,,,
PC4759WH,4759-WH,,Floral Division Blue/Green Wall Hanging,63.00,,,,63.00,,,,,,,,,,,,
PC5715WH,5715-WH,,Coral Fish Study Wall Hanging,81.00,,,,81.00,,,,,,,,,,,,
PC5855WH,5855-WH,,Monogram Medallion A Wall Hanging,130.50,,,,130.50,,,,,,,,,,,,
PC6619B,6619-B,,Southwest Petroglyphs Tote Bag,14.40,,,,14.40,,,,,,,,,,,,
PC2735WH,2735-WH,,Song Bird Bouquet Wall Hanging,81.00,,,,81.00,,,,,,,,,,,,
PC2914T,2914-T,,Southwest Still Life Blanket,22.50,,,,22.50,,,,,,,,,,,,
PC3120WH,3120-WH,,Light Whimsical Dragonfly I Wall Hanging,72.00,,,,72.00,,,,,,,,,,,,
PC3164WH,3164-WH,,Gods of Good Fortune Wall Hanging - Small,58.50,,,,58.50,,,,,,,,,,,,
PC3210WH,3210-WH,,Homeward Bound Wall Hanging,72.00,,,,72.00,,,,,,,,,,,,
PC3570WH,3570-WH,,Abstract Autumn Medium Wall Hanging,81.00,,,,81.00,,,,,,,,,,,,
PC3612WH,3612-WH,,River Sunrise Wall Hanging,72.00,,,,72.00,,,,,,,,,,,,
PC3649WH,3649-WH,,Dynasty II Wall Hanging,63.00,,,,63.00,,,,,,,,,,,,
PC3668WH,3668-WH,,Hip to Be Square Wall Hanging,72.00,,,,72.00,,,,,,,,,,,,
PC3790WH,3790-WH,,Pinot Wall Hanging,49.50,,,,49.50,,,,,,,,,,,,
PC4118WH,4118-WH,,Abstract Damask Flax Wall Hanging,85.50,,,,85.50,,,,,,,,,,,,
PC4613WH,4613-WH,,Sparks II Wall Hanging,76.50,,,,76.50,,,,,,,,,,,,
PC4726T,4726-T,,On the Move Blanket,22.50,,,,22.50,,,,,,,,,,,,
PC5565WH,5565-WH,,Jungle Wall Hanging,36.00,,,,36.00,,,,,,,,,,,,
PC5566WH,5566-WH,,Harbor Icons Wall Tapestry,36.00,,,,36.00,,,,,,,,,,,,
PC5737WH,5737-WH,,Amber Window Wall Hanging,90.00,,,,90.00,,,,,,,,,,,,
PC6025WH,6025-WH,,Monogram Medallion J Wall Hanging,130.50,,,,130.50,,,,,,,,,,,,
PC6644WHROD2B,6644-WH,,St. George Tapestry Wall Hanging,148.50,,,,148.50,,,,,,,,,,,,
PC8048P,8048-P,666576813620,WhirlwindSage Pillow,12.60,,14.00,,12.60,,14.00,,,,,,,,,,
PC821T,821-T,,Royal Palms Blanket,22.50,,,,22.50,,,,,,,,,,,,
PC857T,857-T,,Undersea Paradise Blanket,22.50,,,,22.50,,,,,,,,,,,,
PC1066P,1066-P,666576033424,666576033424,12.60,,,,12.60,,,,,,,,,,,,
PC1896WH,1896-WH,,Whimsical Dragonfly II Wall Hanging,72.00,,,,72.00,,,,,,,,,,,,
PC2123WH,2123-WH,,Fresco Collage Wall Hanging,184.50,,,,184.50,,,,,,,,,,,,
PC2214WH,2214-WH,,Along the Garden Path Wall Hanging,76.50,,,,76.50,,,,,,,,,,,,
PC2258WH,2258-WH,,Ancient Ruins I Wall Hanging,67.50,,,,67.50,,,,,,,,,,,,
PC2343WH,2343-WH,,Bosciani Wall Hanging,45.00,,,,45.00,,,,,,,,,,,,
PC2347WH,2347-WH,,Souvenirs des Voyage Wall Hanging,76.50,,,,76.50,,,,,,,,,,,,
PC2391T,2391-T,,Canoes Blanket,22.50,,,,22.50,,,,,,,,,,,,
PC5130WH,5130-WH,,Autumn Leaves I Wall Hanging,45.00,,,,45.00,,,,,,,,,,,,
PC5171WH,5171-WH,,Shellworks Small Wall Tapestry,63.00,,,,63.00,,,,,,,,,,,,
