PC957A,957-A,,Nautical Natural Blanket,16.20,,,,16.20,,,,,,,,,,,,
PCROD6B,ROD6BPcw,,Feather Rod in Bronze Finish - 108 inch,17.99,,,,17.99,,,,,,,,,,,,
PC1375WH,1375-WH,,Bar de L&apos;Entracte Wall Hanging,72.00,,,,72.00,,,,,,,,,,,,
PC1387WH,1387-WH,,Paperwhite II Wall Hanging,45.00,,,,45.00,,,,,,,,,,,,
PC1768WH,1768-WH,,Harvest Table Wall Hanging,72.00,,,,72.00,,,,,,,,,,,,
PC2116WH,2116-WH,,Bounds Park Oak Wall Hanging,76.50,,,,76.50,,,,,,,,,,,,
PC2183WH,2183-WH,,Musical Bouquet Wall Hanging - Large,130.50,,,,130.50,,,,,,,,,,,,
PC2337WH,2337-WH,,Pomerol Wall Hanging,72.00,,,,72.00,,,,,,,,,,,,
PC2434WH,2434-WH,,Evening Anticipation Wall Tapestry,58.50,,,,58.50,,,,,,,,,,,,
PC2476WH,2476-WH,,Summer Harvest Cotton Wall Hanging,76.50,,,,76.50,,,,,,,,,,,,
PC2596WH,2596-WH,,Cliffs Wall Hanging,144.00,,,,144.00,,,,,,,,,,,,
PC2605WH,2605-WH,,"Bless Us, Oh Lord Wall Hanging",58.50,,,,58.50,,,,,,,,,,,,
PC2765WH,2765-WH,,Summer Moments II Wall Tapestry,58.50,,,,58.50,,,,,,,,,,,,
PC2915WH,2915-WH,,Jubilation Wall Hanging,72.00,,,,72.00,,,,,,,,,,,,
PC2951WH,2951-WH,,Homestead Wall Hanging,76.50,,,,76.50,,,,,,,,,,,,
PC2977WH,2977-WH,,Unicorn Dips His Horn Wall Hanging - Small,49.50,,,,49.50,,,,,,,,,,,,
PC3115WH,3115-WH,,Magnolia Montage Wall Hanging - Large,81.00,,,,81.00,,,,,,,,,,,,
PC3153WH,3153-WH,,Butterfly Dance II Wall Hanging - Small,36.00,,,,36.00,,,,,,,,,,,,
PC3196WH,3196-WH,,Italian Still Life Wall Hanging,76.50,,,,76.50,,,,,,,,,,,,
PC3583WH,3583-WH,,Garden Magic Wall Hanging,81.00,,,,81.00,,,,,,,,,,,,
PC3650WH,3650-WH,,Paris France I Wall Hanging,72.00,,,,72.00,,,,,,,,,,,,
PC3838WH,3838-WH,,Leaf Dance II Wall Hanging,72.00,,,,72.00,,,,,,,,,,,,
PC4568WH,4568-WH,,Map of the World Wall Hanging,72.00,,,,72.00,,,,,,,,,,,,
PC4586WH,4586-WH,,Copernican System Wall Hanging,81.00,,,,81.00,,,,,,,,,,,,
PC4719WH,4719-WH,,Sudden Encounter Wall Tapestry,22.50,,,,22.50,,,,,,,,,,,,
PC5140WH,5140-WH,,Bamboo Nine Patch Large Wall Hanging,81.00,,,,81.00,,,,,,,,,,,,
PC5296WH,5296-WH,,Rangoli Raspberry Wall Hanging,85.50,,,,85.50,,,,,,,,,,,,
PC5642WH,5642-WH,,Patchwork Fairy I Wall Hanging,45.00,,,,45.00,,,,,,,,,,,,
PC5885WH,5885-WH,,Girl Defending Herself Against Love Wall Hanging,72.00,,,,72.00,,,,,,,,,,,,
PC6651WHROD2B,6651-WH,,Strawberry Thief Tapestry Wall Hanging,225.00,,,,225.00,,,,,,,,,,,,
PCTASSEL19,Tassel19,,Ellora Tassel- Black,12.60,,,,12.60,,,,,,,,,,,,
PC1576WH,1576-WH,,Visual Pattern II Wall Hanging,81.00,,,,81.00,,,,,,,,,,,,
PC1630WH,1630-WH,,Exotic Retreat I Wall Tapestry,81.00,,,,81.00,,,,,,,,,,,,
PC203A,203-A,,Seashells by the Seashore Blanket,20.70,,,,20.70,,,,,,,,,,,,
PC2076WH,2076-WH,,Tulip Bordeaux Wall Hanging,76.50,,,,76.50,,,,,,,,,,,,
PC2147WH,2147-WH,,Mother&apos;s Bouquet Wall Hanging - Small,72.00,,,,72.00,,,,,,,,,,,,
PC2185WH,2185-WH,,Magnolia Crimson Chenille Wall Hanging,90.00,,,,90.00,,,,,,,,,,,,
PC2317WH,2317-WH,,Gray Wolf Wall Tapestry,22.50,,,,22.50,,,,,,,,,,,,
PC2383WH,2383-WH,,La Vendages Wall Hanging,130.50,,,,130.50,,,,,,,,,,,,
PC2703WH,2703-WH,,Elkington&apos;s Cloisonne Wall Hanging,117.00,,,,117.00,,,,,,,,,,,,
PC2713WH,2713-WH,,My Fair Lady I Wall Hanging,76.50,,,,76.50,,,,,,,,,,,,
PC2722WH,2722-WH,,My Fair Lady II Wall Hanging,76.50,,,,76.50,,,,,,,,,,,,
PC2885WH,2885-WH,,Jennie&apos;s Mantle II Wall Hanging,76.50,,,,76.50,,,,,,,,,,,,
PC3089WH,3089-WH,,Apple Tree with Red Fruit Wall Hanging,81.00,,,,81.00,,,,,,,,,,,,
PC3092WH,3092-WH,,Lady with Fan Wall Hanging,76.50,,,,76.50,,,,,,,,,,,,
PC3343WH,3343-WH,,Geese Lodge Wall Tapestry,22.50,,,,22.50,,,,,,,,,,,,
PC3504WH,3504-WH,,Provence Interior II Wall Hanging,76.50,,,,76.50,,,,,,,,,,,,
PC3651WH,3651-WH,,Italian Country Village II Wall Hanging,76.50,,,,76.50,,,,,,,,,,,,
PC3695WH,3695-WH,,Masala Anise Wall Hanging,121.50,,,,121.50,,,,,,,,,,,,
PC3874P,3874-P,,Southwest Geometric Tan Pillow,12.60,,,,12.60,,,,,,,,,,,,
PC3996WH,3996-WH,,Reflejos en el Lago Wall Tapestry,76.50,,,,76.50,,,,,,,,,,,,
PC4065WH,4065-WH,,Acanthus Vine Wall Hanging - Large,157.50,,,,157.50,,,,,,,,,,,,
PC4565WH,4565-WH,,Tropical Urn I Wall Hanging,76.50,,,,76.50,,,,,,,,,,,,
PC4575WH,4575-WH,,Vino de Tuscany Wall Hanging,76.50,,,,76.50,,,,,,,,,,,,
PC4720T,4720-T,,Morning View Blanket,22.50,,,,22.50,,,,,,,,,,,,
PC5128WH,5128-WH,,Daisy Bouquet Wall Hanging,54.00,,,,54.00,,,,,,,,,,,,
PC5261WH,5261-WH,,Arabian Nights I Wall Hanging,81.00,,,,81.00,,,,,,,,,,,,
PC5265WH,5265-WH,,Minuet II Wall Hanging,45.00,,,,45.00,,,,,,,,,,,,
PC5378P,5378-P,666576815983,Sun & Sky Pillow,12.60,,14.00,,12.60,,14.00,,,,,,,,,,
PC5724WH,5724-WH,,Hillside Cafe Wall Hanging,76.50,,,,76.50,,,,,,,,,,,,
PC5767WH,5767-WH,,Autumn Mosaic Wall Hanging,130.50,,,,130.50,,,,,,,,,,,,
PC5862WH,5862-WH,,Unity Wall Hanging,45.00,,,,45.00,,,,,,,,,,,,
PC3893T,3893-T,,Antler Lodge Tapestry Blanket,22.50,,,,22.50,,,,,,,,,,,,
PC3902P,3902-P,,Southwest Sampler Sunset Pillow,13.50,,15.00,,13.50,,15.00,,,,,,,,,,
PC4019WH,4019-WH,,Cache Pot Quad Wall Hanging,58.50,,,,58.50,,,,,,,,,,,,
PC4033WH,4033-WH,,Blooming Lily Wall Hanging,63.00,,,,63.00,,,,,,,,,,,,
PC4143WH,4143-WH,,Damaskerade Wall Hanging,76.50,,,,76.50,,,,,,,,,,,,
PC4640WH,4640-WH,,Marine Impressions Wall Hanging,63.00,,,,63.00,,,,,,,,,,,,
PC4760WH,4760-WH,,Floral Division Blue/Oyster Wall Hanging,63.00,,,,63.00,,,,,,,,,,,,
PC5568WH,5568-WH,,Cowboy Wall Hanging,45.00,,,,45.00,,,,,,,,,,,,
PC5630WH,5630-WH,,On Safari Wall Hanging,58.50,,,,58.50,,,,,,,,,,,,
PC5726WH,5726-WH,,Gothic Cross Wall Hanging,72.00,,,,72.00,,,,,,,,,,,,
PC5733WH,5733-WH,,Autumn Fusion I Wall Hanging,67.50,,,,67.50,,,,,,,,,,,,
PC5798WH,5798-WH,,Temple Tree of Life Wall Hanging,216.00,,,,216.00,,,,,,,,,,,,
PC6068WH,6068-WH,,Kiss Captured Wall Hanging,198.00,,,,198.00,,,,,,,,,,,,
PC695T,695-T,,Lighthouses of New England Blanket,22.50,,,,22.50,,,,,,,,,,,,
PC8049T,8049-T,666576813521,WhirlwindSand Tapestry Throw,22.50,,,,25.20,,,,,,,,,,,,
PC8126T,8126-T,6.66577E+11,Rimrock Sandstone Tapestry Throw,25.20,,28.00,,25.20,,28.00,,,,,,,,,,
PCROD5B,ROD-5B,,752122284478,19.99,,,,19.99,,,,,,,,,,,,
PC1438WH,1438-WH,,Maurice Wall Hanging,72.00,,,,72.00,,,,,,,,,,,,
PC1447WH,1447-WH,,Old World Map Wall Hanging,72.00,,,,72.00,,,,,,,,,,,,
PC1519WH,1519-WH,,Lodge at Lake Como Wall Hanging - Small,72.00,,,,72.00,,,,,,,,,,,,
PC1570WH,1570-WH,,Sun Filled Chintz Wall Hanging,72.00,,,,72.00,,,,,,,,,,,,
PC1575WH,1575-WH,,Visual Pattern I Wall Hanging,81.00,,,,81.00,,,,,,,,,,,,
PC1752WH,1752-WH,,Royal Palms Duke of Chaulhes Wall Hanging,30.15,,,,30.15,,,,,,,,,,,,
PC2148WH,2148-WH,,Musical Bouquet Wall Hanging - Small,72.00,,,,72.00,,,,,,,,,,,,
PC2151WH,2151-WH,,Fruits of Labor Wall Hanging - Small,76.50,,,,76.50,,,,,,,,,,,,
PC2181WH,2181-WH,,Flowers of Harmony Wall Hanging - Large,130.50,,,,130.50,,,,,,,,,,,,
PC2198WH,2198-WH,,Date to Remember Wall Hanging - Large,112.50,,,,112.50,,,,,,,,,,,,
PC2201WH,2201-WH,,Radiance Wall Hanging,81.00,,,,81.00,,,,,,,,,,,,
PC2257WH,2257-WH,,Ancient Ruins II Wall Hanging,67.50,,,,67.50,,,,,,,,,,,,
PC2292WH,2292-WH,,Verdure with Animals Wool Wall Hanging - Small,126.00,,,,126.00,,,,,,,,,,,,
PC2457WH,2457-WH,,Terrazo I Wall Tapestry,72.00,,,,72.00,,,,,,,,,,,,
PC2709WH,2709-WH,,Blue Boat Wall Hanging,85.50,,,,85.50,,,,,,,,,,,,
PC2711WH,2711-WH,,Garden On the Cote D&apos;Azur Large Wall Tapestry,130.50,,,,130.50,,,,,,,,,,,,
PC2738WH,2738-WH,,Cliffs of the Upper Colorado Wall Hanging,72.00,,,,72.00,,,,,,,,,,,,
PC2750WH,2750-WH,,The Kiss Wall Hanging - Large,130.50,,,,130.50,,,,,,,,,,,,
PC2782WH,2782-WH,,Courtyard Vista Wall Hanging,76.50,,,,76.50,,,,,,,,,,,,
PC2787WH,2787-WH,,Oriental Still Life with Lilies Wall Hanging - Small,72.00,,,,72.00,,,,,,,,,,,,
PC3067WH,3067-WH,,Symphony in Red and Khaki I Wall Hanging - Small,49.50,,,,49.50,,,,,,,,,,,,
PC3152WH,3152-WH,,Butterfly Dance I Wall Hanging - Small,36.00,,,,36.00,,,,,,,,,,,,
PC3235WH,3235-WH,,Manhattan Cocktail Wall Hanging,49.50,,,,49.50,,,,,,,,,,,,
PC3411WH,3411-WH,,Framed Peacocks Wall Hanging,76.50,,,,76.50,,,,,,,,,,,,
PC3661WH,3661-WH,,Frankie Fingertips Wall Hanging - Small,36.00,,,,36.00,,,,,,,,,,,,
PC3696WH,3696-WH,,Orient Blush Wall Hanging,94.50,,,,94.50,,,,,,,,,,,,
PC3751WH,3751-WH,,Bass Attack Wall Tapestry,22.50,,,,26.10,,,,,,,,,,,,
PC3890B,3890-B,,Sunset Run Tote Bag,16.20,,18.00,,16.20,,18.00,,,,,,,,,,
PC3885T,3885-T,,Steppin&apos; Out Blanket,22.50,,,,22.50,,,,,,,,,,,,
PC3963P,3963-P,,Live Southwest Pillow,6.30,,,,6.30,,,,,,,,,,,,
PC4110WH,4110-WH,,Wheatfield with Crows Wall Hanging,58.50,,,,58.50,,,,,,,,,,,,
PC4469WH,4469-WH,,Playful Sea Wall Tapestry,63.00,,,,63.00,,,,,,,,,,,,
PC4752WH,4752-WH,,Iconic Capital Wall Hanging,81.00,,,,81.00,,,,,,,,,,,,
PC5233WH,5233-WH,,Lotus II Wall Hanging,54.00,,,,54.00,,,,,,,,,,,,
PC5238WH,5238-WH,,Floral Division Sage/Pink Wall Hanging - Large,81.00,,,,81.00,,,,,,,,,,,,
PC5305WH,5305-WH,,Come Dance with Me Wall Hanging,67.50,,,,67.50,,,,,,,,,,,,
PC5516P,5516-P,,Teec Nos Pos Pillow,12.60,,,,12.60,,,,,,,,,,,,
PC5811WH,5811-WH,,Guiding Angel Wall Hanging,76.50,,,,76.50,,,,,,,,,,,,
PC5930WH,5930-WH,,Paisley Dark Wall Hanging,87.30,,,,87.30,,,,,,,,,,,,
PC6046WH,6046-WH,,The Accolade Wall Hanging - Small,49.50,,,,49.50,,,,,,,,,,,,
PC6160WH,6160-WH,,Lighthouse Window Wall Tapestry,80.10,,,,80.10,,,,,,,,,,,,
PC6646WHROD9A,6646-WH,,Ascendance Long Tapestry Wall Hanging - Dawn,130.50,,,,130.50,,,,,,,,,,,,
PC8113B,8113-B,666576817895,Antelope Ridge Juniper Tote Bag,16.65,,18.50,,16.65,,18.50,,,,,,,,,,
PC1708WH,1708-WH,,Old World Palm II Wall Hanging,45.00,,,,45.00,,,,,,,,,,,,
PC1710WH,1710-WH,,Morning Retreat Wall Tapestry,76.50,,,,76.50,,,,,,,,,,,,
PC1722WH,1722-WH,,Tulip Unveiled II Wall Hanging,36.00,,,,36.00,,,,,,,,,,,,
PC2074WH,2074-WH,,Ocean Narcissus Wall Tapestry,72.00,,,,72.00,,,,,,,,,,,,
PC2294WH,2294-WH,,Frutti D&apos;Estate Wall Hanging - Small,76.50,,,,76.50,,,,,,,,,,,,
PC2751WH,2751-WH,,The Kiss Wall Hanging - Small,90.00,,,,90.00,,,,,,,,,,,,
PC3204WH,3204-WH,,Northern Exposure I Wall Tapestry,22.50,,,,22.50,,,,,,,,,,,,
PC3439WH,3439-WH,,Empire Urn I Noir Wall Hanging,36.00,,,,36.00,,,,,,,,,,,,
PC5376T,5376-T,,Paraguay Blanket,22.50,,,,22.50,,,,,,,,,,,,
PC5739WH,5739-WH,,Silk Road Turquoise Wall Hanging,112.50,,,,112.50,,,,,,,,,,,,
PC5996WH,5996-WH-ROD-7A,,Bohemian Paisley Wall Hanging,76.50,,,,76.50,,,,,,,,,,,,
PC6638P,6638-P,666576705536,Turquoise Peaks Southwest Geometric Pillow,12.60,,14.00,,12.60,,14.00,,,,,,,,,,
PC3079WH,3079-WH,,Temple of Flora Wall Hanging - Small,49.50,,,,49.50,,,,,,,,,,,,
PC3609WH,3609-WH,,Drinks Wall Hanging,72.00,,,,72.00,,,,,,,,,,,,
PC3616WH,3616-WH,,Safari Floral I Wall Hanging,45.00,,,,45.00,,,,,,,,,,,,
PC3674WH,3674-WH,,Iron Work Black and White Wall Hanging,81.00,,,,81.00,,,,,,,,,,,,
PC3697WH,3697-WH,,Windsong Blue Wall Hanging,94.50,,,,94.50,,,,,,,,,,,,
PC3783WH,3783-WH,,Garden Cabinet Wall Hanging,49.50,,,,49.50,,,,,,,,,,,,
PC3785WH,3785-WH,,"Horse Red, White and Blue Wall Hanging",58.50,,,,58.50,,,,,,,,,,,,
PC3967T,3967-T,,Southwest Butte Clay Blanket,25.20,,28.00,,25.20,,28.00,,,,,,,,,,
PC3995WH,3995-WH,,Ginger Jar Wall Hanging,76.50,,,,76.50,,,,,,,,,,,,
PC4120WH,4120-WH,,A New and Accurate Map Wall Hanging - Large,117.00,,,,117.00,,,,,,,,,,,,
PC4170WH,4170-WH,,Flower Guard Wall Hanging,45.00,,,,45.00,,,,,,,,,,,,
PC1099WH,1099-WH,,Wolf Lodge Wall Tapestry,26.10,,29.00,,26.10,,29.00,,,,,,,,,,
PC-1099WH,PC-1099WH,,Wolf Wall hanging,25.00,,,,25.00,,,,,,,,,,,,
PC1111WH,1111-WH,,Souls of Poets Wall Hanging - Large,130.50,,,,130.50,,,,,,,,,,,,
PC1592WH,1592-WH,,Pompeian Pears Wall Hanging,81.00,,,,81.00,,,,,,,,,,,,
PC1728WH,1728-WH,,Grapes and Labels IV Wall Hanging,36.00,,,,36.00,,,,,,,,,,,,
PC2028WH,2028-WH,,Elephant Tribute Wall Hanging,72.00,,,,72.00,,,,,,,,,,,,
PC2102WH,2102-WH,,Kimono Orchid Crimson I Wall Hanging,36.00,,,,36.00,,,,,,,,,,,,
PC2278WH,2278-WH,,Verdure with Animals Wool Wall Hanging - Large,216.00,,,,216.00,,,,,,,,,,,,
PC2316PM,2316-PM,,Caribou Placemat,4.05,,,,4.05,,,,,,,,,,,,
PC2393T,2393-T,,Pheasant Feathers Blanket,22.50,,,,22.50,,,,,,,,,,,,
PC2812WH,2812-WH,,Budding Artist Wall Hanging,76.50,,,,76.50,,,,,,,,,,,,
PC2959WH,2959-WH,,Floating Botanicals Rain Wall Hanging,45.00,,,,45.00,,,,,,,,,,,,
PC8122T,8122-T,6.66577E+11,Rimrock Red Tapestry Throw,25.20,,28.00,,25.20,,28.00,,,,,,,,,,
PC4561WH,4561-WH,,Nautical Motif Wall Tapestry,72.00,,,,72.00,,,,,,,,,,,,
PC4629WH,4629-WH,,Leopard with Rosette Wall Hanging,63.00,,,,63.00,,,,,,,,,,,,
PC4751WH,4751-WH,,Giraffe with Rosette Wall Hanging,63.00,,,,63.00,,,,,,,,,,,,
PC4777WH,4777-WH,,The Music Room Monet Wall Hanging,117.00,,,,117.00,,,,,,,,,,,,
PC5242WH,5242-WH,,Pergola in Amalfi Wall Tapestry,72.00,,,,72.00,,,,,,,,,,,,
PC5716WH,5716-WH,,Tuscan Valley View Wall Hanging - Small,31.50,,,,31.50,,,,,,,,,,,,
PC6663WHROD9B,6663-WH,,Wisteria with House Finch Tapestry Wall Hanging,247.50,,,,247.50,,,,,,,,,,,,
PC8111T,8111-T,666576817727,Antelope Ridge Tapestry Throw,25.20,,28.00,,25.20,,28.00,,,,,,,,,,
PC3056WH,3056-WH,,Abbazia Wall Hanging,72.00,,,,72.00,,,,,,,,,,,,
PC3070WH,3070-WH,,The Accolade Wall Hanging,76.50,,,,76.50,,,,,,,,,,,,
PC3080WH,3080-WH,,Temple of Flora Wall Hanging - Large,76.50,,,,76.50,,,,,,,,,,,,
PC3271WH,3271-WH,,Red Tapestry Wall Hanging,22.50,,,,22.50,,,,,,,,,,,,
PC3340WH,3340-WH,,Deer Lodge Wall Tapestry,26.10,,29.00,,26.10,,29.00,,,,,,,,,,
PC3568WH,3568-WH,,Marions Wall Hanging,81.00,,,,81.00,,,,,,,,,,,,
PC3587WH,3587-WH,,Topiary Garden Wall Hanging,72.00,,,,72.00,,,,,,,,,,,,
PC3776WH,3776-WH,,Elkington&apos;s Cloisonne Wall Hanging - Small,54.00,,,,54.00,,,,,,,,,,,,
PC3858WH,3858-WH,,Terra Nova II Wall Hanging - Small,63.00,,,,63.00,,,,,,,,,,,,
PC3986WH,3986-WH,,Nature&apos;s Spheres I Wall Hanging,72.00,,,,72.00,,,,,,,,,,,,
PC4071WH,4071-WH,,Poppy Tango Wall Hanging,81.00,,,,81.00,,,,,,,,,,,,
PC4116WH,4116-WH,,Classic Porcelain Wall Hanging,63.00,,,,63.00,,,,,,,,,,,,
PC4346T,4346-T,,Kokopelli Pot Blanket,22.50,,,,22.50,,,,,,,,,,,,
PC1527WH,1527-WH,,Vogue Silhouette Wall Hanging,45.00,,,,45.00,,,,,,,,,,,,
PC2241WH,2241-WH,,Parterre de la Vierge Wall Hanging - Large,130.50,,,,130.50,,,,,,,,,,,,
PC2270WH,2270-WH,,Aix en Provence Wall Hanging - Large,117.00,,,,117.00,,,,,,,,,,,,
PC2271WH,2271-WH,,Seaside Fountain Large Wall Tapestry,144.00,,,,144.00,,,,,,,,,,,,
PC2334WH,2334-WH,,Chablis &apos;27 Wall Hanging,72.00,,,,72.00,,,,,,,,,,,,
PC2401WH,2401-WH,,Squaws Wall Hanging,76.50,,,,76.50,,,,,,,,,,,,
PC2427WH,2427-WH,,Oleanders Wall Hanging,72.00,,,,72.00,,,,,,,,,,,,
PC2480WH,2480-WH,,Verdure with Animals Cotton Wall Hanging,76.50,,,,76.50,,,,,,,,,,,,
PC2773WH,2773-WH,,Nova Terrarum Orbis Wall Hanging,130.50,,,,130.50,,,,,,,,,,,,
PC8125P,8125-P,6.66577E+11,Rimrock Spring Pillow,16.65,,18.50,,16.65,,18.50,,,,,,,,,,
PCROD12B,ROD12BPcw,,Square Rod in Satin Nickel Finish - 108 inch,17.99,,,,17.99,,,,,,,,,,,,
PC4585WH,4585-WH,,Romantic Urn II Wall Hanging,63.00,,,,63.00,,,,,,,,,,,,
PC4753T,4753-T,,Buffalo Nation Blanket,25.20,,28.00,,25.20,,28.00,,,,,,,,,,
PC4816WH,4816-WH,,Epic Wall Hanging,117.00,,,,117.00,,,,,,,,,,,,
PC5240WH,5240-WH,,"Floral Division Red, Gold and Black Wall Hanging",81.00,,,,81.00,,,,,,,,,,,,
PC5264WH,5264-WH,,Minuet I Wall Hanging,45.00,,,,45.00,,,,,,,,,,,,
PC5514WH,5514-WH,,Cherry Blossom Wall Hanging,49.50,,,,49.50,,,,,,,,,,,,
PC5731WH,5731-WH,,Exotic Journey Wall Hanging,90.00,,,,90.00,,,,,,,,,,,,
PC5859WH,5859-WH,,Gardens in the Mist Wall Hanging,45.00,,,,45.00,,,,,,,,,,,,
PC5931WH,5931-WH,,Antique Tapestry Wall Hanging,76.50,,,,76.50,,,,,,,,,,,,
PC6454WH,6454-WH,,North Slope Wall Tapestry,135.00,,,,135.00,,,,,,,,,,,,
PC6608WHROD9B,6608-WH,,Regal Crest Tapestry Wall Hanging,297.00,,,,297.00,,,,,,,,,,,,
PC8115PM,8115-PM,666576818441,Cimarron Turquoise Placemat,4.05,,4.50,,4.05,,4.50,,,,,,,,,,
PC3004WH,3004-WH,,Symphony in Red and Khaki Wall Hanging,81.00,,,,81.00,,,,,,,,,,,,
PC3117WH,3117-WH,,Magnolia Montage Wall Hanging - Small,49.50,,,,49.50,,,,,,,,,,,,
PC3127WH,3127-WH,,Haute Pink Medallion Trio Wall Hanging,45.00,,,,45.00,,,,,,,,,,,,
PC3226WH,3226-WH,,L&apos;Essence II Wall Hanging,81.00,,,,81.00,,,,,,,,,,,,
PC3610WH,3610-WH,,Persimmon Forest Wall Hanging,81.00,,,,81.00,,,,,,,,,,,,
PC3676WH,3676-WH,,Edinburgh Scroll Wall Hanging,76.50,,,,76.50,,,,,,,,,,,,
PC3882T,3882-T,,Western Slant Shadows Blanket,22.50,,,,22.50,,,,,,,,,,,,
PC3889P,3889-P,666576105244,Indian Market Pillow,12.60,,,,12.60,,,,,,,,,,,,
PC4029WH,4029-WH,,October Song I Wall Hanging,45.00,,,,45.00,,,,,,,,,,,,
PC1276WH,1276-WH,,Cinzano Wall Hanging,72.00,,,,72.00,,,,,,,,,,,,
PC1300WH,1300-WH,,Golden Warmth Wall Hanging,81.00,,,,81.00,,,,,,,,,,,,
PC1336T,1336-T,,Lighthouses of the Northwest Blanket,22.50,,,,22.50,,,,,,,,,,,,
PC1344WH,1344-WH,,Van Gogh&apos;s Irises Wall Hanging,72.00,,,,72.00,,,,,,,,,,,,
PC1597WH,1597-WH,,Le Cafe Wall Hanging,45.00,,,,45.00,,,,,,,,,,,,
PC1911T,1911-T,,Showing Off Blanket,22.50,,,,22.50,,,,,,,,,,,,
PC1921PM,1921-PM,,Adirondack Lodge Placemat,4.05,,,,4.05,,,,,,,,,,,,
PC2077WH,2077-WH,,Courtyard Bicycle Wall Hanging,72.00,,,,72.00,,,,,,,,,,,,
PC2222WH,2222-WH,,Nostalgia Wall Hanging,72.00,,,,72.00,,,,,,,,,,,,
PC2279WH,2279-WH,,Le Chateau de Monceau Wall Hanging,184.50,,,,184.50,,,,,,,,,,,,
PC2429WH,2429-WH,,Magnolia Reflections Wall Hanging,72.00,,,,72.00,,,,,,,,,,,,
PC2539WH,2539-WH,,Italian Feast Wall Hanging - Large,117.00,,,,117.00,,,,,,,,,,,,
PC2889WH,2889-WH,,Jazz Reflections I Wall Hanging - OVERSTOCK,72.00,,,,72.00,,,,,,,,,,,,
PC2963WH,2963-WH,,The Gate Wall Hanging,76.50,,,,76.50,,,,,,,,,,,,
PC8117PM,8117-PM,666576818465,Concho Springs Rose Placemat,4.05,,4.50,,4.05,,4.50,,,,,,,,,,
PC8121PM,8121-PM,6.66577E+11,Rimrock Placemat,4.05,,4.50,,4.05,,4.50,,,,,,,,,,
PC4558WH,4558-WH,,Violet Boat Wall Tapestry,72.00,,,,72.00,,,,,,,,,,,,
PC5236WH,5236-WH,,Garden Celebrations Large Wall Hanging,81.00,,,,81.00,,,,,,,,,,,,
PC5256WH,5256-WH,,Panelled Detail of Turkeys Wall Hanging,94.50,,,,94.50,,,,,,,,,,,,
PC5257WH,5257-WH,,Panelled Detail of Hens Wall Hanging,94.50,,,,94.50,,,,,,,,,,,,
PC5273WH,5273-WH,,Pink Fun Wall Hanging,63.00,,,,63.00,,,,,,,,,,,,
PC6588WHROD5B,6588-WH,,Otomi Tapestry Wall Hanging - Platinum,126.00,,,,126.00,,,,,,,,,,,,
PC6894WHROD6B,6894-WH,,Amazonas Tapestry Wall Hanging,112.50,,,,112.50,,,,,,,,,,,,
PC2978WH,2978-WH,,White Sails I Small Wall Tapestry,49.50,,,,49.50,,,,,,,,,,,,
PC3075WH,3075-WH,,Amalfi Dai Cappuccini Wall Hanging - Large,130.50,,,,130.50,,,,,,,,,,,,
PC3201WH,3201-WH,,Music in the Garden Wall Hanging,76.50,,,,76.50,,,,,,,,,,,,
PC3216WH,3216-WH,,Moonlight Moose Small Wall Tapestry,31.50,,,,31.50,,,,,,,,,,,,
PC3230WH,3230-WH,,Venetian Light Wall Hanging,76.50,,,,76.50,,,,,,,,,,,,
PC3412WH,3412-WH,,Tropical Flowers Wall Tapestry,72.00,,,,72.00,,,,,,,,,,,,
PC3431WH,3431-WH,,Portofino Wall Tapestry,72.00,,,,72.00,,,,,,,,,,,,
PC4117WH,4117-WH,,A New and Accurate Map Wall Hanging,63.00,,,,63.00,,,,,,,,,,,,
PC1496WH,1496-WH,,Corner Cafe Wall Hanging,81.00,,,,81.00,,,,,,,,,,,,
PC1505WH,1505-WH,,Protecting Her Cubs Wall Hanging,72.00,,,,72.00,,,,,,,,,,,,
PC1806WH,1806-WH,,September Botanical Wall Hanging,36.00,,,,36.00,,,,,,,,,,,,
PC1906T,1906-T,,Horses of Zia Blanket,22.50,,,,22.50,,,,,,,,,,,,
PC1913WH,1913-WH,,Rose Arch Wall Tapestry,72.00,,,,72.00,,,,,,,,,,,,
PC2742WH,2742-WH,,Paradise Sunset Wall Tapestry,72.00,,,,72.00,,,,,,,,,,,,
PC2932T,2932-T,,Southwest Salmon Blanket,22.50,,,,22.50,,,,,,,,,,,,
PC8118B,8118-B,6.66577E+11,Concho Springs Red Tote Bag,16.65,,18.50,,16.65,,18.50,,,,,,,,,,
PC4791WH,4791-WH,,Glimpse Wall Hanging,81.00,,,,81.00,,,,,,,,,,,,
PC2149WH,2149-WH,,Grapes of Venice Wall Hanging - Small,72.00,,,,72.00,,,,,,,,,,,,
PC2193WH,2193-WH,,Vin Rouge Panel Wall Hanging,67.50,,,,67.50,,,,,,,,,,,,
PC2335WH,2335-WH,,Exposition Universelle Wall Hanging,72.00,,,,72.00,,,,,,,,,,,,
PC2439T,2439-T,,Pineapples and Fruit Blanket,22.50,,,,22.50,,,,,,,,,,,,
PC2895WH,2895-WH,,Jazz Medley I Wall Hanging,72.00,,,,72.00,,,,,,,,,,,,
PC8121B,8121-B,6.66577E+11,Rimrock Tote Bag,16.65,,18.50,,16.65,,18.50,,,,,,,,,,
PC4830WH,4830-WH,,Reverie Wall Hanging,72.00,,,,72.00,,,,,,,,,,,,
PC5810WH,5810-WH,,Angels Playing Violin Wall Hanging,72.00,,,,72.00,,,,,,,,,,,,
PC6186T,6186-T,,Beach Babies Blanket,22.50,,,,22.50,,,,,,,,,,,,
PC6636B,6636-B,,Southwest Geometric Deep Red Tote Bag,16.20,,18.00,,16.20,,18.00,,,,,,,,,,
PC6887WHROD9A,6887-WH,,Free Fall II Tapestry Wall Hanging,72.00,,,,72.00,,,,,,,,,,,,
PC6888WHROD12A,6888-WH,,Suzani Rosettes Tapestry Wall Hanging,112.50,,,,112.50,,,,,,,,,,,,
PC6918WHROD4A,6918-WH,,Needlepoint Tulip Tapestry Wall Hanging,94.50,,,,94.50,,,,,,,,,,,,
PC8057P,8057-P,666576814023,Chimayo Pillow Large,12.60,,14.00,,12.60,,14.00,,,,,,,,,,
PC8113PM,8113-PM,666576817963,Antelope Ridge Juniper Placemat,4.05,,4.50,,4.05,,4.50,,,,,,,,,,
PC2966WH,2966-WH,,White Sails II Small Wall Tapestry,49.50,,,,49.50,,,,,,,,,,,,
PC3251WH,3251-WH,,Tuscan Sunlight I Wall Hanging,76.50,,,,76.50,,,,,,,,,,,,
PC3621WH,3621-WH,,Paradise Plum Wall Hanging,117.00,,,,117.00,,,,,,,,,,,,
PC3684WH,3684-WH,,Cloisonne Jet Wall Hanging,94.50,,,,94.50,,,,,,,,,,,,
PC3715WH,3715-WH,,Bedazzle Wall Hanging,76.50,,,,76.50,,,,,,,,,,,,
PC3873T,3873-T,,Southwest Saddleblanket Gold Throw,22.50,,,,22.50,,,,,,,,,,,,
PC4038WH,4038-WH,,Patio View Wall Hanging,72.00,,,,72.00,,,,,,,,,,,,
PC2132WH,2132-WH,,Fruit Medley Wall Hanging - Small,76.50,,,,76.50,,,,,,,,,,,,
PC2202WH,2202-WH,,Love Letters Wall Hanging,76.50,,,,76.50,,,,,,,,,,,,
PC2239WH,2239-WH,,Sonoran Sentinels Wall Hanging,76.50,,,,76.50,,,,,,,,,,,,
PC2323WH,2323-WH,,In His Domain Wall Tapestry,22.50,,,,22.50,,,,,,,,,,,,
PC2430WH,2430-WH,,Early Autumn Crossing Wall Hanging,76.50,,,,76.50,,,,,,,,,,,,
PC2431WH,2431-WH,,Afternoon Retreat Wall Hanging,76.50,,,,76.50,,,,,,,,,,,,
PC2748WH,2748-WH,,Brown Pelican Wall Hanging,40.50,,,,40.50,,,,,,,,,,,,
PC2749WH,2749-WH,,Grand Staircase Wall Hanging,45.00,,,,45.00,,,,,,,,,,,,
PC2755WH,2755-WH,,My Villa in Tuscany Wall Hanging,58.50,,,,58.50,,,,,,,,,,,,
PC2763WH,2763-WH,,World Map Wall Hanging,76.50,,,,76.50,,,,,,,,,,,,
PC2905WH,2905-WH,,Tropical Bouquet Wall Hanging,72.00,,,,72.00,,,,,,,,,,,,
PC2923WH,2923-WH,,Poetic Grapes Wall Hanging,45.00,,,,45.00,,,,,,,,,,,,
PC8124PM,8124-PM,6.66577E+11,Rimrock Dusk Placemat,4.05,,4.50,,4.05,,4.50,,,,,,,,,,
PCROD4A,ROD4APcw,,Fleur de Lis Rod in Bronze Finish - 48 inch,17.99,,,,17.99,,,,,,,,,,,,
PCTASSEL5,Tassel5,,Jhalar Tassel - Earth,12.60,,,,12.60,,,,,,,,,,,,
PC4571WH,4571-WH,,Home Sweet Home Wall Hanging,72.00,,,,72.00,,,,,,,,,,,,
PC4580WH,4580-WH,,Cupidon Wall Hanging,76.50,,,,76.50,,,,,,,,,,,,
PC4596WH,4596-WH,,Great Wave at Kanagawa Wall Tapestry,72.00,,,,72.00,,,,,,,,,,,,
PC4758WH,4758-WH,,Floral Division Sage/Pink Wall Hanging,63.00,,,,63.00,,,,,,,,,,,,
PC4808WH,4808-WH,,Birchwood Buck Wall Tapestry,81.00,,,,81.00,,,,,,,,,,,,
PC5243WH,5243-WH,,Pergola in Amalfi Large Wall Tapestry,117.00,,,,117.00,,,,,,,,,,,,
PC5378T,5378-T,,Kilim Blanket,22.50,,,,22.50,,,,,,,,,,,,
PC5764WH,5764-WH,,Study for the Porta Pia Wall Hanging,193.50,,,,193.50,,,,,,,,,,,,
PC6049WH,6049-WH,,La Belle Dame Sans II Wall Hanging - Small,49.50,,,,49.50,,,,,,,,,,,,
PC6071WH,6071-WH,,Gypsy Robe Wall Hanging,81.00,,,,81.00,,,,,,,,,,,,
PC6399P,6399-P,,Fetishes Pillow,12.60,,,,12.60,,,,,,,,,,,,
PC6460WH,6460-WH,,The Blue Boat Wall Tapestry,72.00,,,,72.00,,,,,,,,,,,,
PC6734WHROD9A,6734-WH,,In the Blue Wood I Tapestry Wall Hanging,72.00,,,,72.00,,,,,,,,,,,,
PC7101T,7101-T,,Desert Rain Blanket,23.40,,,,23.40,,,,,,,,,,,,
PC3036WH,3036-WH,,Afternoon Light in Tuscany Wall Hanging,72.00,,,,72.00,,,,,,,,,,,,
PC3343P,3343-P,,Geese Lodge Pillow,12.60,,,,12.60,,,,,,,,,,,,
PC3636T,3636-T,PC3636T,Southwest Stripe Blanket,22.50,,,,22.50,,,,,,,,,,,,
PC3638P,3638-P,,Southwest Ancient Ones Pillow,12.60,,,,12.60,,,,,,,,,,,,
PC3750WH,3750-WH,,Country Treasures Wall Tapestry,22.50,,,,22.50,,,,,,,,,,,,
PC3868T,3868-T,,Southwest Geometric Flame Blanket,22.50,,,,22.50,,,,,,,,,,,,
PC3884T,3884-T,,Tlalocs Tribe Blanket,22.50,,,,22.50,,,,,,,,,,,,
PC3984WH,3984-WH,,Dancing in the Wind Wall Hanging,81.00,,,,81.00,,,,,,,,,,,,
PC3998WH,3998-WH,,Terrace Tulips Wall Hanging,63.00,,,,63.00,,,,,,,,,,,,
PC4144WH,4144-WH,,Mount Ventoux Wall Hanging,117.00,,,,117.00,,,,,,,,,,,,
PC4198T,4198-T,,Koko Quartet II Blanket,22.50,,,,22.50,,,,,,,,,,,,
PC1567WH,1567-WH,,Mediterranean Gold Wall Tapestry,81.00,,,,81.00,,,,,,,,,,,,
PC204A,204-A,,Nautical Fish Blanket,23.40,,,,23.40,,,,,,,,,,,,
PC2215WH,2215-WH,,Plentitude de Charme et de Reve Wall Hanging - Large,130.50,,,,130.50,,,,,,,,,,,,
PC2232WH,2232-WH,,Balcony de la Flora Wall Hanging,76.50,,,,76.50,,,,,,,,,,,,
PC2242WH,2242-WH,,The Veranda Wall Hanging - Small,76.50,,,,76.50,,,,,,,,,,,,
PC2458WH,2458-WH,,Before The Rain Wall Tapestry,72.00,,,,72.00,,,,,,,,,,,,
PC2906WH,2906-WH,,Playing at the Seashore Wall Tapestry,76.50,,,,76.50,,,,,,,,,,,,
PC4423T,4423-T,,Southwest Saddleblanket Natural Throw,22.50,,,,22.50,,,,,,,,,,,,
PC4569WH,4569-WH,,Damask Coffee Black Wall Hanging,63.00,,,,63.00,,,,,,,,,,,,
PC5258WH,5258-WH,,Aviary in a Winter Garden Wall Hanging,72.00,,,,72.00,,,,,,,,,,,,
PC5268WH,5268-WH,,New Enchantment II Wall Hanging,72.00,,,,72.00,,,,,,,,,,,,
PC5271WH,5271-WH,,Bold Bluff Wall Hanging,72.00,,,,72.00,,,,,,,,,,,,
PC5615T,5615-T,,Southwest Sampler Russet Chenille Blanket,31.50,,,,31.50,,,,,,,,,,,,
PC5722WH,5722-WH,,Wrought Iron Damask Wall Hanging,94.50,,,,94.50,,,,,,,,,,,,
PC5806WH,5806-WH,,Palladio Facade II Wall Hanging,72.00,,,,72.00,,,,,,,,,,,,
PC6053WH,6053-WH,,Suzanni Indigo Wall Hanging,81.00,,,,81.00,,,,,,,,,,,,
PC644A,644-A,,Divers Down Flag Blanket,20.70,,,,20.70,,,,,,,,,,,,
PC684T,684-T,,Lighthouses of the Great Lakes Blanket,22.50,,,,22.50,,,,,,,,,,,,
PC6902WHROD9B,6902-WH,,Omphalos Tapestry Wall Hanging,103.50,,,,103.50,,,,,,,,,,,,
PC8113T,8113-T,666576817741,Antelope Ridge Juniper Tapestry Throw,25.20,,28.00,,25.20,,28.00,,,,,,,,,,
PC3198WH,3198-WH,,Gentle Giants Wall Hanging,72.00,,,,72.00,,,,,,,,,,,,
PC3618WH,3618-WH,,White Katabria Kimono Wall Hanging,117.00,,,,117.00,,,,,,,,,,,,
PC3626WH,3626-WH,,Mixed Intervals II Wall Hanging,72.00,,,,72.00,,,,,,,,,,,,
